A1: Orario partenza imbarcazioni | F1: 0.54166666666666663
D2: CLASSIFICA TEMPI COMPENSATI
A3: N° Vel | B3: Arrivo | C3: Tempo reale | D3: Tempo compensato | E3: Posizione Assoluta | F3: Posizione compensato | G3: Posizione classe | H3: nome skipper | I3: Prodiere | J3: ID_classe | K3: YS
A4: 54 | B4: 0.64583333333333337 | C4: =B4-'\Documents and Settings\Utente Predefinito\Documenti\01_al lavoro\temp\[CFC10- Iscrizioni Classifiche e premiazioni v.5.0_1.xls]Arrivo Comp'!$F$1 -> 0.10416666666666674 | D4: =C4*1000/K4 -> 0.11548410938654849 | E4: 2 | F4: 1 | H4: =VLOOKUP(A4,'\Documents and Settings\Utente Predefinito\Documenti\01_al lavoro\temp\[CFC10- Iscrizioni Classifiche e premiazioni v.5.0_1.xls]Iscrizioni'!$A$2:$L$254,7,FALSE) -> Giraldi Marco | I4: =VLOOKUP(A4,'\Documents and Settings\Utente Predefinito\Documenti\01_al lavoro\temp\[CFC10- Iscrizioni Classifiche e premiazioni v.5.0_1.xls]Iscrizioni'!$A$2:$L$254,8,FALSE) -> Giacometti Giovanni | J4: =VLOOKUP(A4,'\Documents and Settings\Utente Predefinito\Documenti\01_al lavoro\temp\[CFC10- Iscrizioni Classifiche e premiazioni v.5.0_1.xls]Iscrizioni'!$A$2:$L$254,3,FALSE) -> 07 - 505 | K4: =VLOOKUP(A4,'\Documents and Settings\Utente Predefinito\Documenti\01_al lavoro\temp\[CFC10- Iscrizioni Classifiche e premiazioni v.5.0_1.xls]Iscrizioni'!$A$2:$L$254,6,FALSE) -> 902
A5: 63 | B5: 0.66111111111111109 | C5: =B5-'\Documents and Settings\Utente Predefinito\Documenti\01_al lavoro\temp\[CFC10- Iscrizioni Classifiche e premiazioni v.5.0_1.xls]Arrivo Comp'!$F$1 -> 0.11944444444444446 | D5: =C5*1000/K5 -> 0.11779531010300243 | E5: 4 | F5: 2 | H5: =VLOOKUP(A5,'\Documents and Settings\Utente Predefinito\Documenti\01_al lavoro\temp\[CFC10- Iscrizioni Classifiche e premiazioni v.5.0_1.xls]Iscrizioni'!$A$2:$L$254,7,FALSE) -> Brighenti Claudio | I5: =VLOOKUP(A5,'\Documents and Settings\Utente Predefinito\Documenti\01_al lavoro\temp\[CFC10- Iscrizioni Classifiche e premiazioni v.5.0_1.xls]Iscrizioni'!$A$2:$L$254,8,FALSE) -> 0 | J5: =VLOOKUP(A5,'\Documents and Settings\Utente Predefinito\Documenti\01_al lavoro\temp\[CFC10- Iscrizioni Classifiche e premiazioni v.5.0_1.xls]Iscrizioni'!$A$2:$L$254,3,FALSE) -> 62 - RS 100 vp | K5: =VLOOKUP(A5,'\Documents and Settings\Utente Predefinito\Documenti\01_al lavoro\temp\[CFC10- Iscrizioni Classifiche e premiazioni v.5.0_1.xls]Iscrizioni'!$A$2:$L$254,6,FALSE) -> 1014
A6: 1 | B6: 0.68135416666666659 | C6: =B6-'\Documents and Settings\Utente Predefinito\Documenti\01_al lavoro\temp\[CFC10- Iscrizioni Classifiche e premiazioni v.5.0_1.xls]Arrivo Comp'!$F$1 -> 0.13968749999999999 | D6: =C6*1000/K6 -> 0.11827900084674002 | E6: 17 | F6: 3 | H6: =VLOOKUP(A6,'\Documents and Settings\Utente Predefinito\Documenti\01_al lavoro\temp\[CFC10- Iscrizioni Classifiche e premiazioni v.5.0_1.xls]Iscrizioni'!$A$2:$L$254,7,FALSE) -> Agostini Andrea | I6: =VLOOKUP(A6,'\Documents and Settings\Utente Predefinito\Documenti\01_al lavoro\temp\[CFC10- Iscrizioni Classifiche e premiazioni v.5.0_1.xls]Iscrizioni'!$A$2:$L$254,8,FALSE) -> Vascellari Alessandra-Zucchetti Giulia | J6: =VLOOKUP(A6,'\Documents and Settings\Utente Predefinito\Documenti\01_al lavoro\temp\[CFC10- Iscrizioni Classifiche e premiazioni v.5.0_1.xls]Iscrizioni'!$A$2:$L$254,3,FALSE) -> 72 - Trident 16 Cna | K6: =VLOOKUP(A6,'\Documents and Settings\Utente Predefinito\Documenti\01_al lavoro\temp\[CFC10- Iscrizioni Classifiche e premiazioni v.5.0_1.xls]Iscrizioni'!$A$2:$L$254,6,FALSE) -> 1181
A7: 22 | B7: 0.67208333333333325 | C7: =B7-'\Documents and Settings\Utente Predefinito\Documenti\01_al lavoro\temp\[CFC10- Iscrizioni Classifiche e premiazioni v.5.0_1.xls]Arrivo Comp'!$F$1 -> 0.13041666666666663 | D7: =C7*1000/K7 -> 0.11845292158643654 | E7: 12 | F7: 4 | H7: =VLOOKUP(A7,'\Documents and Settings\Utente Predefinito\Documenti\01_al lavoro\temp\[CFC10- Iscrizioni Classifiche e premiazioni v.5.0_1.xls]Iscrizioni'!$A$2:$L$254,7,FALSE) -> Vicentini Carlo Alberto | I7: =VLOOKUP(A7,'\Documents and Settings\Utente Predefinito\Documenti\01_al lavoro\temp\[CFC10- Iscrizioni Classifiche e premiazioni v.5.0_1.xls]Iscrizioni'!$A$2:$L$254,8,FALSE) -> 0 | J7: =VLOOKUP(A7,'\Documents and Settings\Utente Predefinito\Documenti\01_al lavoro\temp\[CFC10- Iscrizioni Classifiche e premiazioni v.5.0_1.xls]Iscrizioni'!$A$2:$L$254,3,FALSE) -> 34 - Laser radial | K7: =VLOOKUP(A7,'\Documents and Settings\Utente Predefinito\Documenti\01_al lavoro\temp\[CFC10- Iscrizioni Classifiche e premiazioni v.5.0_1.xls]Iscrizioni'!$A$2:$L$254,6,FALSE) -> 1101
A8: 34 | B8: 0.65718750000000004 | C8: =B8-'\Documents and Settings\Utente Predefinito\Documenti\01_al lavoro\temp\[CFC10- Iscrizioni Classifiche e premiazioni v.5.0_1.xls]Arrivo Comp'!$F$1 -> 0.11552083333333341 | D8: =C8*1000/K8 -> 0.11909364261168391 | E8: 3 | F8: 5 | H8: =VLOOKUP(A8,'\Documents and Settings\Utente Predefinito\Documenti\01_al lavoro\temp\[CFC10- Iscrizioni Classifiche e premiazioni v.5.0_1.xls]Iscrizioni'!$A$2:$L$254,7,FALSE) -> Corica Eleonora | I8: =VLOOKUP(A8,'\Documents and Settings\Utente Predefinito\Documenti\01_al lavoro\temp\[CFC10- Iscrizioni Classifiche e premiazioni v.5.0_1.xls]Iscrizioni'!$A$2:$L$254,8,FALSE) -> Guagliardo Jacopo | J8: =VLOOKUP(A8,'\Documents and Settings\Utente Predefinito\Documenti\01_al lavoro\temp\[CFC10- Iscrizioni Classifiche e premiazioni v.5.0_1.xls]Iscrizioni'!$A$2:$L$254,3,FALSE) -> 60 - RS 500 | K8: =VLOOKUP(A8,'\Documents and Settings\Utente Predefinito\Documenti\01_al lavoro\temp\[CFC10- Iscrizioni Classifiche e premiazioni v.5.0_1.xls]Iscrizioni'!$A$2:$L$254,6,FALSE) -> 970
A9: 35 | B9: 0.66293981481481479 | C9: =B9-'\Documents and Settings\Utente Predefinito\Documenti\01_al lavoro\temp\[CFC10- Iscrizioni Classifiche e premiazioni v.5.0_1.xls]Arrivo Comp'!$F$1 -> 0.12127314814814816 | D9: =C9*1000/K9 -> 0.12066979915238622 | E9: 7 | F9: 6 | H9: =VLOOKUP(A9,'\Documents and Settings\Utente Predefinito\Documenti\01_al lavoro\temp\[CFC10- Iscrizioni Classifiche e premiazioni v.5.0_1.xls]Iscrizioni'!$A$2:$L$254,7,FALSE) -> Monciardini Paolo | I9: =VLOOKUP(A9,'\Documents and Settings\Utente Predefinito\Documenti\01_al lavoro\temp\[CFC10- Iscrizioni Classifiche e premiazioni v.5.0_1.xls]Iscrizioni'!$A$2:$L$254,8,FALSE) -> Carugati Davide | J9: =VLOOKUP(A9,'\Documents and Settings\Utente Predefinito\Documenti\01_al lavoro\temp\[CFC10- Iscrizioni Classifiche e premiazioni v.5.0_1.xls]Iscrizioni'!$A$2:$L$254,3,FALSE) -> 10 - Buzz | K9: =VLOOKUP(A9,'\Documents and Settings\Utente Predefinito\Documenti\01_al lavoro\temp\[CFC10- Iscrizioni Classifiche e premiazioni v.5.0_1.xls]Iscrizioni'!$A$2:$L$254,6,FALSE) -> 1005
A10: 62 | B10: 0.68482638888888892 | C10: =B10-'\Documents and Settings\Utente Predefinito\Documenti\01_al lavoro\temp\[CFC10- Iscrizioni Classifiche e premiazioni v.5.0_1.xls]Arrivo Comp'!$F$1 -> 0.14315972222222229 | D10: =C10*1000/K10 -> 0.12121907046758873 | E10: 22 | F10: 7 | H10: =VLOOKUP(A10,'\Documents and Settings\Utente Predefinito\Documenti\01_al lavoro\temp\[CFC10- Iscrizioni Classifiche e premiazioni v.5.0_1.xls]Iscrizioni'!$A$2:$L$254,7,FALSE) -> Luzi Giacomo | I10: =VLOOKUP(A10,'\Documents and Settings\Utente Predefinito\Documenti\01_al lavoro\temp\[CFC10- Iscrizioni Classifiche e premiazioni v.5.0_1.xls]Iscrizioni'!$A$2:$L$254,8,FALSE) -> Dede Enea-Bonfanti Alessandro | J10: =VLOOKUP(A10,'\Documents and Settings\Utente Predefinito\Documenti\01_al lavoro\temp\[CFC10- Iscrizioni Classifiche e premiazioni v.5.0_1.xls]Iscrizioni'!$A$2:$L$254,3,FALSE) -> 72 - Trident 16 Cna | K10: =VLOOKUP(A10,'\Documents and Settings\Utente Predefinito\Documenti\01_al lavoro\temp\[CFC10- Iscrizioni Classifiche e premiazioni v.5.0_1.xls]Iscrizioni'!$A$2:$L$254,6,FALSE) -> 1181
A11: 26 | B11: 0.68585648148148148 | C11: =B11-'\Documents and Settings\Utente Predefinito\Documenti\01_al lavoro\temp\[CFC10- Iscrizioni Classifiche e premiazioni v.5.0_1.xls]Arrivo Comp'!$F$1 -> 0.14418981481481485 | D11: =C11*1000/K11 -> 0.1220912911217738 | E11: 24 | F11: 8 | H11: =VLOOKUP(A11,'\Documents and Settings\Utente Predefinito\Documenti\01_al lavoro\temp\[CFC10- Iscrizioni Classifiche e premiazioni v.5.0_1.xls]Iscrizioni'!$A$2:$L$254,7,FALSE) -> Bignotti Camilla | I11: =VLOOKUP(A11,'\Documents and Settings\Utente Predefinito\Documenti\01_al lavoro\temp\[CFC10- Iscrizioni Classifiche e premiazioni v.5.0_1.xls]Iscrizioni'!$A$2:$L$254,8,FALSE) -> Ferremi Federica-Coppola Camilla_Massarotti Caterina | J11: =VLOOKUP(A11,'\Documents and Settings\Utente Predefinito\Documenti\01_al lavoro\temp\[CFC10- Iscrizioni Classifiche e premiazioni v.5.0_1.xls]Iscrizioni'!$A$2:$L$254,3,FALSE) -> 72 - Trident 16 Cna | K11: =VLOOKUP(A11,'\Documents and Settings\Utente Predefinito\Documenti\01_al lavoro\temp\[CFC10- Iscrizioni Classifiche e premiazioni v.5.0_1.xls]Iscrizioni'!$A$2:$L$254,6,FALSE) -> 1181
A12: 60 | B12: 0.67527777777777775 | C12: =B12-'\Documents and Settings\Utente Predefinito\Documenti\01_al lavoro\temp\[CFC10- Iscrizioni Classifiche e premiazioni v.5.0_1.xls]Arrivo Comp'!$F$1 -> 0.13361111111111112 | D12: =C12*1000/K12 -> 0.12394351680065967 | E12: 13 | F12: 9 | H12: =VLOOKUP(A12,'\Documents and Settings\Utente Predefinito\Documenti\01_al lavoro\temp\[CFC10- Iscrizioni Classifiche e premiazioni v.5.0_1.xls]Iscrizioni'!$A$2:$L$254,7,FALSE) -> Perlini Carlo | I12: =VLOOKUP(A12,'\Documents and Settings\Utente Predefinito\Documenti\01_al lavoro\temp\[CFC10- Iscrizioni Classifiche e premiazioni v.5.0_1.xls]Iscrizioni'!$A$2:$L$254,8,FALSE) -> 0 | J12: =VLOOKUP(A12,'\Documents and Settings\Utente Predefinito\Documenti\01_al lavoro\temp\[CFC10- Iscrizioni Classifiche e premiazioni v.5.0_1.xls]Iscrizioni'!$A$2:$L$254,3,FALSE) -> 33 - Laser STD | K12: =VLOOKUP(A12,'\Documents and Settings\Utente Predefinito\Documenti\01_al lavoro\temp\[CFC10- Iscrizioni Classifiche e premiazioni v.5.0_1.xls]Iscrizioni'!$A$2:$L$254,6,FALSE) -> 1078
A13: 50 | B13: 0.66229166666666661 | C13: =B13-'\Documents and Settings\Utente Predefinito\Documenti\01_al lavoro\temp\[CFC10- Iscrizioni Classifiche e premiazioni v.5.0_1.xls]Arrivo Comp'!$F$1 -> 0.120625 | D13: =C13*1000/K13 -> 0.12397225077081191 | E13: 6 | F13: 10 | H13: =VLOOKUP(A13,'\Documents and Settings\Utente Predefinito\Documenti\01_al lavoro\temp\[CFC10- Iscrizioni Classifiche e premiazioni v.5.0_1.xls]Iscrizioni'!$A$2:$L$254,7,FALSE) -> Benetti Giancarlo | I13: =VLOOKUP(A13,'\Documents and Settings\Utente Predefinito\Documenti\01_al lavoro\temp\[CFC10- Iscrizioni Classifiche e premiazioni v.5.0_1.xls]Iscrizioni'!$A$2:$L$254,8,FALSE) -> Pasini Andrea | J13: =VLOOKUP(A13,'\Documents and Settings\Utente Predefinito\Documenti\01_al lavoro\temp\[CFC10- Iscrizioni Classifiche e premiazioni v.5.0_1.xls]Iscrizioni'!$A$2:$L$254,3,FALSE) -> 06 - 470 | K13: =VLOOKUP(A13,'\Documents and Settings\Utente Predefinito\Documenti\01_al lavoro\temp\[CFC10- Iscrizioni Classifiche e premiazioni v.5.0_1.xls]Iscrizioni'!$A$2:$L$254,6,FALSE) -> 973
A14: 51 | B14: 0.66324074074074069 | C14: =B14-'\Documents and Settings\Utente Predefinito\Documenti\01_al lavoro\temp\[CFC10- Iscrizioni Classifiche e premiazioni v.5.0_1.xls]Arrivo Comp'!$F$1 -> 0.12157407407407406 | D14: =C14*1000/K14 -> 0.12494766091888393 | E14: 8 | F14: 11 | H14: =VLOOKUP(A14,'\Documents and Settings\Utente Predefinito\Documenti\01_al lavoro\temp\[CFC10- Iscrizioni Classifiche e premiazioni v.5.0_1.xls]Iscrizioni'!$A$2:$L$254,7,FALSE) -> Fellin Guido | I14: =VLOOKUP(A14,'\Documents and Settings\Utente Predefinito\Documenti\01_al lavoro\temp\[CFC10- Iscrizioni Classifiche e premiazioni v.5.0_1.xls]Iscrizioni'!$A$2:$L$254,8,FALSE) -> Antonioli Antonio | J14: =VLOOKUP(A14,'\Documents and Settings\Utente Predefinito\Documenti\01_al lavoro\temp\[CFC10- Iscrizioni Classifiche e premiazioni v.5.0_1.xls]Iscrizioni'!$A$2:$L$254,3,FALSE) -> 06 - 470 | K14: =VLOOKUP(A14,'\Documents and Settings\Utente Predefinito\Documenti\01_al lavoro\temp\[CFC10- Iscrizioni Classifiche e premiazioni v.5.0_1.xls]Iscrizioni'!$A$2:$L$254,6,FALSE) -> 973
A15: 61 | B15: 0.6793865740740741 | C15: =B15-'\Documents and Settings\Utente Predefinito\Documenti\01_al lavoro\temp\[CFC10- Iscrizioni Classifiche e premiazioni v.5.0_1.xls]Arrivo Comp'!$F$1 -> 0.13771990740740747 | D15: =C15*1000/K15 -> 0.1250862010966462 | E15: 16 | F15: 12 | H15: =VLOOKUP(A15,'\Documents and Settings\Utente Predefinito\Documenti\01_al lavoro\temp\[CFC10- Iscrizioni Classifiche e premiazioni v.5.0_1.xls]Iscrizioni'!$A$2:$L$254,7,FALSE) -> Silvestrelli Tazio | I15: =VLOOKUP(A15,'\Documents and Settings\Utente Predefinito\Documenti\01_al lavoro\temp\[CFC10- Iscrizioni Classifiche e premiazioni v.5.0_1.xls]Iscrizioni'!$A$2:$L$254,8,FALSE) -> 0 | J15: =VLOOKUP(A15,'\Documents and Settings\Utente Predefinito\Documenti\01_al lavoro\temp\[CFC10- Iscrizioni Classifiche e premiazioni v.5.0_1.xls]Iscrizioni'!$A$2:$L$254,3,FALSE) -> 34 - Laser radial | K15: =VLOOKUP(A15,'\Documents and Settings\Utente Predefinito\Documenti\01_al lavoro\temp\[CFC10- Iscrizioni Classifiche e premiazioni v.5.0_1.xls]Iscrizioni'!$A$2:$L$254,6,FALSE) -> 1101
A16: 52 | B16: 0.66344907407407405 | C16: =B16-'\Documents and Settings\Utente Predefinito\Documenti\01_al lavoro\temp\[CFC10- Iscrizioni Classifiche e premiazioni v.5.0_1.xls]Arrivo Comp'!$F$1 -> 0.12178240740740742 | D16: =C16*1000/K16 -> 0.12516177534163148 | E16: 9 | F16: 13 | H16: =VLOOKUP(A16,'\Documents and Settings\Utente Predefinito\Documenti\01_al lavoro\temp\[CFC10- Iscrizioni Classifiche e premiazioni v.5.0_1.xls]Iscrizioni'!$A$2:$L$254,7,FALSE) -> Schulian Werner | I16: =VLOOKUP(A16,'\Documents and Settings\Utente Predefinito\Documenti\01_al lavoro\temp\[CFC10- Iscrizioni Classifiche e premiazioni v.5.0_1.xls]Iscrizioni'!$A$2:$L$254,8,FALSE) -> Egger Arnold | J16: =VLOOKUP(A16,'\Documents and Settings\Utente Predefinito\Documenti\01_al lavoro\temp\[CFC10- Iscrizioni Classifiche e premiazioni v.5.0_1.xls]Iscrizioni'!$A$2:$L$254,3,FALSE) -> 06 - 470 | K16: =VLOOKUP(A16,'\Documents and Settings\Utente Predefinito\Documenti\01_al lavoro\temp\[CFC10- Iscrizioni Classifiche e premiazioni v.5.0_1.xls]Iscrizioni'!$A$2:$L$254,6,FALSE) -> 973
A17: 5 | B17: 0.64449074074074075 | C17: =B17-'\Documents and Settings\Utente Predefinito\Documenti\01_al lavoro\temp\[CFC10- Iscrizioni Classifiche e premiazioni v.5.0_1.xls]Arrivo Comp'!$F$1 -> 0.10282407407407412 | D17: =C17*1000/K17 -> 0.12539521228545625 | E17: 1 | F17: 14 | H17: =VLOOKUP(A17,'\Documents and Settings\Utente Predefinito\Documenti\01_al lavoro\temp\[CFC10- Iscrizioni Classifiche e premiazioni v.5.0_1.xls]Iscrizioni'!$A$2:$L$254,7,FALSE) -> Bonezzi Luca | I17: =VLOOKUP(A17,'\Documents and Settings\Utente Predefinito\Documenti\01_al lavoro\temp\[CFC10- Iscrizioni Classifiche e premiazioni v.5.0_1.xls]Iscrizioni'!$A$2:$L$254,8,FALSE) -> 0 | J17: =VLOOKUP(A17,'\Documents and Settings\Utente Predefinito\Documenti\01_al lavoro\temp\[CFC10- Iscrizioni Classifiche e premiazioni v.5.0_1.xls]Iscrizioni'!$A$2:$L$254,3,FALSE) -> 86 - Contender CS | K17: =VLOOKUP(A17,'\Documents and Settings\Utente Predefinito\Documenti\01_al lavoro\temp\[CFC10- Iscrizioni Classifiche e premiazioni v.5.0_1.xls]Iscrizioni'!$A$2:$L$254,6,FALSE) -> 820
A18: 39 | B18: 0.68256944444444445 | C18: =B18-'\Documents and Settings\Utente Predefinito\Documenti\01_al lavoro\temp\[CFC10- Iscrizioni Classifiche e premiazioni v.5.0_1.xls]Arrivo Comp'!$F$1 -> 0.14090277777777782 | D18: =C18*1000/K18 -> 0.12603110713575835 | E18: 18 | F18: 15 | H18: =VLOOKUP(A18,'\Documents and Settings\Utente Predefinito\Documenti\01_al lavoro\temp\[CFC10- Iscrizioni Classifiche e premiazioni v.5.0_1.xls]Iscrizioni'!$A$2:$L$254,7,FALSE) -> Zabrzewska Magdalena | I18: =VLOOKUP(A18,'\Documents and Settings\Utente Predefinito\Documenti\01_al lavoro\temp\[CFC10- Iscrizioni Classifiche e premiazioni v.5.0_1.xls]Iscrizioni'!$A$2:$L$254,8,FALSE) -> Corebellari Gianluigi | J18: =VLOOKUP(A18,'\Documents and Settings\Utente Predefinito\Documenti\01_al lavoro\temp\[CFC10- Iscrizioni Classifiche e premiazioni v.5.0_1.xls]Iscrizioni'!$A$2:$L$254,3,FALSE) -> 22 - FJ | K18: =VLOOKUP(A18,'\Documents and Settings\Utente Predefinito\Documenti\01_al lavoro\temp\[CFC10- Iscrizioni Classifiche e premiazioni v.5.0_1.xls]Iscrizioni'!$A$2:$L$254,6,FALSE) -> 1118
A19: 49 | B19: 0.66461805555555553 | C19: =B19-'\Documents and Settings\Utente Predefinito\Documenti\01_al lavoro\temp\[CFC10- Iscrizioni Classifiche e premiazioni v.5.0_1.xls]Arrivo Comp'!$F$1 -> 0.1229513888888889 | D19: =C19*1000/K19 -> 0.12636319515815919 | E19: 10 | F19: 16 | H19: =VLOOKUP(A19,'\Documents and Settings\Utente Predefinito\Documenti\01_al lavoro\temp\[CFC10- Iscrizioni Classifiche e premiazioni v.5.0_1.xls]Iscrizioni'!$A$2:$L$254,7,FALSE) -> Maffeis Massimo | I19: =VLOOKUP(A19,'\Documents and Settings\Utente Predefinito\Documenti\01_al lavoro\temp\[CFC10- Iscrizioni Classifiche e premiazioni v.5.0_1.xls]Iscrizioni'!$A$2:$L$254,8,FALSE) -> Cima Iris | J19: =VLOOKUP(A19,'\Documents and Settings\Utente Predefinito\Documenti\01_al lavoro\temp\[CFC10- Iscrizioni Classifiche e premiazioni v.5.0_1.xls]Iscrizioni'!$A$2:$L$254,3,FALSE) -> 06 - 470 | K19: =VLOOKUP(A19,'\Documents and Settings\Utente Predefinito\Documenti\01_al lavoro\temp\[CFC10- Iscrizioni Classifiche e premiazioni v.5.0_1.xls]Iscrizioni'!$A$2:$L$254,6,FALSE) -> 973
A20: 45 | B20: 0.6832407407407407 | C20: =B20-'\Documents and Settings\Utente Predefinito\Documenti\01_al lavoro\temp\[CFC10- Iscrizioni Classifiche e premiazioni v.5.0_1.xls]Arrivo Comp'!$F$1 -> 0.14157407407407407 | D20: =C20*1000/K20 -> 0.12663155105015569 | E20: 20 | F20: 17 | H20: =VLOOKUP(A20,'\Documents and Settings\Utente Predefinito\Documenti\01_al lavoro\temp\[CFC10- Iscrizioni Classifiche e premiazioni v.5.0_1.xls]Iscrizioni'!$A$2:$L$254,7,FALSE) -> Berardo Filippo | I20: =VLOOKUP(A20,'\Documents and Settings\Utente Predefinito\Documenti\01_al lavoro\temp\[CFC10- Iscrizioni Classifiche e premiazioni v.5.0_1.xls]Iscrizioni'!$A$2:$L$254,8,FALSE) -> Quartini Alfredo | J20: =VLOOKUP(A20,'\Documents and Settings\Utente Predefinito\Documenti\01_al lavoro\temp\[CFC10- Iscrizioni Classifiche e premiazioni v.5.0_1.xls]Iscrizioni'!$A$2:$L$254,3,FALSE) -> 22 - FJ | K20: =VLOOKUP(A20,'\Documents and Settings\Utente Predefinito\Documenti\01_al lavoro\temp\[CFC10- Iscrizioni Classifiche e premiazioni v.5.0_1.xls]Iscrizioni'!$A$2:$L$254,6,FALSE) -> 1118
A21: 47 | B21: 0.68358796296296298 | C21: =B21-'\Documents and Settings\Utente Predefinito\Documenti\01_al lavoro\temp\[CFC10- Iscrizioni Classifiche e premiazioni v.5.0_1.xls]Arrivo Comp'!$F$1 -> 0.14192129629629635 | D21: =C21*1000/K21 -> 0.12694212548863718 | E21: 39 | F21: 18 | H21: =VLOOKUP(A21,'\Documents and Settings\Utente Predefinito\Documenti\01_al lavoro\temp\[CFC10- Iscrizioni Classifiche e premiazioni v.5.0_1.xls]Iscrizioni'!$A$2:$L$254,7,FALSE) -> Veroni Giuseppe | I21: =VLOOKUP(A21,'\Documents and Settings\Utente Predefinito\Documenti\01_al lavoro\temp\[CFC10- Iscrizioni Classifiche e premiazioni v.5.0_1.xls]Iscrizioni'!$A$2:$L$254,8,FALSE) -> Tosi Giulia | J21: =VLOOKUP(A21,'\Documents and Settings\Utente Predefinito\Documenti\01_al lavoro\temp\[CFC10- Iscrizioni Classifiche e premiazioni v.5.0_1.xls]Iscrizioni'!$A$2:$L$254,3,FALSE) -> 22 - FJ | K21: =VLOOKUP(A21,'\Documents and Settings\Utente Predefinito\Documenti\01_al lavoro\temp\[CFC10- Iscrizioni Classifiche e premiazioni v.5.0_1.xls]Iscrizioni'!$A$2:$L$254,6,FALSE) -> 1118
A22: 10 | B22: 0.69239583333333332 | C22: =B22-'\Documents and Settings\Utente Predefinito\Documenti\01_al lavoro\temp\[CFC10- Iscrizioni Classifiche e premiazioni v.5.0_1.xls]Arrivo Comp'!$F$1 -> 0.15072916666666669 | D22: =C22*1000/K22 -> 0.12773658192090398 | E22: 30 | F22: 19 | H22: =VLOOKUP(A22,'\Documents and Settings\Utente Predefinito\Documenti\01_al lavoro\temp\[CFC10- Iscrizioni Classifiche e premiazioni v.5.0_1.xls]Iscrizioni'!$A$2:$L$254,7,FALSE) -> Tovazzi Andrea | I22: =VLOOKUP(A22,'\Documents and Settings\Utente Predefinito\Documenti\01_al lavoro\temp\[CFC10- Iscrizioni Classifiche e premiazioni v.5.0_1.xls]Iscrizioni'!$A$2:$L$254,8,FALSE) -> Lo Manto Caterina | J22: =VLOOKUP(A22,'\Documents and Settings\Utente Predefinito\Documenti\01_al lavoro\temp\[CFC10- Iscrizioni Classifiche e premiazioni v.5.0_1.xls]Iscrizioni'!$A$2:$L$254,3,FALSE) -> 12 - Caravelle | K22: =VLOOKUP(A22,'\Documents and Settings\Utente Predefinito\Documenti\01_al lavoro\temp\[CFC10- Iscrizioni Classifiche e premiazioni v.5.0_1.xls]Iscrizioni'!$A$2:$L$254,6,FALSE) -> 1180
A23: 40 | B23: 0.70021990740740747 | C23: =B23-'\Documents and Settings\Utente Predefinito\Documenti\01_al lavoro\temp\[CFC10- Iscrizioni Classifiche e premiazioni v.5.0_1.xls]Arrivo Comp'!$F$1 -> 0.15855324074074084 | D23: =C23*1000/K23 -> 0.12786551672640392 | E23: 37 | F23: 20 | H23: =VLOOKUP(A23,'\Documents and Settings\Utente Predefinito\Documenti\01_al lavoro\temp\[CFC10- Iscrizioni Classifiche e premiazioni v.5.0_1.xls]Iscrizioni'!$A$2:$L$254,7,FALSE) -> Macchi Giudo Pierluigi | I23: =VLOOKUP(A23,'\Documents and Settings\Utente Predefinito\Documenti\01_al lavoro\temp\[CFC10- Iscrizioni Classifiche e premiazioni v.5.0_1.xls]Iscrizioni'!$A$2:$L$254,8,FALSE) -> 0 | J23: =VLOOKUP(A23,'\Documents and Settings\Utente Predefinito\Documenti\01_al lavoro\temp\[CFC10- Iscrizioni Classifiche e premiazioni v.5.0_1.xls]Iscrizioni'!$A$2:$L$254,3,FALSE) -> 74 - Topaz Uno race plus | K23: =VLOOKUP(A23,'\Documents and Settings\Utente Predefinito\Documenti\01_al lavoro\temp\[CFC10- Iscrizioni Classifiche e premiazioni v.5.0_1.xls]Iscrizioni'!$A$2:$L$254,6,FALSE) -> 1240
A24: 38 | B24: 0.68475694444444446 | C24: =B24-'\Documents and Settings\Utente Predefinito\Documenti\01_al lavoro\temp\[CFC10- Iscrizioni Classifiche e premiazioni v.5.0_1.xls]Arrivo Comp'!$F$1 -> 0.14309027777777783 | D24: =C24*1000/K24 -> 0.12798772609819126 | E24: 21 | F24: 21 | H24: =VLOOKUP(A24,'\Documents and Settings\Utente Predefinito\Documenti\01_al lavoro\temp\[CFC10- Iscrizioni Classifiche e premiazioni v.5.0_1.xls]Iscrizioni'!$A$2:$L$254,7,FALSE) -> Uras Claudio | I24: =VLOOKUP(A24,'\Documents and Settings\Utente Predefinito\Documenti\01_al lavoro\temp\[CFC10- Iscrizioni Classifiche e premiazioni v.5.0_1.xls]Iscrizioni'!$A$2:$L$254,8,FALSE) -> Residori Alessandra | J24: =VLOOKUP(A24,'\Documents and Settings\Utente Predefinito\Documenti\01_al lavoro\temp\[CFC10- Iscrizioni Classifiche e premiazioni v.5.0_1.xls]Iscrizioni'!$A$2:$L$254,3,FALSE) -> 22 - FJ | K24: =VLOOKUP(A24,'\Documents and Settings\Utente Predefinito\Documenti\01_al lavoro\temp\[CFC10- Iscrizioni Classifiche e premiazioni v.5.0_1.xls]Iscrizioni'!$A$2:$L$254,6,FALSE) -> 1118
A25: 28 | B25: 0.66150462962962964 | C25: =B25-'\Documents and Settings\Utente Predefinito\Documenti\01_al lavoro\temp\[CFC10- Iscrizioni Classifiche e premiazioni v.5.0_1.xls]Arrivo Comp'!$F$1 -> 0.11983796296296301 | D25: =C25*1000/K25 -> 0.12941464682825379 | E25: 5 | F25: 22 | H25: =VLOOKUP(A25,'\Documents and Settings\Utente Predefinito\Documenti\01_al lavoro\temp\[CFC10- Iscrizioni Classifiche e premiazioni v.5.0_1.xls]Iscrizioni'!$A$2:$L$254,7,FALSE) -> Modena Umberto | I25: =VLOOKUP(A25,'\Documents and Settings\Utente Predefinito\Documenti\01_al lavoro\temp\[CFC10- Iscrizioni Classifiche e premiazioni v.5.0_1.xls]Iscrizioni'!$A$2:$L$254,8,FALSE) -> Menini Andrea | J25: =VLOOKUP(A25,'\Documents and Settings\Utente Predefinito\Documenti\01_al lavoro\temp\[CFC10- Iscrizioni Classifiche e premiazioni v.5.0_1.xls]Iscrizioni'!$A$2:$L$254,3,FALSE) -> 26 - Iso | K25: =VLOOKUP(A25,'\Documents and Settings\Utente Predefinito\Documenti\01_al lavoro\temp\[CFC10- Iscrizioni Classifiche e premiazioni v.5.0_1.xls]Iscrizioni'!$A$2:$L$254,6,FALSE) -> 926
A26: 11 | B26: 0.69468750000000001 | C26: =B26-'\Documents and Settings\Utente Predefinito\Documenti\01_al lavoro\temp\[CFC10- Iscrizioni Classifiche e premiazioni v.5.0_1.xls]Arrivo Comp'!$F$1 -> 0.15302083333333338 | D26: =C26*1000/K26 -> 0.1295688681907988 | E26: 33 | F26: 23 | H26: =VLOOKUP(A26,'\Documents and Settings\Utente Predefinito\Documenti\01_al lavoro\temp\[CFC10- Iscrizioni Classifiche e premiazioni v.5.0_1.xls]Iscrizioni'!$A$2:$L$254,7,FALSE) -> Cavallini Federica | I26: =VLOOKUP(A26,'\Documents and Settings\Utente Predefinito\Documenti\01_al lavoro\temp\[CFC10- Iscrizioni Classifiche e premiazioni v.5.0_1.xls]Iscrizioni'!$A$2:$L$254,8,FALSE) -> Marco D'Alba-Cortiana Paola | J26: =VLOOKUP(A26,'\Documents and Settings\Utente Predefinito\Documenti\01_al lavoro\temp\[CFC10- Iscrizioni Classifiche e premiazioni v.5.0_1.xls]Iscrizioni'!$A$2:$L$254,3,FALSE) -> 72 - Trident 16 Cna | K26: =VLOOKUP(A26,'\Documents and Settings\Utente Predefinito\Documenti\01_al lavoro\temp\[CFC10- Iscrizioni Classifiche e premiazioni v.5.0_1.xls]Iscrizioni'!$A$2:$L$254,6,FALSE) -> 1181
A27: 9 | B27: 0.69581018518518523 | C27: =B27-'\Documents and Settings\Utente Predefinito\Documenti\01_al lavoro\temp\[CFC10- Iscrizioni Classifiche e premiazioni v.5.0_1.xls]Arrivo Comp'!$F$1 -> 0.1541435185185186 | D27: =C27*1000/K27 -> 0.13051949070153987 | E27: 34 | F27: 24 | H27: =VLOOKUP(A27,'\Documents and Settings\Utente Predefinito\Documenti\01_al lavoro\temp\[CFC10- Iscrizioni Classifiche e premiazioni v.5.0_1.xls]Iscrizioni'!$A$2:$L$254,7,FALSE) -> Mutto Accordi Elisabetta | I27: =VLOOKUP(A27,'\Documents and Settings\Utente Predefinito\Documenti\01_al lavoro\temp\[CFC10- Iscrizioni Classifiche e premiazioni v.5.0_1.xls]Iscrizioni'!$A$2:$L$254,8,FALSE) -> Zennaro Nicola-Zuccaro Andrea | J27: =VLOOKUP(A27,'\Documents and Settings\Utente Predefinito\Documenti\01_al lavoro\temp\[CFC10- Iscrizioni Classifiche e premiazioni v.5.0_1.xls]Iscrizioni'!$A$2:$L$254,3,FALSE) -> 72 - Trident 16 Cna | K27: =VLOOKUP(A27,'\Documents and Settings\Utente Predefinito\Documenti\01_al lavoro\temp\[CFC10- Iscrizioni Classifiche e premiazioni v.5.0_1.xls]Iscrizioni'!$A$2:$L$254,6,FALSE) -> 1181
A28: 6 | B28: 0.68260416666666668 | C28: =B28-'\Documents and Settings\Utente Predefinito\Documenti\01_al lavoro\temp\[CFC10- Iscrizioni Classifiche e premiazioni v.5.0_1.xls]Arrivo Comp'!$F$1 -> 0.14093749999999999 | D28: =C28*1000/K28 -> 0.13061862835959226 | E28: 19 | F28: 25 | H28: =VLOOKUP(A28,'\Documents and Settings\Utente Predefinito\Documenti\01_al lavoro\temp\[CFC10- Iscrizioni Classifiche e premiazioni v.5.0_1.xls]Iscrizioni'!$A$2:$L$254,7,FALSE) -> Brighenti Bendetto | I28: =VLOOKUP(A28,'\Documents and Settings\Utente Predefinito\Documenti\01_al lavoro\temp\[CFC10- Iscrizioni Classifiche e premiazioni v.5.0_1.xls]Iscrizioni'!$A$2:$L$254,8,FALSE) -> Brighenti | J28: =VLOOKUP(A28,'\Documents and Settings\Utente Predefinito\Documenti\01_al lavoro\temp\[CFC10- Iscrizioni Classifiche e premiazioni v.5.0_1.xls]Iscrizioni'!$A$2:$L$254,3,FALSE) -> 56 - RS Vision | K28: =VLOOKUP(A28,'\Documents and Settings\Utente Predefinito\Documenti\01_al lavoro\temp\[CFC10- Iscrizioni Classifiche e premiazioni v.5.0_1.xls]Iscrizioni'!$A$2:$L$254,6,FALSE) -> 1079
A29: 58 | B29: 0.68571759259259257 | C29: =B29-'\Documents and Settings\Utente Predefinito\Documenti\01_al lavoro\temp\[CFC10- Iscrizioni Classifiche e premiazioni v.5.0_1.xls]Arrivo Comp'!$F$1 -> 0.14405092592592594 | D29: =C29*1000/K29 -> 0.13083644498267571 | E29: 23 | F29: 26 | H29: =VLOOKUP(A29,'\Documents and Settings\Utente Predefinito\Documenti\01_al lavoro\temp\[CFC10- Iscrizioni Classifiche e premiazioni v.5.0_1.xls]Iscrizioni'!$A$2:$L$254,7,FALSE) -> Cassini Marcello | I29: =VLOOKUP(A29,'\Documents and Settings\Utente Predefinito\Documenti\01_al lavoro\temp\[CFC10- Iscrizioni Classifiche e premiazioni v.5.0_1.xls]Iscrizioni'!$A$2:$L$254,8,FALSE) -> 0 | J29: =VLOOKUP(A29,'\Documents and Settings\Utente Predefinito\Documenti\01_al lavoro\temp\[CFC10- Iscrizioni Classifiche e premiazioni v.5.0_1.xls]Iscrizioni'!$A$2:$L$254,3,FALSE) -> 34 - Laser radial | K29: =VLOOKUP(A29,'\Documents and Settings\Utente Predefinito\Documenti\01_al lavoro\temp\[CFC10- Iscrizioni Classifiche e premiazioni v.5.0_1.xls]Iscrizioni'!$A$2:$L$254,6,FALSE) -> 1101
A30: 36 | B30: 0.70799768518518524 | C30: =B30-'\Documents and Settings\Utente Predefinito\Documenti\01_al lavoro\temp\[CFC10- Iscrizioni Classifiche e premiazioni v.5.0_1.xls]Arrivo Comp'!$F$1 -> 0.16633101851851861 | D30: =C30*1000/K30 -> 0.13086626161960552 | E30: 40 | F30: 27 | H30: =VLOOKUP(A30,'\Documents and Settings\Utente Predefinito\Documenti\01_al lavoro\temp\[CFC10- Iscrizioni Classifiche e premiazioni v.5.0_1.xls]Iscrizioni'!$A$2:$L$254,7,FALSE) -> Pallavidini Riccardo | I30: =VLOOKUP(A30,'\Documents and Settings\Utente Predefinito\Documenti\01_al lavoro\temp\[CFC10- Iscrizioni Classifiche e premiazioni v.5.0_1.xls]Iscrizioni'!$A$2:$L$254,8,FALSE) -> 0 | J30: =VLOOKUP(A30,'\Documents and Settings\Utente Predefinito\Documenti\01_al lavoro\temp\[CFC10- Iscrizioni Classifiche e premiazioni v.5.0_1.xls]Iscrizioni'!$A$2:$L$254,3,FALSE) -> 16 - Dinghy '12 vtr | K30: =VLOOKUP(A30,'\Documents and Settings\Utente Predefinito\Documenti\01_al lavoro\temp\[CFC10- Iscrizioni Classifiche e premiazioni v.5.0_1.xls]Iscrizioni'!$A$2:$L$254,6,FALSE) -> 1271
A31: 46 | B31: 0.68883101851851858 | C31: =B31-'\Documents and Settings\Utente Predefinito\Documenti\01_al lavoro\temp\[CFC10- Iscrizioni Classifiche e premiazioni v.5.0_1.xls]Arrivo Ass'!$F$1 -> 0.14716435185185195 | D31: =C31*1000/K31 -> 0.13163179950970658 | E31: 27 | F31: 28 | H31: =VLOOKUP(A31,'\Documents and Settings\Utente Predefinito\Documenti\01_al lavoro\temp\[CFC10- Iscrizioni Classifiche e premiazioni v.5.0_1.xls]Iscrizioni'!$A$2:$L$254,7,FALSE) -> Cominotti Riccardo | I31: =VLOOKUP(A31,'\Documents and Settings\Utente Predefinito\Documenti\01_al lavoro\temp\[CFC10- Iscrizioni Classifiche e premiazioni v.5.0_1.xls]Iscrizioni'!$A$2:$L$254,8,FALSE) -> Cominotti Gianluca | J31: =VLOOKUP(A31,'\Documents and Settings\Utente Predefinito\Documenti\01_al lavoro\temp\[CFC10- Iscrizioni Classifiche e premiazioni v.5.0_1.xls]Iscrizioni'!$A$2:$L$254,3,FALSE) -> 22 - FJ | K31: =VLOOKUP(A31,'\Documents and Settings\Utente Predefinito\Documenti\01_al lavoro\temp\[CFC10- Iscrizioni Classifiche e premiazioni v.5.0_1.xls]Iscrizioni'!$A$2:$L$254,6,FALSE) -> 1118
A32: 14 | B32: 0.697199074074074 | C32: =B32-'\Documents and Settings\Utente Predefinito\Documenti\01_al lavoro\temp\[CFC10- Iscrizioni Classifiche e premiazioni v.5.0_1.xls]Arrivo Comp'!$F$1 -> 0.15553240740740737 | D32: =C32*1000/K32 -> 0.13169551854987921 | E32: 35 | F32: 29 | H32: =VLOOKUP(A32,'\Documents and Settings\Utente Predefinito\Documenti\01_al lavoro\temp\[CFC10- Iscrizioni Classifiche e premiazioni v.5.0_1.xls]Iscrizioni'!$A$2:$L$254,7,FALSE) -> Marcato Alessio | I32: =VLOOKUP(A32,'\Documents and Settings\Utente Predefinito\Documenti\01_al lavoro\temp\[CFC10- Iscrizioni Classifiche e premiazioni v.5.0_1.xls]Iscrizioni'!$A$2:$L$254,8,FALSE) -> Paolo Pongiluppi-Zilja Kastriot | J32: =VLOOKUP(A32,'\Documents and Settings\Utente Predefinito\Documenti\01_al lavoro\temp\[CFC10- Iscrizioni Classifiche e premiazioni v.5.0_1.xls]Iscrizioni'!$A$2:$L$254,3,FALSE) -> 72 - Trident 16 Cna | K32: =VLOOKUP(A32,'\Documents and Settings\Utente Predefinito\Documenti\01_al lavoro\temp\[CFC10- Iscrizioni Classifiche e premiazioni v.5.0_1.xls]Iscrizioni'!$A$2:$L$254,6,FALSE) -> 1181
A33: 41 | B33: 0.68912037037037033 | C33: =B33-'\Documents and Settings\Utente Predefinito\Documenti\01_al lavoro\temp\[CFC10- Iscrizioni Classifiche e premiazioni v.5.0_1.xls]Arrivo Comp'!$F$1 -> 0.1474537037037037 | D33: =C33*1000/K33 -> 0.13189061154177434 | E33: 28 | F33: 30 | H33: =VLOOKUP(A33,'\Documents and Settings\Utente Predefinito\Documenti\01_al lavoro\temp\[CFC10- Iscrizioni Classifiche e premiazioni v.5.0_1.xls]Iscrizioni'!$A$2:$L$254,7,FALSE) -> Cambi Enzo | I33: =VLOOKUP(A33,'\Documents and Settings\Utente Predefinito\Documenti\01_al lavoro\temp\[CFC10- Iscrizioni Classifiche e premiazioni v.5.0_1.xls]Iscrizioni'!$A$2:$L$254,8,FALSE) -> Olivieri Giuliano | J33: =VLOOKUP(A33,'\Documents and Settings\Utente Predefinito\Documenti\01_al lavoro\temp\[CFC10- Iscrizioni Classifiche e premiazioni v.5.0_1.xls]Iscrizioni'!$A$2:$L$254,3,FALSE) -> 22 - FJ | K33: =VLOOKUP(A33,'\Documents and Settings\Utente Predefinito\Documenti\01_al lavoro\temp\[CFC10- Iscrizioni Classifiche e premiazioni v.5.0_1.xls]Iscrizioni'!$A$2:$L$254,6,FALSE) -> 1118
A34: 37 | B34: 0.70981481481481479 | C34: =B34-'\Documents and Settings\Utente Predefinito\Documenti\01_al lavoro\temp\[CFC10- Iscrizioni Classifiche e premiazioni v.5.0_1.xls]Arrivo Comp'!$F$1 -> 0.16814814814814816 | D34: =C34*1000/K34 -> 0.13229594661538013 | E34: 42 | F34: 31 | H34: =VLOOKUP(A34,'\Documents and Settings\Utente Predefinito\Documenti\01_al lavoro\temp\[CFC10- Iscrizioni Classifiche e premiazioni v.5.0_1.xls]Iscrizioni'!$A$2:$L$254,7,FALSE) -> Baroni Maurizio | I34: =VLOOKUP(A34,'\Documents and Settings\Utente Predefinito\Documenti\01_al lavoro\temp\[CFC10- Iscrizioni Classifiche e premiazioni v.5.0_1.xls]Iscrizioni'!$A$2:$L$254,8,FALSE) -> 0 | J34: =VLOOKUP(A34,'\Documents and Settings\Utente Predefinito\Documenti\01_al lavoro\temp\[CFC10- Iscrizioni Classifiche e premiazioni v.5.0_1.xls]Iscrizioni'!$A$2:$L$254,3,FALSE) -> 16 - Dinghy '12 vtr | K34: =VLOOKUP(A34,'\Documents and Settings\Utente Predefinito\Documenti\01_al lavoro\temp\[CFC10- Iscrizioni Classifiche e premiazioni v.5.0_1.xls]Iscrizioni'!$A$2:$L$254,6,FALSE) -> 1271
A35: 32 | B35: 0.67060185185185184 | C35: =B35-'\Documents and Settings\Utente Predefinito\Documenti\01_al lavoro\temp\[CFC10- Iscrizioni Classifiche e premiazioni v.5.0_1.xls]Arrivo Comp'!$F$1 -> 0.12893518518518521 | D35: =C35*1000/K35 -> 0.13292287132493322 | E35: 11 | F35: 32 | H35: =VLOOKUP(A35,'\Documents and Settings\Utente Predefinito\Documenti\01_al lavoro\temp\[CFC10- Iscrizioni Classifiche e premiazioni v.5.0_1.xls]Iscrizioni'!$A$2:$L$254,7,FALSE) -> Bucciarelli Filippo | I35: =VLOOKUP(A35,'\Documents and Settings\Utente Predefinito\Documenti\01_al lavoro\temp\[CFC10- Iscrizioni Classifiche e premiazioni v.5.0_1.xls]Iscrizioni'!$A$2:$L$254,8,FALSE) -> Sembenotti Daniel | J35: =VLOOKUP(A35,'\Documents and Settings\Utente Predefinito\Documenti\01_al lavoro\temp\[CFC10- Iscrizioni Classifiche e premiazioni v.5.0_1.xls]Iscrizioni'!$A$2:$L$254,3,FALSE) -> 60 - RS 500 | K35: =VLOOKUP(A35,'\Documents and Settings\Utente Predefinito\Documenti\01_al lavoro\temp\[CFC10- Iscrizioni Classifiche e premiazioni v.5.0_1.xls]Iscrizioni'!$A$2:$L$254,6,FALSE) -> 970
A36: 42 | B36: 0.70015046296296291 | C36: =B36-'\Documents and Settings\Utente Predefinito\Documenti\01_al lavoro\temp\[CFC10- Iscrizioni Classifiche e premiazioni v.5.0_1.xls]Arrivo Comp'!$F$1 -> 0.15848379629629628 | D36: =C36*1000/K36 -> 0.13329167056038374 | E36: 36 | F36: 33 | H36: =VLOOKUP(A36,'\Documents and Settings\Utente Predefinito\Documenti\01_al lavoro\temp\[CFC10- Iscrizioni Classifiche e premiazioni v.5.0_1.xls]Iscrizioni'!$A$2:$L$254,7,FALSE) -> Foschini Gabriele | I36: =VLOOKUP(A36,'\Documents and Settings\Utente Predefinito\Documenti\01_al lavoro\temp\[CFC10- Iscrizioni Classifiche e premiazioni v.5.0_1.xls]Iscrizioni'!$A$2:$L$254,8,FALSE) -> Visconti Federico | J36: =VLOOKUP(A36,'\Documents and Settings\Utente Predefinito\Documenti\01_al lavoro\temp\[CFC10- Iscrizioni Classifiche e premiazioni v.5.0_1.xls]Iscrizioni'!$A$2:$L$254,3,FALSE) -> 54 - RS Feva | K36: =VLOOKUP(A36,'\Documents and Settings\Utente Predefinito\Documenti\01_al lavoro\temp\[CFC10- Iscrizioni Classifiche e premiazioni v.5.0_1.xls]Iscrizioni'!$A$2:$L$254,6,FALSE) -> 1189
A37: 2 | B37: 0.68631944444444448 | C37: =B37-'\Documents and Settings\Utente Predefinito\Documenti\01_al lavoro\temp\[CFC10- Iscrizioni Classifiche e premiazioni v.5.0_1.xls]Arrivo Comp'!$F$1 -> 0.14465277777777785 | D37: =C37*1000/K37 -> 0.13406188857996093 | E37: 25 | F37: 34 | H37: =VLOOKUP(A37,'\Documents and Settings\Utente Predefinito\Documenti\01_al lavoro\temp\[CFC10- Iscrizioni Classifiche e premiazioni v.5.0_1.xls]Iscrizioni'!$A$2:$L$254,7,FALSE) -> Guidetti Francesco | I37: =VLOOKUP(A37,'\Documents and Settings\Utente Predefinito\Documenti\01_al lavoro\temp\[CFC10- Iscrizioni Classifiche e premiazioni v.5.0_1.xls]Iscrizioni'!$A$2:$L$254,8,FALSE) -> Riva Andrea | J37: =VLOOKUP(A37,'\Documents and Settings\Utente Predefinito\Documenti\01_al lavoro\temp\[CFC10- Iscrizioni Classifiche e premiazioni v.5.0_1.xls]Iscrizioni'!$A$2:$L$254,3,FALSE) -> 56 - RS Vision | K37: =VLOOKUP(A37,'\Documents and Settings\Utente Predefinito\Documenti\01_al lavoro\temp\[CFC10- Iscrizioni Classifiche e premiazioni v.5.0_1.xls]Iscrizioni'!$A$2:$L$254,6,FALSE) -> 1079
A38: 27 | B38: 0.67895833333333344 | C38: =B38-'\Documents and Settings\Utente Predefinito\Documenti\01_al lavoro\temp\[CFC10- Iscrizioni Classifiche e premiazioni v.5.0_1.xls]Arrivo Comp'!$F$1 -> 0.13729166666666681 | D38: =C38*1000/K38 -> 0.13433626875407711 | E38: 15 | F38: 35 | H38: =VLOOKUP(A38,'\Documents and Settings\Utente Predefinito\Documenti\01_al lavoro\temp\[CFC10- Iscrizioni Classifiche e premiazioni v.5.0_1.xls]Iscrizioni'!$A$2:$L$254,7,FALSE) -> Zanandrea Lucio | I38: =VLOOKUP(A38,'\Documents and Settings\Utente Predefinito\Documenti\01_al lavoro\temp\[CFC10- Iscrizioni Classifiche e premiazioni v.5.0_1.xls]Iscrizioni'!$A$2:$L$254,8,FALSE) -> Zarantonello Fabrizio | J38: =VLOOKUP(A38,'\Documents and Settings\Utente Predefinito\Documenti\01_al lavoro\temp\[CFC10- Iscrizioni Classifiche e premiazioni v.5.0_1.xls]Iscrizioni'!$A$2:$L$254,3,FALSE) -> 67 - Strale | K38: =VLOOKUP(A38,'\Documents and Settings\Utente Predefinito\Documenti\01_al lavoro\temp\[CFC10- Iscrizioni Classifiche e premiazioni v.5.0_1.xls]Iscrizioni'!$A$2:$L$254,6,FALSE) -> 1022
A39: 57 | B39: 0.68980324074074073 | C39: =B39-'\Documents and Settings\Utente Predefinito\Documenti\01_al lavoro\temp\[CFC10- Iscrizioni Classifiche e premiazioni v.5.0_1.xls]Arrivo Comp'!$F$1 -> 0.1481365740740741 | D39: =C39*1000/K39 -> 0.13628019694027058 | E39: 29 | F39: 36 | H39: =VLOOKUP(A39,'\Documents and Settings\Utente Predefinito\Documenti\01_al lavoro\temp\[CFC10- Iscrizioni Classifiche e premiazioni v.5.0_1.xls]Iscrizioni'!$A$2:$L$254,7,FALSE) -> Coppola Vicenzo | I39: =VLOOKUP(A39,'\Documents and Settings\Utente Predefinito\Documenti\01_al lavoro\temp\[CFC10- Iscrizioni Classifiche e premiazioni v.5.0_1.xls]Iscrizioni'!$A$2:$L$254,8,FALSE) -> Pozder Wi | J39: =VLOOKUP(A39,'\Documents and Settings\Utente Predefinito\Documenti\01_al lavoro\temp\[CFC10- Iscrizioni Classifiche e premiazioni v.5.0_1.xls]Iscrizioni'!$A$2:$L$254,3,FALSE) -> 05 - 420 | K39: =VLOOKUP(A39,'\Documents and Settings\Utente Predefinito\Documenti\01_al lavoro\temp\[CFC10- Iscrizioni Classifiche e premiazioni v.5.0_1.xls]Iscrizioni'!$A$2:$L$254,6,FALSE) -> 1087
A40: 59 | B40: 0.69430555555555562 | C40: =B40-'\Documents and Settings\Utente Predefinito\Documenti\01_al lavoro\temp\[CFC10- Iscrizioni Classifiche e premiazioni v.5.0_1.xls]Arrivo Comp'!$F$1 -> 0.15263888888888899 | D40: =C40*1000/K40 -> 0.13863659299626613 | E40: 32 | F40: 37 | H40: =VLOOKUP(A40,'\Documents and Settings\Utente Predefinito\Documenti\01_al lavoro\temp\[CFC10- Iscrizioni Classifiche e premiazioni v.5.0_1.xls]Iscrizioni'!$A$2:$L$254,7,FALSE) -> Signorelli Alberto | I40: =VLOOKUP(A40,'\Documents and Settings\Utente Predefinito\Documenti\01_al lavoro\temp\[CFC10- Iscrizioni Classifiche e premiazioni v.5.0_1.xls]Iscrizioni'!$A$2:$L$254,8,FALSE) -> 0 | J40: =VLOOKUP(A40,'\Documents and Settings\Utente Predefinito\Documenti\01_al lavoro\temp\[CFC10- Iscrizioni Classifiche e premiazioni v.5.0_1.xls]Iscrizioni'!$A$2:$L$254,3,FALSE) -> 34 - Laser radial | K40: =VLOOKUP(A40,'\Documents and Settings\Utente Predefinito\Documenti\01_al lavoro\temp\[CFC10- Iscrizioni Classifiche e premiazioni v.5.0_1.xls]Iscrizioni'!$A$2:$L$254,6,FALSE) -> 1101
A41: 55 | B41: 0.67833333333333334 | C41: =B41-'\Documents and Settings\Utente Predefinito\Documenti\01_al lavoro\temp\[CFC10- Iscrizioni Classifiche e premiazioni v.5.0_1.xls]Arrivo Comp'!$F$1 -> 0.13666666666666671 | D41: =C41*1000/K41 -> 0.13917175831636122 | E41: 14 | F41: 38 | H41: =VLOOKUP(A41,'\Documents and Settings\Utente Predefinito\Documenti\01_al lavoro\temp\[CFC10- Iscrizioni Classifiche e premiazioni v.5.0_1.xls]Iscrizioni'!$A$2:$L$254,7,FALSE) -> Frau Virgilio | I41: =VLOOKUP(A41,'\Documents and Settings\Utente Predefinito\Documenti\01_al lavoro\temp\[CFC10- Iscrizioni Classifiche e premiazioni v.5.0_1.xls]Iscrizioni'!$A$2:$L$254,8,FALSE) -> 0 | J41: =VLOOKUP(A41,'\Documents and Settings\Utente Predefinito\Documenti\01_al lavoro\temp\[CFC10- Iscrizioni Classifiche e premiazioni v.5.0_1.xls]Iscrizioni'!$A$2:$L$254,3,FALSE) -> 21 - Fireball | K41: =VLOOKUP(A41,'\Documents and Settings\Utente Predefinito\Documenti\01_al lavoro\temp\[CFC10- Iscrizioni Classifiche e premiazioni v.5.0_1.xls]Iscrizioni'!$A$2:$L$254,6,FALSE) -> 982
A42: 30 | B42: 0.69289351851851855 | C42: =B42-'\Documents and Settings\Utente Predefinito\Documenti\01_al lavoro\temp\[CFC10- Iscrizioni Classifiche e premiazioni v.5.0_1.xls]Arrivo Comp'!$F$1 -> 0.15122685185185192 | D42: =C42*1000/K42 -> 0.14015463563656338 | E42: 31 | F42: 39 | H42: =VLOOKUP(A42,'\Documents and Settings\Utente Predefinito\Documenti\01_al lavoro\temp\[CFC10- Iscrizioni Classifiche e premiazioni v.5.0_1.xls]Iscrizioni'!$A$2:$L$254,7,FALSE) -> Di Leonardo Carlo | I42: =VLOOKUP(A42,'\Documents and Settings\Utente Predefinito\Documenti\01_al lavoro\temp\[CFC10- Iscrizioni Classifiche e premiazioni v.5.0_1.xls]Iscrizioni'!$A$2:$L$254,8,FALSE) -> Svalduz Piero | J42: =VLOOKUP(A42,'\Documents and Settings\Utente Predefinito\Documenti\01_al lavoro\temp\[CFC10- Iscrizioni Classifiche e premiazioni v.5.0_1.xls]Iscrizioni'!$A$2:$L$254,3,FALSE) -> 56 - RS Vision | K42: =VLOOKUP(A42,'\Documents and Settings\Utente Predefinito\Documenti\01_al lavoro\temp\[CFC10- Iscrizioni Classifiche e premiazioni v.5.0_1.xls]Iscrizioni'!$A$2:$L$254,6,FALSE) -> 1079
A43: 18 | B43: 0.70475694444444448 | C43: =B43-'\Documents and Settings\Utente Predefinito\Documenti\01_al lavoro\temp\[CFC10- Iscrizioni Classifiche e premiazioni v.5.0_1.xls]Arrivo Comp'!$F$1 -> 0.16309027777777785 | D43: =C43*1000/K43 -> 0.14059506704980851 | E43: 38 | F43: 40 | H43: =VLOOKUP(A43,'\Documents and Settings\Utente Predefinito\Documenti\01_al lavoro\temp\[CFC10- Iscrizioni Classifiche e premiazioni v.5.0_1.xls]Iscrizioni'!$A$2:$L$254,7,FALSE) -> Ferrari Davide | I43: =VLOOKUP(A43,'\Documents and Settings\Utente Predefinito\Documenti\01_al lavoro\temp\[CFC10- Iscrizioni Classifiche e premiazioni v.5.0_1.xls]Iscrizioni'!$A$2:$L$254,8,FALSE) -> 0 | J43: =VLOOKUP(A43,'\Documents and Settings\Utente Predefinito\Documenti\01_al lavoro\temp\[CFC10- Iscrizioni Classifiche e premiazioni v.5.0_1.xls]Iscrizioni'!$A$2:$L$254,3,FALSE) -> 08 - Byte | K43: =VLOOKUP(A43,'\Documents and Settings\Utente Predefinito\Documenti\01_al lavoro\temp\[CFC10- Iscrizioni Classifiche e premiazioni v.5.0_1.xls]Iscrizioni'!$A$2:$L$254,6,FALSE) -> 1160
A44: 24 | B44: 0.68784722222222217 | C44: =B44-'\Documents and Settings\Utente Predefinito\Documenti\01_al lavoro\temp\[CFC10- Iscrizioni Classifiche e premiazioni v.5.0_1.xls]Arrivo Comp'!$F$1 -> 0.14618055555555554 | D44: =C44*1000/K44 -> 0.14402025177887245 | E44: 26 | F44: 41 | H44: =VLOOKUP(A44,'\Documents and Settings\Utente Predefinito\Documenti\01_al lavoro\temp\[CFC10- Iscrizioni Classifiche e premiazioni v.5.0_1.xls]Iscrizioni'!$A$2:$L$254,7,FALSE) -> Rigon Carla | I44: =VLOOKUP(A44,'\Documents and Settings\Utente Predefinito\Documenti\01_al lavoro\temp\[CFC10- Iscrizioni Classifiche e premiazioni v.5.0_1.xls]Iscrizioni'!$A$2:$L$254,8,FALSE) -> Salomon Vittorio | J44: =VLOOKUP(A44,'\Documents and Settings\Utente Predefinito\Documenti\01_al lavoro\temp\[CFC10- Iscrizioni Classifiche e premiazioni v.5.0_1.xls]Iscrizioni'!$A$2:$L$254,3,FALSE) -> 39 - Laser Vago | K44: =VLOOKUP(A44,'\Documents and Settings\Utente Predefinito\Documenti\01_al lavoro\temp\[CFC10- Iscrizioni Classifiche e premiazioni v.5.0_1.xls]Iscrizioni'!$A$2:$L$254,6,FALSE) -> 1015
A45: 16 | B45: 0.71410879629629631 | C45: =B45-'\Documents and Settings\Utente Predefinito\Documenti\01_al lavoro\temp\[CFC10- Iscrizioni Classifiche e premiazioni v.5.0_1.xls]Arrivo Comp'!$F$1 -> 0.17244212962962968 | D45: =C45*1000/K45 -> 0.14601365760341209 | E45: 43 | F45: 42 | H45: =VLOOKUP(A45,'\Documents and Settings\Utente Predefinito\Documenti\01_al lavoro\temp\[CFC10- Iscrizioni Classifiche e premiazioni v.5.0_1.xls]Iscrizioni'!$A$2:$L$254,7,FALSE) -> Sambo Luca | I45: =VLOOKUP(A45,'\Documents and Settings\Utente Predefinito\Documenti\01_al lavoro\temp\[CFC10- Iscrizioni Classifiche e premiazioni v.5.0_1.xls]Iscrizioni'!$A$2:$L$254,8,FALSE) -> Basso Emi-Ferraro Roberto | J45: =VLOOKUP(A45,'\Documents and Settings\Utente Predefinito\Documenti\01_al lavoro\temp\[CFC10- Iscrizioni Classifiche e premiazioni v.5.0_1.xls]Iscrizioni'!$A$2:$L$254,3,FALSE) -> 72 - Trident 16 Cna | K45: =VLOOKUP(A45,'\Documents and Settings\Utente Predefinito\Documenti\01_al lavoro\temp\[CFC10- Iscrizioni Classifiche e premiazioni v.5.0_1.xls]Iscrizioni'!$A$2:$L$254,6,FALSE) -> 1181
A46: 43 | B46: 0.71721064814814817 | C46: =B46-'\Documents and Settings\Utente Predefinito\Documenti\01_al lavoro\temp\[CFC10- Iscrizioni Classifiche e premiazioni v.5.0_1.xls]Arrivo Comp'!$F$1 -> 0.17554398148148154 | D46: =C46*1000/K46 -> 0.14764001806684737 | E46: 46 | F46: 43 | H46: =VLOOKUP(A46,'\Documents and Settings\Utente Predefinito\Documenti\01_al lavoro\temp\[CFC10- Iscrizioni Classifiche e premiazioni v.5.0_1.xls]Iscrizioni'!$A$2:$L$254,7,FALSE) -> Coveli Martina | I46: =VLOOKUP(A46,'\Documents and Settings\Utente Predefinito\Documenti\01_al lavoro\temp\[CFC10- Iscrizioni Classifiche e premiazioni v.5.0_1.xls]Iscrizioni'!$A$2:$L$254,8,FALSE) -> Romana Monica | J46: =VLOOKUP(A46,'\Documents and Settings\Utente Predefinito\Documenti\01_al lavoro\temp\[CFC10- Iscrizioni Classifiche e premiazioni v.5.0_1.xls]Iscrizioni'!$A$2:$L$254,3,FALSE) -> 54 - RS Feva | K46: =VLOOKUP(A46,'\Documents and Settings\Utente Predefinito\Documenti\01_al lavoro\temp\[CFC10- Iscrizioni Classifiche e premiazioni v.5.0_1.xls]Iscrizioni'!$A$2:$L$254,6,FALSE) -> 1189
A47: 48 | B47: 0.70964120370370365 | C47: =B47-'\Documents and Settings\Utente Predefinito\Documenti\01_al lavoro\temp\[CFC10- Iscrizioni Classifiche e premiazioni v.5.0_1.xls]Arrivo Comp'!$F$1 -> 0.16797453703703702 | D47: =C47*1000/K47 -> 0.15024556085602594 | E47: 41 | F47: 44 | H47: =VLOOKUP(A47,'\Documents and Settings\Utente Predefinito\Documenti\01_al lavoro\temp\[CFC10- Iscrizioni Classifiche e premiazioni v.5.0_1.xls]Iscrizioni'!$A$2:$L$254,7,FALSE) -> Cocca Secondo | I47: =VLOOKUP(A47,'\Documents and Settings\Utente Predefinito\Documenti\01_al lavoro\temp\[CFC10- Iscrizioni Classifiche e premiazioni v.5.0_1.xls]Iscrizioni'!$A$2:$L$254,8,FALSE) -> Soliman Silvio | J47: =VLOOKUP(A47,'\Documents and Settings\Utente Predefinito\Documenti\01_al lavoro\temp\[CFC10- Iscrizioni Classifiche e premiazioni v.5.0_1.xls]Iscrizioni'!$A$2:$L$254,3,FALSE) -> 22 - FJ | K47: =VLOOKUP(A47,'\Documents and Settings\Utente Predefinito\Documenti\01_al lavoro\temp\[CFC10- Iscrizioni Classifiche e premiazioni v.5.0_1.xls]Iscrizioni'!$A$2:$L$254,6,FALSE) -> 1118
A48: 31 | B48: 0.70599537037037041 | C48: =B48-'\Documents and Settings\Utente Predefinito\Documenti\01_al lavoro\temp\[CFC10- Iscrizioni Classifiche e premiazioni v.5.0_1.xls]Arrivo Comp'!$F$1 -> 0.16432870370370378 | D48: =C48*1000/K48 -> 0.15229722308035568 | E48: 39 | F48: 45 | H48: =VLOOKUP(A48,'\Documents and Settings\Utente Predefinito\Documenti\01_al lavoro\temp\[CFC10- Iscrizioni Classifiche e premiazioni v.5.0_1.xls]Iscrizioni'!$A$2:$L$254,7,FALSE) -> Castelli Elena | I48: =VLOOKUP(A48,'\Documents and Settings\Utente Predefinito\Documenti\01_al lavoro\temp\[CFC10- Iscrizioni Classifiche e premiazioni v.5.0_1.xls]Iscrizioni'!$A$2:$L$254,8,FALSE) -> Zampiva Davide | J48: =VLOOKUP(A48,'\Documents and Settings\Utente Predefinito\Documenti\01_al lavoro\temp\[CFC10- Iscrizioni Classifiche e premiazioni v.5.0_1.xls]Iscrizioni'!$A$2:$L$254,3,FALSE) -> 56 - RS Vision | K48: =VLOOKUP(A48,'\Documents and Settings\Utente Predefinito\Documenti\01_al lavoro\temp\[CFC10- Iscrizioni Classifiche e premiazioni v.5.0_1.xls]Iscrizioni'!$A$2:$L$254,6,FALSE) -> 1079
A49: 19 | B49: 0.71570601851851856 | C49: =B49-'\Documents and Settings\Utente Predefinito\Documenti\01_al lavoro\temp\[CFC10- Iscrizioni Classifiche e premiazioni v.5.0_1.xls]Arrivo Comp'!$F$1 -> 0.17403935185185193 | D49: =C49*1000/K49 -> 0.15567026104816808 | E49: 45 | F49: 46 | H49: =VLOOKUP(A49,'\Documents and Settings\Utente Predefinito\Documenti\01_al lavoro\temp\[CFC10- Iscrizioni Classifiche e premiazioni v.5.0_1.xls]Iscrizioni'!$A$2:$L$254,7,FALSE) -> Cunegato Attilio | I49: =VLOOKUP(A49,'\Documents and Settings\Utente Predefinito\Documenti\01_al lavoro\temp\[CFC10- Iscrizioni Classifiche e premiazioni v.5.0_1.xls]Iscrizioni'!$A$2:$L$254,8,FALSE) -> Tajoli Zeno | J49: =VLOOKUP(A49,'\Documents and Settings\Utente Predefinito\Documenti\01_al lavoro\temp\[CFC10- Iscrizioni Classifiche e premiazioni v.5.0_1.xls]Iscrizioni'!$A$2:$L$254,3,FALSE) -> 22 - FJ | K49: =VLOOKUP(A49,'\Documents and Settings\Utente Predefinito\Documenti\01_al lavoro\temp\[CFC10- Iscrizioni Classifiche e premiazioni v.5.0_1.xls]Iscrizioni'!$A$2:$L$254,6,FALSE) -> 1118
A50: 17 | B50: 0.72394675925925922 | C50: =B50-'\Documents and Settings\Utente Predefinito\Documenti\01_al lavoro\temp\[CFC10- Iscrizioni Classifiche e premiazioni v.5.0_1.xls]Arrivo Comp'!$F$1 -> 0.18228009259259259 | D50: =C50*1000/K50 -> 0.15795501957763655 | E50: 47 | F50: 47 | H50: =VLOOKUP(A50,'\Documents and Settings\Utente Predefinito\Documenti\01_al lavoro\temp\[CFC10- Iscrizioni Classifiche e premiazioni v.5.0_1.xls]Iscrizioni'!$A$2:$L$254,7,FALSE) -> Randi Alan | I50: =VLOOKUP(A50,'\Documents and Settings\Utente Predefinito\Documenti\01_al lavoro\temp\[CFC10- Iscrizioni Classifiche e premiazioni v.5.0_1.xls]Iscrizioni'!$A$2:$L$254,8,FALSE) -> Franzoni Davide | J50: =VLOOKUP(A50,'\Documents and Settings\Utente Predefinito\Documenti\01_al lavoro\temp\[CFC10- Iscrizioni Classifiche e premiazioni v.5.0_1.xls]Iscrizioni'!$A$2:$L$254,3,FALSE) -> 78 - Vaurien | K50: =VLOOKUP(A50,'\Documents and Settings\Utente Predefinito\Documenti\01_al lavoro\temp\[CFC10- Iscrizioni Classifiche e premiazioni v.5.0_1.xls]Iscrizioni'!$A$2:$L$254,6,FALSE) -> 1154
A51: 53 | B51: 0.74135416666666665 | C51: =B51-'\Documents and Settings\Utente Predefinito\Documenti\01_al lavoro\temp\[CFC10- Iscrizioni Classifiche e premiazioni v.5.0_1.xls]Arrivo Comp'!$F$1 -> 0.19968749999999999 | D51: =C51*1000/K51 -> 0.16103830645161293 | E51: 48 | F51: 48 | H51: =VLOOKUP(A51,'\Documents and Settings\Utente Predefinito\Documenti\01_al lavoro\temp\[CFC10- Iscrizioni Classifiche e premiazioni v.5.0_1.xls]Iscrizioni'!$A$2:$L$254,7,FALSE) -> Pannocchia Daniele | I51: =VLOOKUP(A51,'\Documents and Settings\Utente Predefinito\Documenti\01_al lavoro\temp\[CFC10- Iscrizioni Classifiche e premiazioni v.5.0_1.xls]Iscrizioni'!$A$2:$L$254,8,FALSE) -> 0 | J51: =VLOOKUP(A51,'\Documents and Settings\Utente Predefinito\Documenti\01_al lavoro\temp\[CFC10- Iscrizioni Classifiche e premiazioni v.5.0_1.xls]Iscrizioni'!$A$2:$L$254,3,FALSE) -> 74 - Topaz Uno race plus | K51: =VLOOKUP(A51,'\Documents and Settings\Utente Predefinito\Documenti\01_al lavoro\temp\[CFC10- Iscrizioni Classifiche e premiazioni v.5.0_1.xls]Iscrizioni'!$A$2:$L$254,6,FALSE) -> 1240
A52: 29 | B52: 0.71442129629629625 | C52: =B52-'\Documents and Settings\Utente Predefinito\Documenti\01_al lavoro\temp\[CFC10- Iscrizioni Classifiche e premiazioni v.5.0_1.xls]Arrivo Comp'!$F$1 -> 0.17275462962962962 | D52: =C52*1000/K52 -> 0.17809755631920579 | E52: 44 | F52: 49 | H52: =VLOOKUP(A52,'\Documents and Settings\Utente Predefinito\Documenti\01_al lavoro\temp\[CFC10- Iscrizioni Classifiche e premiazioni v.5.0_1.xls]Iscrizioni'!$A$2:$L$254,7,FALSE) -> Bellin Simone | I52: =VLOOKUP(A52,'\Documents and Settings\Utente Predefinito\Documenti\01_al lavoro\temp\[CFC10- Iscrizioni Classifiche e premiazioni v.5.0_1.xls]Iscrizioni'!$A$2:$L$254,8,FALSE) -> Brollo Rita | J52: =VLOOKUP(A52,'\Documents and Settings\Utente Predefinito\Documenti\01_al lavoro\temp\[CFC10- Iscrizioni Classifiche e premiazioni v.5.0_1.xls]Iscrizioni'!$A$2:$L$254,3,FALSE) -> 60 - RS 500 | K52: =VLOOKUP(A52,'\Documents and Settings\Utente Predefinito\Documenti\01_al lavoro\temp\[CFC10- Iscrizioni Classifiche e premiazioni v.5.0_1.xls]Iscrizioni'!$A$2:$L$254,6,FALSE) -> 970
A53: 7 | B53: 0.65939814814814812 | C53: =B53-'\Documents and Settings\Utente Predefinito\Documenti\01_al lavoro\temp\[CFC10- Iscrizioni Classifiche e premiazioni v.5.0_1.xls]Arrivo Comp'!$F$1 -> 0.11773148148148149 | D53: DSQ | H53: =VLOOKUP(A53,'\Documents and Settings\Utente Predefinito\Documenti\01_al lavoro\temp\[CFC10- Iscrizioni Classifiche e premiazioni v.5.0_1.xls]Iscrizioni'!$A$2:$L$254,7,FALSE) -> Carlini Luca | I53: =VLOOKUP(A53,'\Documents and Settings\Utente Predefinito\Documenti\01_al lavoro\temp\[CFC10- Iscrizioni Classifiche e premiazioni v.5.0_1.xls]Iscrizioni'!$A$2:$L$254,8,FALSE) -> Giacmeri Emanuele | J53: =VLOOKUP(A53,'\Documents and Settings\Utente Predefinito\Documenti\01_al lavoro\temp\[CFC10- Iscrizioni Classifiche e premiazioni v.5.0_1.xls]Iscrizioni'!$A$2:$L$254,3,FALSE) -> 60 - RS 500 | K53: =VLOOKUP(A53,'\Documents and Settings\Utente Predefinito\Documenti\01_al lavoro\temp\[CFC10- Iscrizioni Classifiche e premiazioni v.5.0_1.xls]Iscrizioni'!$A$2:$L$254,6,FALSE) -> 970
A54: 15 | B54: 0.68814814814814806 | C54: =B54-'\Documents and Settings\Utente Predefinito\Documenti\01_al lavoro\temp\[CFC10- Iscrizioni Classifiche e premiazioni v.5.0_1.xls]Arrivo Comp'!$F$1 -> 0.14648148148148143 | D54: DSQ | H54: =VLOOKUP(A54,'\Documents and Settings\Utente Predefinito\Documenti\01_al lavoro\temp\[CFC10- Iscrizioni Classifiche e premiazioni v.5.0_1.xls]Iscrizioni'!$A$2:$L$254,7,FALSE) -> Vasallo Giovanni | I54: =VLOOKUP(A54,'\Documents and Settings\Utente Predefinito\Documenti\01_al lavoro\temp\[CFC10- Iscrizioni Classifiche e premiazioni v.5.0_1.xls]Iscrizioni'!$A$2:$L$254,8,FALSE) -> Nicoletti Salvatore | J54: =VLOOKUP(A54,'\Documents and Settings\Utente Predefinito\Documenti\01_al lavoro\temp\[CFC10- Iscrizioni Classifiche e premiazioni v.5.0_1.xls]Iscrizioni'!$A$2:$L$254,3,FALSE) -> 22 - FJ | K54: =VLOOKUP(A54,'\Documents and Settings\Utente Predefinito\Documenti\01_al lavoro\temp\[CFC10- Iscrizioni Classifiche e premiazioni v.5.0_1.xls]Iscrizioni'!$A$2:$L$254,6,FALSE) -> 1118
A55: 13 | B55: 0.68702546296296296 | C55: =B55-'\Documents and Settings\Utente Predefinito\Documenti\01_al lavoro\temp\[CFC10- Iscrizioni Classifiche e premiazioni v.5.0_1.xls]Arrivo Comp'!$F$1 -> 0.14535879629629633 | D55: DSQ | H55: =VLOOKUP(A55,'\Documents and Settings\Utente Predefinito\Documenti\01_al lavoro\temp\[CFC10- Iscrizioni Classifiche e premiazioni v.5.0_1.xls]Iscrizioni'!$A$2:$L$254,7,FALSE) -> Bolis Ezio | I55: =VLOOKUP(A55,'\Documents and Settings\Utente Predefinito\Documenti\01_al lavoro\temp\[CFC10- Iscrizioni Classifiche e premiazioni v.5.0_1.xls]Iscrizioni'!$A$2:$L$254,8,FALSE) -> Facchinetti Fabrizio | J55: =VLOOKUP(A55,'\Documents and Settings\Utente Predefinito\Documenti\01_al lavoro\temp\[CFC10- Iscrizioni Classifiche e premiazioni v.5.0_1.xls]Iscrizioni'!$A$2:$L$254,3,FALSE) -> 22 - FJ | K55: =VLOOKUP(A55,'\Documents and Settings\Utente Predefinito\Documenti\01_al lavoro\temp\[CFC10- Iscrizioni Classifiche e premiazioni v.5.0_1.xls]Iscrizioni'!$A$2:$L$254,6,FALSE) -> 1118
A56: 25 | B56: 0.66108796296296302 | C56: =B56-'\Documents and Settings\Utente Predefinito\Documenti\01_al lavoro\temp\[CFC10- Iscrizioni Classifiche e premiazioni v.5.0_1.xls]Arrivo Comp'!$F$1 -> 0.11942129629629639 | D56: DSQ | H56: =VLOOKUP(A56,'\Documents and Settings\Utente Predefinito\Documenti\01_al lavoro\temp\[CFC10- Iscrizioni Classifiche e premiazioni v.5.0_1.xls]Iscrizioni'!$A$2:$L$254,7,FALSE) -> Piccoli Roberto | I56: =VLOOKUP(A56,'\Documents and Settings\Utente Predefinito\Documenti\01_al lavoro\temp\[CFC10- Iscrizioni Classifiche e premiazioni v.5.0_1.xls]Iscrizioni'!$A$2:$L$254,8,FALSE) -> Girardi Roberto | J56: =VLOOKUP(A56,'\Documents and Settings\Utente Predefinito\Documenti\01_al lavoro\temp\[CFC10- Iscrizioni Classifiche e premiazioni v.5.0_1.xls]Iscrizioni'!$A$2:$L$254,3,FALSE) -> 18 - FD | K56: =VLOOKUP(A56,'\Documents and Settings\Utente Predefinito\Documenti\01_al lavoro\temp\[CFC10- Iscrizioni Classifiche e premiazioni v.5.0_1.xls]Iscrizioni'!$A$2:$L$254,6,FALSE) -> 880
A57: 33 | B57: DNF | H57: =VLOOKUP(A57,'\Documents and Settings\Utente Predefinito\Documenti\01_al lavoro\temp\[CFC10- Iscrizioni Classifiche e premiazioni v.5.0_1.xls]Iscrizioni'!$A$2:$L$254,7,FALSE) -> Bigolin Maurizion | I57: =VLOOKUP(A57,'\Documents and Settings\Utente Predefinito\Documenti\01_al lavoro\temp\[CFC10- Iscrizioni Classifiche e premiazioni v.5.0_1.xls]Iscrizioni'!$A$2:$L$254,8,FALSE) -> Veneaziano Roberto | J57: =VLOOKUP(A57,'\Documents and Settings\Utente Predefinito\Documenti\01_al lavoro\temp\[CFC10- Iscrizioni Classifiche e premiazioni v.5.0_1.xls]Iscrizioni'!$A$2:$L$254,3,FALSE) -> 10 - Buzz | K57: =VLOOKUP(A57,'\Documents and Settings\Utente Predefinito\Documenti\01_al lavoro\temp\[CFC10- Iscrizioni Classifiche e premiazioni v.5.0_1.xls]Iscrizioni'!$A$2:$L$254,6,FALSE) -> 1005
A58: 21 | B58: DNF | H58: =VLOOKUP(A58,'\Documents and Settings\Utente Predefinito\Documenti\01_al lavoro\temp\[CFC10- Iscrizioni Classifiche e premiazioni v.5.0_1.xls]Iscrizioni'!$A$2:$L$254,7,FALSE) -> Demeo Giuseppe | I58: =VLOOKUP(A58,'\Documents and Settings\Utente Predefinito\Documenti\01_al lavoro\temp\[CFC10- Iscrizioni Classifiche e premiazioni v.5.0_1.xls]Iscrizioni'!$A$2:$L$254,8,FALSE) -> 0 | J58: =VLOOKUP(A58,'\Documents and Settings\Utente Predefinito\Documenti\01_al lavoro\temp\[CFC10- Iscrizioni Classifiche e premiazioni v.5.0_1.xls]Iscrizioni'!$A$2:$L$254,3,FALSE) -> 68 - Sunfish e/o Alpa skif | K58: =VLOOKUP(A58,'\Documents and Settings\Utente Predefinito\Documenti\01_al lavoro\temp\[CFC10- Iscrizioni Classifiche e premiazioni v.5.0_1.xls]Iscrizioni'!$A$2:$L$254,6,FALSE) -> 1127
A59: 56 | B59: DNF | H59: =VLOOKUP(A59,'\Documents and Settings\Utente Predefinito\Documenti\01_al lavoro\temp\[CFC10- Iscrizioni Classifiche e premiazioni v.5.0_1.xls]Iscrizioni'!$A$2:$L$254,7,FALSE) -> Zaniol Luca | I59: =VLOOKUP(A59,'\Documents and Settings\Utente Predefinito\Documenti\01_al lavoro\temp\[CFC10- Iscrizioni Classifiche e premiazioni v.5.0_1.xls]Iscrizioni'!$A$2:$L$254,8,FALSE) -> Borghetti Patrizia | J59: =VLOOKUP(A59,'\Documents and Settings\Utente Predefinito\Documenti\01_al lavoro\temp\[CFC10- Iscrizioni Classifiche e premiazioni v.5.0_1.xls]Iscrizioni'!$A$2:$L$254,3,FALSE) -> 21 - Fireball | K59: =VLOOKUP(A59,'\Documents and Settings\Utente Predefinito\Documenti\01_al lavoro\temp\[CFC10- Iscrizioni Classifiche e premiazioni v.5.0_1.xls]Iscrizioni'!$A$2:$L$254,6,FALSE) -> 982