A1: ID | B1: Classe | C1: YS | D1: conta | E1: Conv.
A2: 01 - 18 ' | B2: 18 ' | C2: 915 | D2: =COUNTIF(Iscrizioni!$C$3:$C$80,A2) -> 0 | E2: SI
A3: 02 - 18 ' skiff | B3: 18 ' skiff | C3: 586 | D3: =COUNTIF(Iscrizioni!$C$3:$C$80,A3) -> 0 | E3: NO
A4: 03 - 29 er | B4: 29 er | C4: 924 | D4: =COUNTIF(Iscrizioni!$C$3:$C$80,A4) -> 0
A5: 04 - 49ers | B5: 49ers | C5: 747 | D5: =COUNTIF(Iscrizioni!$C$3:$C$80,A5) -> 1
A6: 05 - 420 | B6: 420 | C6: 1087 | D6: =COUNTIF(Iscrizioni!$C$3:$C$80,A6) -> 0
A7: 06 - 470 | B7: 470 | C7: 973 | D7: =COUNTIF(Iscrizioni!$C$3:$C$80,A7) -> 4
A8: 07 - 505 | B8: 505 | C8: 902 | D8: =COUNTIF(Iscrizioni!$C$3:$C$80,A8) -> 0
A9: 08 - Byte | B9: Byte | C9: 1160 | D9: =COUNTIF(Iscrizioni!$C$3:$C$80,A9) -> 0
A10: 09 - Byte CII | B10: Byte CII | C10: 1139 | D10: =COUNTIF(Iscrizioni!$C$3:$C$80,A10) -> 1
A11: 10 - Buzz | B11: Buzz | C11: 1005 | D11: =COUNTIF(Iscrizioni!$C$3:$C$80,A11) -> 3
A12: 11 - Cadet | B12: Cadet | C12: 1432 | D12: =COUNTIF(Iscrizioni!$C$3:$C$80,A12) -> 0
A13: 12 - Caravelle | B13: Caravelle | C13: 1180 | D13: =COUNTIF(Iscrizioni!$C$3:$C$80,A13) -> 0
A14: 13 - Contender | B14: Contender | C14: 993 | D14: =COUNTIF(Iscrizioni!$C$3:$C$80,A14) -> 1
A15: 14 - C 14 (cna) | B15: C 14 (cna) | C15: 1003 | D15: =COUNTIF(Iscrizioni!$C$3:$C$80,A15) -> 0
A16: 15 - Dinghy '12 classico | B16: Dinghy '12 classico | C16: 1334 | D16: =COUNTIF(Iscrizioni!$C$3:$C$80,A16) -> 1
A17: 16 - Dinghy '12 vtr | B17: Dinghy '12 vtr | C17: 1271 | D17: =COUNTIF(Iscrizioni!$C$3:$C$80,A17) -> 2
A18: 17 - Europa | B18: Europa | C18: 1139 | D18: =COUNTIF(Iscrizioni!$C$3:$C$80,A18) -> 2
A19: 18 - FD | B19: FD | C19: 880 | D19: =COUNTIF(Iscrizioni!$C$3:$C$80,A19) -> 4
A20: 19 - Feather 14 | B20: Feather 14 | C20: 1117 | D20: =COUNTIF(Iscrizioni!$C$3:$C$80,A20) -> 0
A21: 20 - Finn | B21: Finn | C21: 1068 | D21: =COUNTIF(Iscrizioni!$C$3:$C$80,A21) -> 0
A22: 21 - Fireball | B22: Fireball | C22: 982 | D22: =COUNTIF(Iscrizioni!$C$3:$C$80,A22) -> 0
A23: 22 - FJ | B23: FJ | C23: 1118 | D23: =COUNTIF(Iscrizioni!$C$3:$C$80,A23) -> 11
A24: 23 - FIV 555 | B24: FIV 555 | C24: 1093 | D24: =COUNTIF(Iscrizioni!$C$3:$C$80,A24) -> 0
A25: 24 - Equipe | B25: Equipe | C25: 1175 | D25: =COUNTIF(Iscrizioni!$C$3:$C$80,A25) -> 0
A26: 25 - Equipe new sail | B26: Equipe new sail | C26: 1215 | D26: =COUNTIF(Iscrizioni!$C$3:$C$80,A26) -> 0
A27: 26 - Iso | B27: Iso | C27: 926 | D27: =COUNTIF(Iscrizioni!$C$3:$C$80,A27) -> 1
A28: 27 - Javelin | B28: Javelin | C28: 926 | D28: =COUNTIF(Iscrizioni!$C$3:$C$80,A28) -> 0
A29: 28 - Jet | B29: Jet | C29: 881 | D29: =COUNTIF(Iscrizioni!$C$3:$C$80,A29) -> 0
A30: 29 - Jet On CLIPPER | B30: Jet On CLIPPER | C30: 1180 | D30: =COUNTIF(Iscrizioni!$C$3:$C$80,A30) -> 0
A31: 30 - LASER 13 | B31: LASER 13 | C31: 1205 | D31: =COUNTIF(Iscrizioni!$C$3:$C$80,A31) -> 0
A32: 31 - Laser 4000 | B32: Laser 4000 | C32: 891 | D32: =COUNTIF(Iscrizioni!$C$3:$C$80,A32) -> 0
A33: 32 - Laser 5000 | B33: Laser 5000 | C33: 846 | D33: =COUNTIF(Iscrizioni!$C$3:$C$80,A33) -> 1
A34: 33 - Laser STD | B34: Laser STD | C34: 1078 | D34: =COUNTIF(Iscrizioni!$C$3:$C$80,A34) -> 9
A35: 34 - Laser radial | B35: Laser radial | C35: 1101 | D35: =COUNTIF(Iscrizioni!$C$3:$C$80,A35) -> 0
A36: 35 - Laser 4.7 | B36: Laser 4.7 | C36: 1177 | D36: =COUNTIF(Iscrizioni!$C$3:$C$80,A36) -> 0
A37: 36 - Laser 2 | B37: Laser 2 | C37: 1035 | D37: =COUNTIF(Iscrizioni!$C$3:$C$80,A37) -> 0
A38: 37 - Laser Bahia | B38: Laser Bahia | C38: 1095 | D38: =COUNTIF(Iscrizioni!$C$3:$C$80,A38) -> 0
A39: 38 - Laser Eps | B39: Laser Eps | C39: 1013 | D39: =COUNTIF(Iscrizioni!$C$3:$C$80,A39) -> 0
A40: 39 - Laser Vago | B40: Laser Vago | C40: 1015 | D40: =COUNTIF(Iscrizioni!$C$3:$C$80,A40) -> 0
A41: 40 - Laser Pico (single) | B41: Laser Pico (single) | C41: 1260 | D41: =COUNTIF(Iscrizioni!$C$3:$C$80,A41) -> 0
A42: 41 - Laser Pico (double) | B42: Laser Pico (double) | C42: 1264 | D42: =COUNTIF(Iscrizioni!$C$3:$C$80,A42) -> 0
A43: 42 - Laser Vortex | B43: Laser Vortex | C43: 900 | D43: =COUNTIF(Iscrizioni!$C$3:$C$80,A43) -> 0
A44: 43 - Maretta Touring | B44: Maretta Touring | C44: 1170 | D44: =COUNTIF(Iscrizioni!$C$3:$C$80,A44) -> 0
A45: 44 - Mirror full rig | B45: Mirror full rig | C45: 1364 | D45: =COUNTIF(Iscrizioni!$C$3:$C$80,A45) -> 0
A46: 45 - Moth con FOIL | B46: Moth con FOIL | C46: 690 | D46: =COUNTIF(Iscrizioni!$C$3:$C$80,A46) -> 0
A47: 46 - Musto skiff | B47: Musto skiff | C47: 823 | D47: =COUNTIF(Iscrizioni!$C$3:$C$80,A47) -> 0
A48: 47 - Musto skiff MPS | B48: Musto skiff MPS | C48: 875 | D48: =COUNTIF(Iscrizioni!$C$3:$C$80,A48) -> 0
A49: 48 - Neptun 16 | B49: Neptun 16 | C49: 1190 | D49: =COUNTIF(Iscrizioni!$C$3:$C$80,A49) -> 0
A50: 49 - OK | B50: OK | C50: 1110 | D50: =COUNTIF(Iscrizioni!$C$3:$C$80,A50) -> 0
A51: 50 - Open Bic | B51: Open Bic | C51: 1390 | D51: =COUNTIF(Iscrizioni!$C$3:$C$80,A51) -> 0
A52: 51 - Optimist | B52: Optimist | C52: 1646 | D52: =COUNTIF(Iscrizioni!$C$3:$C$80,A52) -> 0
A53: 52 - RS Tera | B53: RS Tera | C53: 1390 | D53: =COUNTIF(Iscrizioni!$C$3:$C$80,A53) -> 0
A54: 53 - RS Feva XL | B54: RS Feva XL | C54: 1200 | D54: =COUNTIF(Iscrizioni!$C$3:$C$80,A54) -> 0
A55: 54 - RS Feva | B55: RS Feva | C55: 1189 | D55: =COUNTIF(Iscrizioni!$C$3:$C$80,A55) -> 3
A56: 55 - RS Vareo | B56: RS Vareo | C56: 1038 | D56: =COUNTIF(Iscrizioni!$C$3:$C$80,A56) -> 0
A57: 56 - RS Vision | B57: RS Vision | C57: 1079 | D57: =COUNTIF(Iscrizioni!$C$3:$C$80,A57) -> 1
A58: 57 - RS 800 | B58: RS 800 | C58: 781 | D58: =COUNTIF(Iscrizioni!$C$3:$C$80,A58) -> 0
A59: 58 - RS 700 | B59: RS 700 | C59: 820 | D59: =COUNTIF(Iscrizioni!$C$3:$C$80,A59) -> 0
A60: 59 - RS 600 | B60: RS 600 | C60: 893 | D60: =COUNTIF(Iscrizioni!$C$3:$C$80,A60) -> 0
A61: 60 - RS 500 | B61: RS 500 | C61: 970 | D61: =COUNTIF(Iscrizioni!$C$3:$C$80,A61) -> 9
A62: 61 - RS 400 | B62: RS 400 | C62: 933 | D62: =COUNTIF(Iscrizioni!$C$3:$C$80,A62) -> 0
A63: 62 - S nazionale | B63: S nazionale | C63: 1088 | D63: =COUNTIF(Iscrizioni!$C$3:$C$80,A63) -> 1
A64: 63 - Snipe | B64: Snipe | C64: 1117 | D64: =COUNTIF(Iscrizioni!$C$3:$C$80,A64) -> 0
A65: 64 - Splash | B65: Splash | C65: 1184 | D65: =COUNTIF(Iscrizioni!$C$3:$C$80,A65) -> 0
A66: 65 - Strale | B66: Strale | C66: 1022 | D66: =COUNTIF(Iscrizioni!$C$3:$C$80,A66) -> 1
A67: 66 - Sunfish e/o Alpa skif | B67: Sunfish e/o Alpa skif | C67: 1127 | D67: =COUNTIF(Iscrizioni!$C$3:$C$80,A67) -> 2
A68: 67 - Tasar | B68: Tasar | C68: 1023 | D68: =COUNTIF(Iscrizioni!$C$3:$C$80,A68) -> 0
A69: 68 - Topper | B69: Topper | C69: 1290 | D69: =COUNTIF(Iscrizioni!$C$3:$C$80,A69) -> 3
A70: 69 - Trident std Cna | B70: Trident std Cna | C70: 1201 | D70: =COUNTIF(Iscrizioni!$C$3:$C$80,A70) -> 0
A71: 70 - Trident 16 Cna | B71: Trident 16 Cna | C71: 1181 | D71: =COUNTIF(Iscrizioni!$C$3:$C$80,A71) -> 7
A72: 71 - Truc 12 | B72: Truc 12 | C72: 1183 | D72: =COUNTIF(Iscrizioni!$C$3:$C$80,A72) -> 0
A73: 72 - Topaz Uno race plus | B73: Topaz Uno race plus | C73: 1240 | D73: =COUNTIF(Iscrizioni!$C$3:$C$80,A73) -> 2
A74: 73 - Topaz duo no spi | B74: Topaz duo no spi | C74: 1190 | D74: =COUNTIF(Iscrizioni!$C$3:$C$80,A74) -> 0
A75: 74 - Vibe | B75: Vibe | C75: 1185 | D75: =COUNTIF(Iscrizioni!$C$3:$C$80,A75) -> 0
A76: 75 - Vis | B76: Vis | C76: 920 | D76: =COUNTIF(Iscrizioni!$C$3:$C$80,A76) -> 0
A77: 76 - Vaurien | B77: Vaurien | C77: 1154 | D77: =COUNTIF(Iscrizioni!$C$3:$C$80,A77) -> 1
A78: 77 - Vaurien new sails | B78: Vaurien new sails | C78: 1118 | D78: =COUNTIF(Iscrizioni!$C$3:$C$80,A78) -> 2
A79: 78 - Windy | B79: Windy | C79: 1010 | D79: =COUNTIF(Iscrizioni!$C$3:$C$80,A79) -> 0
A80: 79 - Xenon | B80: Xenon | C80: 1070 | D80: =COUNTIF(Iscrizioni!$C$3:$C$80,A80) -> 0
A81: 80 - Zef | B81: Zef | C81: 1330 | D81: =COUNTIF(Iscrizioni!$C$3:$C$80,A81) -> 0
A82: 81 - Zoom 8 | B82: Zoom 8 | C82: 1500 | D82: =COUNTIF(Iscrizioni!$C$3:$C$80,A82) -> 0
A83: 82 - Classe A (senza genn) | B83: Classe A (senza genn) | C83: 720 | D83: =COUNTIF(Iscrizioni!$C$3:$C$80,A83) -> 0
A84: 83 - Cat Kit OCEANO | B84: Cat Kit OCEANO | C84: 800 | D84: =COUNTIF(Iscrizioni!$C$3:$C$80,A84) -> 0
A85: 84 - DART 18 | B85: DART 18 | C85: 798 | D85: =COUNTIF(Iscrizioni!$C$3:$C$80,A85) -> 0
A86: 85 - HOBIE 16 | B86: HOBIE 16 | C86: 802 | D86: =COUNTIF(Iscrizioni!$C$3:$C$80,A86) -> 0
A87: 86 - HOBIE 18 | B87: HOBIE 18 | C87: 742 | D87: =COUNTIF(Iscrizioni!$C$3:$C$80,A87) -> 0
A88: 87 - TOP CAT 14" | B88: TOP CAT 14" | C88: 916 | D88: =COUNTIF(Iscrizioni!$C$3:$C$80,A88) -> 0
A89: 88 - Rennjolle | B89: Rennjolle | C89: 1101 | D89: =COUNTIF(Iscrizioni!$C$3:$C$80,A89) -> 1
A90: 89 - classe U | B90: Classe U | C90: 966 | D90: =COUNTIF(Iscrizioni!$C$3:$C$80,A90) -> 1
D91: =COUNTIF(Iscrizioni!$C$3:$C$80,A91) -> 0
D92: =COUNTIF(Iscrizioni!$C$3:$C$80,A92) -> 0
D93: =COUNTIF(Iscrizioni!$C$3:$C$80,A93) -> 0
D94: =COUNTIF(Iscrizioni!$C$3:$C$80,A94) -> 0