H1: FITZCARRALDO CUP 2009
F2: CLASSIFICA DEFINITVA TEMPI COMPENSATI
A3: N° Vel | B3: Arrivo | C3: Tempo reale | D3: Tempo compensato | E3: Posizione Assoluta | F3: Posizione compensato | G3: Posizione classe | H3: nome skipper | I3: Prodiere | J3: ID_classe | K3: YS | L3: Circolo Velico | M3: Cellulare | N3: Pos
A4: 867 | B4: 5.5972222222222222E-2 | C4: =B4-'Arrivo ass'!$F$1 -> 5.5972222222222222E-2 | D4: =C4*1000/K4 -> 7.4929347017700432E-2 | E4: 1 | F4: 1 | H4: =IF(VLOOKUP(A4,Iscrizioni!$A$3:$K$254,2,FALSE)="SI",VLOOKUP(A4,Iscrizioni!$A$3:$K$254,6,FALSE),"NON ISCRITTO") -> Tita Ruggero | I4: =VLOOKUP(A4,Iscrizioni!$A$3:$K$254,7,FALSE) -> Pilati Matteo | J4: =VLOOKUP(A4,Iscrizioni!$A$3:$K$254,3,FALSE) -> 04 - 49ers | K4: =VLOOKUP(J4,Tabelle!$A$2:$C$90,3,FALSE) -> 747 | L4: =VLOOKUP(A4,Iscrizioni!$A$3:$K$254,9,FALSE) -> Compagnia della Vela | M4: =VLOOKUP(A4,Iscrizioni!$A$3:$K$254,8,FALSE) -> 0 | N4: 2
A5: 978 | B5: 8.0879629629629635E-2 | C5: =B5-'Arrivo ass'!$F$1 -> 8.0879629629629635E-2 | D5: =C5*1000/K5 -> 8.0477243412566804E-2 | E5: 2 | F5: 2 | H5: =IF(VLOOKUP(A5,Iscrizioni!$A$3:$K$254,2,FALSE)="SI",VLOOKUP(A5,Iscrizioni!$A$3:$K$254,6,FALSE),"NON ISCRITTO") -> Monciardini Paolo | I5: =VLOOKUP(A5,Iscrizioni!$A$3:$K$254,7,FALSE) -> Cuccato Debora | J5: =VLOOKUP(A5,Iscrizioni!$A$3:$K$254,3,FALSE) -> 10 - Buzz | K5: =VLOOKUP(J5,Tabelle!$A$2:$C$90,3,FALSE) -> 1005 | L5: =VLOOKUP(A5,Iscrizioni!$A$3:$K$254,9,FALSE) -> UMV | M5: =VLOOKUP(A5,Iscrizioni!$A$3:$K$254,8,FALSE) -> 3386046883 | N5: 1
A6: 415 | B6: 9.428935185185186E-2 | C6: =B6-'Arrivo ass'!$F$1 -> 9.428935185185186E-2 | D6: =C6*1000/K6 -> 8.5639738285060732E-2 | E6: 3 | F6: 3 | H6: =IF(VLOOKUP(A6,Iscrizioni!$A$3:$K$254,2,FALSE)="SI",VLOOKUP(A6,Iscrizioni!$A$3:$K$254,6,FALSE),"NON ISCRITTO") -> Modena Loris | I6: =VLOOKUP(A6,Iscrizioni!$A$3:$K$254,7,FALSE) -> Vasallo Giovanni | J6: =VLOOKUP(A6,Iscrizioni!$A$3:$K$254,3,FALSE) -> 88 - Rennjolle | K6: =VLOOKUP(J6,Tabelle!$A$2:$C$90,3,FALSE) -> 1101 | L6: =VLOOKUP(A6,Iscrizioni!$A$3:$K$254,9,FALSE) -> CN Brenzone | M6: =VLOOKUP(A6,Iscrizioni!$A$3:$K$254,8,FALSE) -> 3298622966 | N6: 3 | Q6: 8.5717592592592595E-2 | R6: =Q6*1.1 -> 9.428935185185186E-2
A7: 782 | B7: 8.9374999999999996E-2 | C7: =B7-'Arrivo ass'!$F$1 -> 8.9374999999999996E-2 | D7: =C7*1000/K7 -> 9.2139175257731964E-2 | E7: 4 | F7: 4 | G7: 1 | H7: =IF(VLOOKUP(A7,Iscrizioni!$A$3:$K$254,2,FALSE)="SI",VLOOKUP(A7,Iscrizioni!$A$3:$K$254,6,FALSE),"NON ISCRITTO") -> Scarpa Roberto | I7: =VLOOKUP(A7,Iscrizioni!$A$3:$K$254,7,FALSE) -> Favaro Benedetta | J7: =VLOOKUP(A7,Iscrizioni!$A$3:$K$254,3,FALSE) -> 60 - RS 500 | K7: =VLOOKUP(J7,Tabelle!$A$2:$C$90,3,FALSE) -> 970 | L7: =VLOOKUP(A7,Iscrizioni!$A$3:$K$254,9,FALSE) -> AVL | M7: =VLOOKUP(A7,Iscrizioni!$A$3:$K$254,8,FALSE) -> 3477167745 | N7: 4
A8: 799 | B8: 0.12710648148148149 | C8: =B8-'Arrivo ass'!$F$1 -> 0.12710648148148149 | D8: =C8*1000/K8 -> 9.5282220001110557E-2 | E8: 17 | F8: 5 | H8: =IF(VLOOKUP(A8,Iscrizioni!$A$3:$K$254,2,FALSE)="SI",VLOOKUP(A8,Iscrizioni!$A$3:$K$254,6,FALSE),"NON ISCRITTO") -> Armellini Roberto | I8: =VLOOKUP(A8,Iscrizioni!$A$3:$K$254,7,FALSE) -> 0 | J8: =VLOOKUP(A8,Iscrizioni!$A$3:$K$254,3,FALSE) -> 15 - Dinghy '12 classico | K8: =VLOOKUP(J8,Tabelle!$A$2:$C$90,3,FALSE) -> 1334 | L8: =VLOOKUP(A8,Iscrizioni!$A$3:$K$254,9,FALSE) -> Homerus onlus | M8: =VLOOKUP(A8,Iscrizioni!$A$3:$K$254,8,FALSE) -> 3357192377 | N8: 17
A9: 801 | B9: 9.8217592592592592E-2 | C9: =B9-'Arrivo ass'!$F$1 -> 9.8217592592592592E-2 | D9: =C9*1000/K9 -> 0.10125525009545629 | E9: 5 | F9: 6 | G9: 2 | H9: =IF(VLOOKUP(A9,Iscrizioni!$A$3:$K$254,2,FALSE)="SI",VLOOKUP(A9,Iscrizioni!$A$3:$K$254,6,FALSE),"NON ISCRITTO") -> Corica Francesco | I9: =VLOOKUP(A9,Iscrizioni!$A$3:$K$254,7,FALSE) -> Guagliardo Jacopo | J9: =VLOOKUP(A9,Iscrizioni!$A$3:$K$254,3,FALSE) -> 60 - RS 500 | K9: =VLOOKUP(J9,Tabelle!$A$2:$C$90,3,FALSE) -> 970 | L9: =VLOOKUP(A9,Iscrizioni!$A$3:$K$254,9,FALSE) -> YCC Genova | M9: =VLOOKUP(A9,Iscrizioni!$A$3:$K$254,8,FALSE) -> 339410737 | N9: 5
A10: 2455 | B10: 0.11668981481481482 | C10: =B10-'Arrivo ass'!$F$1 -> 0.11668981481481482 | D10: =C10*1000/K10 -> 0.10244935453451695 | E10: 10 | F10: 7 | H10: =IF(VLOOKUP(A10,Iscrizioni!$A$3:$K$254,2,FALSE)="SI",VLOOKUP(A10,Iscrizioni!$A$3:$K$254,6,FALSE),"NON ISCRITTO") -> Dugnagni Giacomo | I10: =VLOOKUP(A10,Iscrizioni!$A$3:$K$254,7,FALSE) -> 0 | J10: =VLOOKUP(A10,Iscrizioni!$A$3:$K$254,3,FALSE) -> 09 - Byte CII | K10: =VLOOKUP(J10,Tabelle!$A$2:$C$90,3,FALSE) -> 1139 | L10: =VLOOKUP(A10,Iscrizioni!$A$3:$K$254,9,FALSE) -> LNI Desenzano | M10: =VLOOKUP(A10,Iscrizioni!$A$3:$K$254,8,FALSE) -> 3202632474 | N10: 10
A11: 962 | B11: 0.12333333333333334 | C11: =B11-'Arrivo ass'!$F$1 -> 0.12333333333333334 | D11: =C11*1000/K11 -> 0.10443127293254305 | E11: 15 | F11: 8 | G11: 1 | H11: =IF(VLOOKUP(A11,Iscrizioni!$A$3:$K$254,2,FALSE)="SI",VLOOKUP(A11,Iscrizioni!$A$3:$K$254,6,FALSE),"NON ISCRITTO") -> Mainero Mario | I11: =VLOOKUP(A11,Iscrizioni!$A$3:$K$254,7,FALSE) -> Lorenzetti Marco | J11: =VLOOKUP(A11,Iscrizioni!$A$3:$K$254,3,FALSE) -> 70 - Trident 16 Cna | K11: =VLOOKUP(J11,Tabelle!$A$2:$C$90,3,FALSE) -> 1181 | L11: =VLOOKUP(A11,Iscrizioni!$A$3:$K$254,9,FALSE) -> CN Senigallia | M11: =VLOOKUP(A11,Iscrizioni!$A$3:$K$254,8,FALSE) -> 3295462697 | N11: 15
A12: 216 | B12: 0.10275462962962963 | C12: =B12-'Arrivo ass'!$F$1 -> 0.10275462962962963 | D12: =C12*1000/K12 -> 0.10637125220458554 | E12: 6 | F12: 9 | H12: =IF(VLOOKUP(A12,Iscrizioni!$A$3:$K$254,2,FALSE)="SI",VLOOKUP(A12,Iscrizioni!$A$3:$K$254,6,FALSE),"NON ISCRITTO") -> Spanò Domenico | I12: =VLOOKUP(A12,Iscrizioni!$A$3:$K$254,7,FALSE) -> Zanza Walter - Guareschi Corrado | J12: =VLOOKUP(A12,Iscrizioni!$A$3:$K$254,3,FALSE) -> 89 - classe U | K12: =VLOOKUP(J12,Tabelle!$A$2:$C$90,3,FALSE) -> 966 | L12: =VLOOKUP(A12,Iscrizioni!$A$3:$K$254,9,FALSE) -> YC Versilia | M12: =VLOOKUP(A12,Iscrizioni!$A$3:$K$254,8,FALSE) -> 3202326907 | N12: 6
A13: 974 | B13: 0.12231481481481482 | C13: =B13-'Arrivo ass'!$F$1 -> 0.12231481481481482 | D13: =C13*1000/K13 -> 0.10738789711572855 | E13: 14 | F13: 10 | H13: =IF(VLOOKUP(A13,Iscrizioni!$A$3:$K$254,2,FALSE)="SI",VLOOKUP(A13,Iscrizioni!$A$3:$K$254,6,FALSE),"NON ISCRITTO") -> Lo Manto Caterina | I13: =VLOOKUP(A13,Iscrizioni!$A$3:$K$254,7,FALSE) -> 0 | J13: =VLOOKUP(A13,Iscrizioni!$A$3:$K$254,3,FALSE) -> 17 - Europa | K13: =VLOOKUP(J13,Tabelle!$A$2:$C$90,3,FALSE) -> 1139 | L13: =VLOOKUP(A13,Iscrizioni!$A$3:$K$254,9,FALSE) -> CDDF | M13: =VLOOKUP(A13,Iscrizioni!$A$3:$K$254,8,FALSE) -> 3493779082 | N13: 14
A14: 181984 | B14: 0.12024305555555555 | C14: =B14-'Arrivo ass'!$F$1 -> 0.12024305555555555 | D14: =C14*1000/K14 -> 0.11154272314986599 | E14: 11 | F14: 11 | G14: 1 | H14: =IF(VLOOKUP(A14,Iscrizioni!$A$3:$K$254,2,FALSE)="SI",VLOOKUP(A14,Iscrizioni!$A$3:$K$254,6,FALSE),"NON ISCRITTO") -> Barozzi Mauro | I14: =VLOOKUP(A14,Iscrizioni!$A$3:$K$254,7,FALSE) -> 0 | J14: =VLOOKUP(A14,Iscrizioni!$A$3:$K$254,3,FALSE) -> 33 - Laser STD | K14: =VLOOKUP(J14,Tabelle!$A$2:$C$90,3,FALSE) -> 1078 | L14: =VLOOKUP(A14,Iscrizioni!$A$3:$K$254,9,FALSE) -> CDDF | M14: =VLOOKUP(A14,Iscrizioni!$A$3:$K$254,8,FALSE) -> 0 | N14: 11
A15: 188540 | B15: 0.12053240740740741 | C15: =B15-'Arrivo ass'!$F$1 -> 0.12053240740740741 | D15: =C15*1000/K15 -> 0.11181113859685288 | E15: 12 | F15: 12 | G15: 2 | H15: =IF(VLOOKUP(A15,Iscrizioni!$A$3:$K$254,2,FALSE)="SI",VLOOKUP(A15,Iscrizioni!$A$3:$K$254,6,FALSE),"NON ISCRITTO") -> Perlini Carlo | I15: =VLOOKUP(A15,Iscrizioni!$A$3:$K$254,7,FALSE) -> 0 | J15: =VLOOKUP(A15,Iscrizioni!$A$3:$K$254,3,FALSE) -> 33 - Laser STD | K15: =VLOOKUP(J15,Tabelle!$A$2:$C$90,3,FALSE) -> 1078 | L15: =VLOOKUP(A15,Iscrizioni!$A$3:$K$254,9,FALSE) -> LNI Garda | M15: =VLOOKUP(A15,Iscrizioni!$A$3:$K$254,8,FALSE) -> 3498160374 | N15: 12
A16: 138 | B16: 0.12164351851851851 | C16: =B16-'Arrivo ass'!$F$1 -> 0.12164351851851851 | D16: =C16*1000/K16 -> 0.11284185391328247 | E16: 13 | F16: 13 | G16: 3 | H16: =IF(VLOOKUP(A16,Iscrizioni!$A$3:$K$254,2,FALSE)="SI",VLOOKUP(A16,Iscrizioni!$A$3:$K$254,6,FALSE),"NON ISCRITTO") -> Ruppolo Luca | I16: =VLOOKUP(A16,Iscrizioni!$A$3:$K$254,7,FALSE) -> 0 | J16: =VLOOKUP(A16,Iscrizioni!$A$3:$K$254,3,FALSE) -> 33 - Laser STD | K16: =VLOOKUP(J16,Tabelle!$A$2:$C$90,3,FALSE) -> 1078 | L16: =VLOOKUP(A16,Iscrizioni!$A$3:$K$254,9,FALSE) -> LNI Belluno | M16: =VLOOKUP(A16,Iscrizioni!$A$3:$K$254,8,FALSE) -> 3396136587 | N16: 13
A17: 800 | B17: 0.11307870370370371 | C17: =B17-'Arrivo ass'!$F$1 -> 0.11307870370370371 | D17: =C17*1000/K17 -> 0.11657598319969455 | E17: 8 | F17: 14 | G17: 3 | H17: =IF(VLOOKUP(A17,Iscrizioni!$A$3:$K$254,2,FALSE)="SI",VLOOKUP(A17,Iscrizioni!$A$3:$K$254,6,FALSE),"NON ISCRITTO") -> Carlini Luca | I17: =VLOOKUP(A17,Iscrizioni!$A$3:$K$254,7,FALSE) -> Balestrero Stefano | J17: =VLOOKUP(A17,Iscrizioni!$A$3:$K$254,3,FALSE) -> 60 - RS 500 | K17: =VLOOKUP(J17,Tabelle!$A$2:$C$90,3,FALSE) -> 970 | L17: =VLOOKUP(A17,Iscrizioni!$A$3:$K$254,9,FALSE) -> YCC Genova | M17: =VLOOKUP(A17,Iscrizioni!$A$3:$K$254,8,FALSE) -> 3339410737 | N17: 8
A18: 1 t | B18: 0.13872685185185185 | C18: =B18-'Arrivo ass'!$F$1 -> 0.13872685185185185 | D18: =C18*1000/K18 -> 0.11746558158497193 | E18: 25 | F18: 15 | G18: 2 | H18: =IF(VLOOKUP(A18,Iscrizioni!$A$3:$K$254,2,FALSE)="SI",VLOOKUP(A18,Iscrizioni!$A$3:$K$254,6,FALSE),"NON ISCRITTO") -> Agostini Andrea | I18: =VLOOKUP(A18,Iscrizioni!$A$3:$K$254,7,FALSE) -> Vascellari Alessandro - Zucchetti Giulia | J18: =VLOOKUP(A18,Iscrizioni!$A$3:$K$254,3,FALSE) -> 70 - Trident 16 Cna | K18: =VLOOKUP(J18,Tabelle!$A$2:$C$90,3,FALSE) -> 1181 | L18: =VLOOKUP(A18,Iscrizioni!$A$3:$K$254,9,FALSE) -> ASS Sport VC Venezia | M18: =VLOOKUP(A18,Iscrizioni!$A$3:$K$254,8,FALSE) -> 3207099208 | N18: 25
A19: 5 t | B19: 0.1414236111111111 | C19: =B19-'Arrivo ass'!$F$1 -> 0.1414236111111111 | D19: =C19*1000/K19 -> 0.11974903565716434 | E19: 30 | F19: 16 | G19: 3 | H19: =IF(VLOOKUP(A19,Iscrizioni!$A$3:$K$254,2,FALSE)="SI",VLOOKUP(A19,Iscrizioni!$A$3:$K$254,6,FALSE),"NON ISCRITTO") -> Zennaro Nicola | I19: =VLOOKUP(A19,Iscrizioni!$A$3:$K$254,7,FALSE) -> D'Ascoli Lucio-Pernigotti Daniele | J19: =VLOOKUP(A19,Iscrizioni!$A$3:$K$254,3,FALSE) -> 70 - Trident 16 Cna | K19: =VLOOKUP(J19,Tabelle!$A$2:$C$90,3,FALSE) -> 1181 | L19: =VLOOKUP(A19,Iscrizioni!$A$3:$K$254,9,FALSE) -> CV Casanova | M19: =VLOOKUP(A19,Iscrizioni!$A$3:$K$254,8,FALSE) -> 0 | N19: 30
A20: 3124 | B20: 0.13421296296296295 | C20: =B20-'Arrivo ass'!$F$1 -> 0.13421296296296295 | D20: =C20*1000/K20 -> 0.1200473729543497 | E20: 19 | F20: 17 | G20: 1 | H20: =IF(VLOOKUP(A20,Iscrizioni!$A$3:$K$254,2,FALSE)="SI",VLOOKUP(A20,Iscrizioni!$A$3:$K$254,6,FALSE),"NON ISCRITTO") -> Zabrzewska Mgadalena | I20: =VLOOKUP(A20,Iscrizioni!$A$3:$K$254,7,FALSE) -> Corbellari Gianluigi | J20: =VLOOKUP(A20,Iscrizioni!$A$3:$K$254,3,FALSE) -> 22 - FJ | K20: =VLOOKUP(J20,Tabelle!$A$2:$C$90,3,FALSE) -> 1118 | L20: =VLOOKUP(A20,Iscrizioni!$A$3:$K$254,9,FALSE) -> CDDF | M20: =VLOOKUP(A20,Iscrizioni!$A$3:$K$254,8,FALSE) -> 3388130309 | N20: 19
A21: 2814 | B21: 0.13518518518518519 | C21: =B21-'Arrivo ass'!$F$1 -> 0.13518518518518519 | D21: =C21*1000/K21 -> 0.12091698138209767 | E21: 21 | F21: 18 | G21: 2 | H21: =IF(VLOOKUP(A21,Iscrizioni!$A$3:$K$254,2,FALSE)="SI",VLOOKUP(A21,Iscrizioni!$A$3:$K$254,6,FALSE),"NON ISCRITTO") -> Uras Claudio | I21: =VLOOKUP(A21,Iscrizioni!$A$3:$K$254,7,FALSE) -> Residori Alessandra | J21: =VLOOKUP(A21,Iscrizioni!$A$3:$K$254,3,FALSE) -> 22 - FJ | K21: =VLOOKUP(J21,Tabelle!$A$2:$C$90,3,FALSE) -> 1118 | L21: =VLOOKUP(A21,Iscrizioni!$A$3:$K$254,9,FALSE) -> CN Valdese WIND | M21: =VLOOKUP(A21,Iscrizioni!$A$3:$K$254,8,FALSE) -> 3484506295 | N21: 21
A22: 4 f | B22: 0.13520833333333335 | C22: =B22-'Arrivo ass'!$F$1 -> 0.13520833333333335 | D22: =C22*1000/K22 -> 0.12093768634466309 | E22: 22 | F22: 19 | G22: 3 | H22: =IF(VLOOKUP(A22,Iscrizioni!$A$3:$K$254,2,FALSE)="SI",VLOOKUP(A22,Iscrizioni!$A$3:$K$254,6,FALSE),"NON ISCRITTO") -> Bolis Ezio | I22: =VLOOKUP(A22,Iscrizioni!$A$3:$K$254,7,FALSE) -> Offer Silvia | J22: =VLOOKUP(A22,Iscrizioni!$A$3:$K$254,3,FALSE) -> 22 - FJ | K22: =VLOOKUP(J22,Tabelle!$A$2:$C$90,3,FALSE) -> 1118 | L22: =VLOOKUP(A22,Iscrizioni!$A$3:$K$254,9,FALSE) -> VC Campione del Garda | M22: =VLOOKUP(A22,Iscrizioni!$A$3:$K$254,8,FALSE) -> 3382648512 | N22: 22
A23: 641 | B23: 0.11247685185185186 | C23: =B23-'Arrivo ass'!$F$1 -> 0.11247685185185186 | D23: =C23*1000/K23 -> 0.12146528277737782 | E23: 7 | F23: 20 | H23: =IF(VLOOKUP(A23,Iscrizioni!$A$3:$K$254,2,FALSE)="SI",VLOOKUP(A23,Iscrizioni!$A$3:$K$254,6,FALSE),"NON ISCRITTO") -> Modena Umberto | I23: =VLOOKUP(A23,Iscrizioni!$A$3:$K$254,7,FALSE) -> Zaccoletti Luca | J23: =VLOOKUP(A23,Iscrizioni!$A$3:$K$254,3,FALSE) -> 26 - Iso | K23: =VLOOKUP(J23,Tabelle!$A$2:$C$90,3,FALSE) -> 926 | L23: =VLOOKUP(A23,Iscrizioni!$A$3:$K$254,9,FALSE) -> LNI Garda | M23: =VLOOKUP(A23,Iscrizioni!$A$3:$K$254,8,FALSE) -> 3473662096 | N23: 7
A24: 3806 | B24: 0.13945601851851852 | C24: =B24-'Arrivo ass'!$F$1 -> 0.13945601851851852 | D24: =C24*1000/K24 -> 0.12473704697541908 | E24: 27 | F24: 21 | G24: 4 | H24: =IF(VLOOKUP(A24,Iscrizioni!$A$3:$K$254,2,FALSE)="SI",VLOOKUP(A24,Iscrizioni!$A$3:$K$254,6,FALSE),"NON ISCRITTO") -> Veroni Giuseppe | I24: =VLOOKUP(A24,Iscrizioni!$A$3:$K$254,7,FALSE) -> Calò Sebastian | J24: =VLOOKUP(A24,Iscrizioni!$A$3:$K$254,3,FALSE) -> 22 - FJ | K24: =VLOOKUP(J24,Tabelle!$A$2:$C$90,3,FALSE) -> 1118 | L24: =VLOOKUP(A24,Iscrizioni!$A$3:$K$254,9,FALSE) -> YC Acquafesca | M24: =VLOOKUP(A24,Iscrizioni!$A$3:$K$254,8,FALSE) -> 3483014560 | N24: 27
A25: 3886 | B25: 0.14060185185185184 | C25: =B25-'Arrivo ass'!$F$1 -> 0.14060185185185184 | D25: =C25*1000/K25 -> 0.12576194262240772 | E25: 28 | F25: 22 | G25: 5 | H25: =IF(VLOOKUP(A25,Iscrizioni!$A$3:$K$254,2,FALSE)="SI",VLOOKUP(A25,Iscrizioni!$A$3:$K$254,6,FALSE),"NON ISCRITTO") -> Chiodi Mario | I25: =VLOOKUP(A25,Iscrizioni!$A$3:$K$254,7,FALSE) -> Langaro Paolo | J25: =VLOOKUP(A25,Iscrizioni!$A$3:$K$254,3,FALSE) -> 22 - FJ | K25: =VLOOKUP(J25,Tabelle!$A$2:$C$90,3,FALSE) -> 1118 | L25: =VLOOKUP(A25,Iscrizioni!$A$3:$K$254,9,FALSE) -> LNI VIcenza | M25: =VLOOKUP(A25,Iscrizioni!$A$3:$K$254,8,FALSE) -> 0 | N25: 28
A26: 12 | B26: 0.13576388888888888 | C26: =B26-'Arrivo ass'!$F$1 -> 0.13576388888888888 | D26: =C26*1000/K26 -> 0.12594052772624201 | E26: 23 | F26: 23 | G26: 4 | H26: =IF(VLOOKUP(A26,Iscrizioni!$A$3:$K$254,2,FALSE)="SI",VLOOKUP(A26,Iscrizioni!$A$3:$K$254,6,FALSE),"NON ISCRITTO") -> Bellato Graziano | I26: =VLOOKUP(A26,Iscrizioni!$A$3:$K$254,7,FALSE) -> 0 | J26: =VLOOKUP(A26,Iscrizioni!$A$3:$K$254,3,FALSE) -> 33 - Laser STD | K26: =VLOOKUP(J26,Tabelle!$A$2:$C$90,3,FALSE) -> 1078 | L26: =VLOOKUP(A26,Iscrizioni!$A$3:$K$254,9,FALSE) -> CN Volano | M26: =VLOOKUP(A26,Iscrizioni!$A$3:$K$254,8,FALSE) -> 3485601790 | N26: 23
A27: 36165 | B27: 0.14108796296296297 | C27: =B27-'Arrivo ass'!$F$1 -> 0.14108796296296297 | D27: =C27*1000/K27 -> 0.12619674683628171 | E27: 29 | F27: 24 | H27: =IF(VLOOKUP(A27,Iscrizioni!$A$3:$K$254,2,FALSE)="SI",VLOOKUP(A27,Iscrizioni!$A$3:$K$254,6,FALSE),"NON ISCRITTO") -> Parigi Stefano | I27: =VLOOKUP(A27,Iscrizioni!$A$3:$K$254,7,FALSE) -> Lombard Nicolas | J27: =VLOOKUP(A27,Iscrizioni!$A$3:$K$254,3,FALSE) -> 77 - Vaurien new sails | K27: =VLOOKUP(J27,Tabelle!$A$2:$C$90,3,FALSE) -> 1118 | L27: =VLOOKUP(A27,Iscrizioni!$A$3:$K$254,9,FALSE) -> CV Pietrabianca | M27: =VLOOKUP(A27,Iscrizioni!$A$3:$K$254,8,FALSE) -> 3280129495 | N27: 29
A28: 13 | B28: 0.14289351851851853 | C28: =B28-'Arrivo ass'!$F$1 -> 0.14289351851851853 | D28: =C28*1000/K28 -> 0.12679105458608567 | E28: 31 | F28: 25 | H28: =IF(VLOOKUP(A28,Iscrizioni!$A$3:$K$254,2,FALSE)="SI",VLOOKUP(A28,Iscrizioni!$A$3:$K$254,6,FALSE),"NON ISCRITTO") -> Beltrame Antonio | I28: =VLOOKUP(A28,Iscrizioni!$A$3:$K$254,7,FALSE) -> 0 | J28: =VLOOKUP(A28,Iscrizioni!$A$3:$K$254,3,FALSE) -> 66 - Sunfish e/o Alpa skif | K28: =VLOOKUP(J28,Tabelle!$A$2:$C$90,3,FALSE) -> 1127 | L28: =VLOOKUP(A28,Iscrizioni!$A$3:$K$254,9,FALSE) -> Punta vela Club | M28: =VLOOKUP(A28,Iscrizioni!$A$3:$K$254,8,FALSE) -> 3351212667 | N28: 31
A29: 3792 | B29: 0.12513888888888888 | C29: =B29-'Arrivo ass'!$F$1 -> 0.12513888888888888 | D29: =C29*1000/K29 -> 0.1286113965970081 | E29: 16 | F29: 26 | H29: =IF(VLOOKUP(A29,Iscrizioni!$A$3:$K$254,2,FALSE)="SI",VLOOKUP(A29,Iscrizioni!$A$3:$K$254,6,FALSE),"NON ISCRITTO") -> Candeago Francesco | I29: =VLOOKUP(A29,Iscrizioni!$A$3:$K$254,7,FALSE) -> Candeago Maurizio | J29: =VLOOKUP(A29,Iscrizioni!$A$3:$K$254,3,FALSE) -> 06 - 470 | K29: =VLOOKUP(J29,Tabelle!$A$2:$C$90,3,FALSE) -> 973 | L29: =VLOOKUP(A29,Iscrizioni!$A$3:$K$254,9,FALSE) -> CN Valle d'Aosta + CN Torino | M29: =VLOOKUP(A29,Iscrizioni!$A$3:$K$254,8,FALSE) -> 0 | N29: 16
A30: 51 | B30: 0.11460648148148149 | C30: =B30-'Arrivo ass'!$F$1 -> 0.11460648148148149 | D30: =C30*1000/K30 -> 0.13023463804713806 | E30: 9 | F30: 27 | H30: =IF(VLOOKUP(A30,Iscrizioni!$A$3:$K$254,2,FALSE)="SI",VLOOKUP(A30,Iscrizioni!$A$3:$K$254,6,FALSE),"NON ISCRITTO") -> Frau Virgilio | I30: =VLOOKUP(A30,Iscrizioni!$A$3:$K$254,7,FALSE) -> Richelli Paola | J30: =VLOOKUP(A30,Iscrizioni!$A$3:$K$254,3,FALSE) -> 18 - FD | K30: =VLOOKUP(J30,Tabelle!$A$2:$C$90,3,FALSE) -> 880 | L30: =VLOOKUP(A30,Iscrizioni!$A$3:$K$254,9,FALSE) -> VCCampione | M30: =VLOOKUP(A30,Iscrizioni!$A$3:$K$254,8,FALSE) -> 0 | N30: 9
A31: 179 | B31: 0.13607638888888887 | C31: =B31-'Arrivo ass'!$F$1 -> 0.13607638888888887 | D31: =C31*1000/K31 -> 0.13314715155468579 | E31: 24 | F31: 28 | H31: =IF(VLOOKUP(A31,Iscrizioni!$A$3:$K$254,2,FALSE)="SI",VLOOKUP(A31,Iscrizioni!$A$3:$K$254,6,FALSE),"NON ISCRITTO") -> Zanandrea Lucio | I31: =VLOOKUP(A31,Iscrizioni!$A$3:$K$254,7,FALSE) -> Frison Federico | J31: =VLOOKUP(A31,Iscrizioni!$A$3:$K$254,3,FALSE) -> 65 - Strale | K31: =VLOOKUP(J31,Tabelle!$A$2:$C$90,3,FALSE) -> 1022 | L31: =VLOOKUP(A31,Iscrizioni!$A$3:$K$254,9,FALSE) -> LNI Vicenza | M31: =VLOOKUP(A31,Iscrizioni!$A$3:$K$254,8,FALSE) -> 3355206292 | N31: 24
A32: 5384 | B32: 0.16611111111111113 | C32: =B32-'Arrivo ass'!$F$1 -> 0.16611111111111113 | D32: =C32*1000/K32 -> 0.13396057347670251 | E32: 33 | F32: 29 | H32: =IF(VLOOKUP(A32,Iscrizioni!$A$3:$K$254,2,FALSE)="SI",VLOOKUP(A32,Iscrizioni!$A$3:$K$254,6,FALSE),"NON ISCRITTO") -> Pannocchia Daniele | I32: =VLOOKUP(A32,Iscrizioni!$A$3:$K$254,7,FALSE) -> 0 | J32: =VLOOKUP(A32,Iscrizioni!$A$3:$K$254,3,FALSE) -> 72 - Topaz Uno race plus | K32: =VLOOKUP(J32,Tabelle!$A$2:$C$90,3,FALSE) -> 1240 | L32: =VLOOKUP(A32,Iscrizioni!$A$3:$K$254,9,FALSE) -> CV La Spezia | M32: =VLOOKUP(A32,Iscrizioni!$A$3:$K$254,8,FALSE) -> 3473707884 | N32: 33
A33: 30 | B33: 0.13252314814814814 | C33: =B33-'Arrivo ass'!$F$1 -> 0.13252314814814814 | D33: =C33*1000/K33 -> 0.13620056335883673 | E33: 18 | F33: 30 | H33: =IF(VLOOKUP(A33,Iscrizioni!$A$3:$K$254,2,FALSE)="SI",VLOOKUP(A33,Iscrizioni!$A$3:$K$254,6,FALSE),"NON ISCRITTO") -> Latini Ivaldo | I33: =VLOOKUP(A33,Iscrizioni!$A$3:$K$254,7,FALSE) -> Olivi Alessandra | J33: =VLOOKUP(A33,Iscrizioni!$A$3:$K$254,3,FALSE) -> 06 - 470 | K33: =VLOOKUP(J33,Tabelle!$A$2:$C$90,3,FALSE) -> 973 | L33: =VLOOKUP(A33,Iscrizioni!$A$3:$K$254,9,FALSE) -> CVMarotta | M33: =VLOOKUP(A33,Iscrizioni!$A$3:$K$254,8,FALSE) -> 0 | N33: 18
A34: 2 | B34: 0.16271990740740741 | C34: =B34-'Arrivo ass'!$F$1 -> 0.16271990740740741 | D34: =C34*1000/K34 -> 0.13778146266503591 | E34: 32 | F34: 31 | G34: 4 | H34: =IF(VLOOKUP(A34,Iscrizioni!$A$3:$K$254,2,FALSE)="SI",VLOOKUP(A34,Iscrizioni!$A$3:$K$254,6,FALSE),"NON ISCRITTO") -> Marcato Alessio | I34: =VLOOKUP(A34,Iscrizioni!$A$3:$K$254,7,FALSE) -> Angelin Alessia-Basso Emi | J34: =VLOOKUP(A34,Iscrizioni!$A$3:$K$254,3,FALSE) -> 70 - Trident 16 Cna | K34: =VLOOKUP(J34,Tabelle!$A$2:$C$90,3,FALSE) -> 1181 | L34: =VLOOKUP(A34,Iscrizioni!$A$3:$K$254,9,FALSE) -> CV Casanova | M34: =VLOOKUP(A34,Iscrizioni!$A$3:$K$254,8,FALSE) -> 3490535497 | N34: 32
A35: 4 t | B35: 0.16666666666666666 | C35: =B35-'Arrivo ass'!$F$1 -> 0.16666666666666666 | D35: =C35*1000/K35 -> 0.14112334180073383 | E35: 34 | F35: 32 | G35: 5 | H35: =IF(VLOOKUP(A35,Iscrizioni!$A$3:$K$254,2,FALSE)="SI",VLOOKUP(A35,Iscrizioni!$A$3:$K$254,6,FALSE),"NON ISCRITTO") -> Bellin Simone | I35: =VLOOKUP(A35,Iscrizioni!$A$3:$K$254,7,FALSE) -> Bolla Rita | J35: =VLOOKUP(A35,Iscrizioni!$A$3:$K$254,3,FALSE) -> 70 - Trident 16 Cna | K35: =VLOOKUP(J35,Tabelle!$A$2:$C$90,3,FALSE) -> 1181 | L35: =VLOOKUP(A35,Iscrizioni!$A$3:$K$254,9,FALSE) -> CV Casanova | M35: =VLOOKUP(A35,Iscrizioni!$A$3:$K$254,8,FALSE) -> 0 | N35: 34
A36: 3 f | B36: 0.1348148148148148 | C36: =B36-'Arrivo ass'!$F$1 -> 0.1348148148148148 | D36: =C36*1000/K36 -> 0.1531986531986532 | E36: 20 | F36: 33 | H36: =IF(VLOOKUP(A36,Iscrizioni!$A$3:$K$254,2,FALSE)="SI",VLOOKUP(A36,Iscrizioni!$A$3:$K$254,6,FALSE),"NON ISCRITTO") -> Masturzo Vincenzo | I36: =VLOOKUP(A36,Iscrizioni!$A$3:$K$254,7,FALSE) -> Masturzo Giuseppe | J36: =VLOOKUP(A36,Iscrizioni!$A$3:$K$254,3,FALSE) -> 18 - FD | K36: =VLOOKUP(J36,Tabelle!$A$2:$C$90,3,FALSE) -> 880 | L36: =VLOOKUP(A36,Iscrizioni!$A$3:$K$254,9,FALSE) -> CN Marina di Alimuri | M36: =VLOOKUP(A36,Iscrizioni!$A$3:$K$254,8,FALSE) -> 3356563796 | N36: 20
A37: 668 | B37: 0.13899305555555555 | C37: =B37-'Arrivo ass'!$F$1 -> 0.13899305555555555 | D37: =C37*1000/K37 -> 0.15794665404040403 | E37: 26 | F37: 34 | H37: =IF(VLOOKUP(A37,Iscrizioni!$A$3:$K$254,2,FALSE)="SI",VLOOKUP(A37,Iscrizioni!$A$3:$K$254,6,FALSE),"NON ISCRITTO") -> Mantovani Giovanni | I37: =VLOOKUP(A37,Iscrizioni!$A$3:$K$254,7,FALSE) -> Semeghini Arrigo | J37: =VLOOKUP(A37,Iscrizioni!$A$3:$K$254,3,FALSE) -> 18 - FD | K37: =VLOOKUP(J37,Tabelle!$A$2:$C$90,3,FALSE) -> 880 | L37: =VLOOKUP(A37,Iscrizioni!$A$3:$K$254,9,FALSE) -> LNI VIcenza | M37: =VLOOKUP(A37,Iscrizioni!$A$3:$K$254,8,FALSE) -> 3392642928 | N37: 26
C38: =B38-'Arrivo ass'!$F$1 -> 0 | D38: =C38*1000/K38 -> #N/D | E38: 35 | F38: 35 | H38: =IF(VLOOKUP(A38,Iscrizioni!$A$3:$K$254,2,FALSE)="SI",VLOOKUP(A38,Iscrizioni!$A$3:$K$254,6,FALSE),"NON ISCRITTO") -> #N/D | I38: =VLOOKUP(A38,Iscrizioni!$A$3:$K$254,7,FALSE) -> #N/D | J38: =VLOOKUP(A38,Iscrizioni!$A$3:$K$254,3,FALSE) -> #N/D | K38: =VLOOKUP(J38,Tabelle!$A$2:$C$90,3,FALSE) -> #N/D | L38: =VLOOKUP(A38,Iscrizioni!$A$3:$K$254,9,FALSE) -> #N/D | M38: =VLOOKUP(A38,Iscrizioni!$A$3:$K$254,8,FALSE) -> #N/D | N38: 35
C39: =B39-'Arrivo ass'!$F$1 -> 0 | D39: =C39*1000/K39 -> #N/D | E39: 36 | F39: 36 | H39: =IF(VLOOKUP(A39,Iscrizioni!$A$3:$K$254,2,FALSE)="SI",VLOOKUP(A39,Iscrizioni!$A$3:$K$254,6,FALSE),"NON ISCRITTO") -> #N/D | I39: =VLOOKUP(A39,Iscrizioni!$A$3:$K$254,7,FALSE) -> #N/D | J39: =VLOOKUP(A39,Iscrizioni!$A$3:$K$254,3,FALSE) -> #N/D | K39: =VLOOKUP(J39,Tabelle!$A$2:$C$90,3,FALSE) -> #N/D | L39: =VLOOKUP(A39,Iscrizioni!$A$3:$K$254,9,FALSE) -> #N/D | M39: =VLOOKUP(A39,Iscrizioni!$A$3:$K$254,8,FALSE) -> #N/D | N39: 36
C40: =B40-'Arrivo ass'!$F$1 -> 0 | D40: =C40*1000/K40 -> #N/D | E40: 37 | F40: 37 | H40: =IF(VLOOKUP(A40,Iscrizioni!$A$3:$K$254,2,FALSE)="SI",VLOOKUP(A40,Iscrizioni!$A$3:$K$254,6,FALSE),"NON ISCRITTO") -> #N/D | I40: =VLOOKUP(A40,Iscrizioni!$A$3:$K$254,7,FALSE) -> #N/D | J40: =VLOOKUP(A40,Iscrizioni!$A$3:$K$254,3,FALSE) -> #N/D | K40: =VLOOKUP(J40,Tabelle!$A$2:$C$90,3,FALSE) -> #N/D | L40: =VLOOKUP(A40,Iscrizioni!$A$3:$K$254,9,FALSE) -> #N/D | M40: =VLOOKUP(A40,Iscrizioni!$A$3:$K$254,8,FALSE) -> #N/D | N40: 37
C41: =B41-'Arrivo ass'!$F$1 -> 0 | D41: =C41*1000/K41 -> #N/D | E41: 38 | F41: 38 | H41: =IF(VLOOKUP(A41,Iscrizioni!$A$3:$K$254,2,FALSE)="SI",VLOOKUP(A41,Iscrizioni!$A$3:$K$254,6,FALSE),"NON ISCRITTO") -> #N/D | I41: =VLOOKUP(A41,Iscrizioni!$A$3:$K$254,7,FALSE) -> #N/D | J41: =VLOOKUP(A41,Iscrizioni!$A$3:$K$254,3,FALSE) -> #N/D | K41: =VLOOKUP(J41,Tabelle!$A$2:$C$90,3,FALSE) -> #N/D | L41: =VLOOKUP(A41,Iscrizioni!$A$3:$K$254,9,FALSE) -> #N/D | M41: =VLOOKUP(A41,Iscrizioni!$A$3:$K$254,8,FALSE) -> #N/D | N41: 38
C42: =B42-'Arrivo ass'!$F$1 -> 0 | D42: =C42*1000/K42 -> #N/D | E42: 39 | F42: 39 | H42: =IF(VLOOKUP(A42,Iscrizioni!$A$3:$K$254,2,FALSE)="SI",VLOOKUP(A42,Iscrizioni!$A$3:$K$254,6,FALSE),"NON ISCRITTO") -> #N/D | I42: =VLOOKUP(A42,Iscrizioni!$A$3:$K$254,7,FALSE) -> #N/D | J42: =VLOOKUP(A42,Iscrizioni!$A$3:$K$254,3,FALSE) -> #N/D | K42: =VLOOKUP(J42,Tabelle!$A$2:$C$90,3,FALSE) -> #N/D | L42: =VLOOKUP(A42,Iscrizioni!$A$3:$K$254,9,FALSE) -> #N/D | M42: =VLOOKUP(A42,Iscrizioni!$A$3:$K$254,8,FALSE) -> #N/D | N42: 39
C43: =B43-'Arrivo ass'!$F$1 -> 0 | D43: =C43*1000/K43 -> #N/D | E43: 40 | F43: 40 | H43: =IF(VLOOKUP(A43,Iscrizioni!$A$3:$K$254,2,FALSE)="SI",VLOOKUP(A43,Iscrizioni!$A$3:$K$254,6,FALSE),"NON ISCRITTO") -> #N/D | I43: =VLOOKUP(A43,Iscrizioni!$A$3:$K$254,7,FALSE) -> #N/D | J43: =VLOOKUP(A43,Iscrizioni!$A$3:$K$254,3,FALSE) -> #N/D | K43: =VLOOKUP(J43,Tabelle!$A$2:$C$90,3,FALSE) -> #N/D | L43: =VLOOKUP(A43,Iscrizioni!$A$3:$K$254,9,FALSE) -> #N/D | M43: =VLOOKUP(A43,Iscrizioni!$A$3:$K$254,8,FALSE) -> #N/D | N43: 40
C44: =B44-'Arrivo ass'!$F$1 -> 0 | D44: =C44*1000/K44 -> #N/D | E44: 41 | F44: 41 | H44: =IF(VLOOKUP(A44,Iscrizioni!$A$3:$K$254,2,FALSE)="SI",VLOOKUP(A44,Iscrizioni!$A$3:$K$254,6,FALSE),"NON ISCRITTO") -> #N/D | I44: =VLOOKUP(A44,Iscrizioni!$A$3:$K$254,7,FALSE) -> #N/D | J44: =VLOOKUP(A44,Iscrizioni!$A$3:$K$254,3,FALSE) -> #N/D | K44: =VLOOKUP(J44,Tabelle!$A$2:$C$90,3,FALSE) -> #N/D | L44: =VLOOKUP(A44,Iscrizioni!$A$3:$K$254,9,FALSE) -> #N/D | M44: =VLOOKUP(A44,Iscrizioni!$A$3:$K$254,8,FALSE) -> #N/D | N44: 41
C45: =B45-'Arrivo ass'!$F$1 -> 0 | D45: =C45*1000/K45 -> #N/D | E45: 42 | F45: 42 | H45: =IF(VLOOKUP(A45,Iscrizioni!$A$3:$K$254,2,FALSE)="SI",VLOOKUP(A45,Iscrizioni!$A$3:$K$254,6,FALSE),"NON ISCRITTO") -> #N/D | I45: =VLOOKUP(A45,Iscrizioni!$A$3:$K$254,7,FALSE) -> #N/D | J45: =VLOOKUP(A45,Iscrizioni!$A$3:$K$254,3,FALSE) -> #N/D | K45: =VLOOKUP(J45,Tabelle!$A$2:$C$90,3,FALSE) -> #N/D | L45: =VLOOKUP(A45,Iscrizioni!$A$3:$K$254,9,FALSE) -> #N/D | M45: =VLOOKUP(A45,Iscrizioni!$A$3:$K$254,8,FALSE) -> #N/D | N45: 42
C46: =B46-'Arrivo ass'!$F$1 -> 0 | D46: =C46*1000/K46 -> #N/D | E46: 43 | F46: 43 | H46: =IF(VLOOKUP(A46,Iscrizioni!$A$3:$K$254,2,FALSE)="SI",VLOOKUP(A46,Iscrizioni!$A$3:$K$254,6,FALSE),"NON ISCRITTO") -> #N/D | I46: =VLOOKUP(A46,Iscrizioni!$A$3:$K$254,7,FALSE) -> #N/D | J46: =VLOOKUP(A46,Iscrizioni!$A$3:$K$254,3,FALSE) -> #N/D | K46: =VLOOKUP(J46,Tabelle!$A$2:$C$90,3,FALSE) -> #N/D | L46: =VLOOKUP(A46,Iscrizioni!$A$3:$K$254,9,FALSE) -> #N/D | M46: =VLOOKUP(A46,Iscrizioni!$A$3:$K$254,8,FALSE) -> #N/D | N46: 43
C47: =B47-'Arrivo ass'!$F$1 -> 0 | D47: =C47*1000/K47 -> #N/D | E47: 44 | F47: 44 | H47: =IF(VLOOKUP(A47,Iscrizioni!$A$3:$K$254,2,FALSE)="SI",VLOOKUP(A47,Iscrizioni!$A$3:$K$254,6,FALSE),"NON ISCRITTO") -> #N/D | I47: =VLOOKUP(A47,Iscrizioni!$A$3:$K$254,7,FALSE) -> #N/D | J47: =VLOOKUP(A47,Iscrizioni!$A$3:$K$254,3,FALSE) -> #N/D | K47: =VLOOKUP(J47,Tabelle!$A$2:$C$90,3,FALSE) -> #N/D | L47: =VLOOKUP(A47,Iscrizioni!$A$3:$K$254,9,FALSE) -> #N/D | M47: =VLOOKUP(A47,Iscrizioni!$A$3:$K$254,8,FALSE) -> #N/D | N47: 44
C48: =B48-'Arrivo ass'!$F$1 -> 0 | D48: =C48*1000/K48 -> #N/D | E48: 45 | F48: 45 | H48: =IF(VLOOKUP(A48,Iscrizioni!$A$3:$K$254,2,FALSE)="SI",VLOOKUP(A48,Iscrizioni!$A$3:$K$254,6,FALSE),"NON ISCRITTO") -> #N/D | I48: =VLOOKUP(A48,Iscrizioni!$A$3:$K$254,7,FALSE) -> #N/D | J48: =VLOOKUP(A48,Iscrizioni!$A$3:$K$254,3,FALSE) -> #N/D | K48: =VLOOKUP(J48,Tabelle!$A$2:$C$90,3,FALSE) -> #N/D | L48: =VLOOKUP(A48,Iscrizioni!$A$3:$K$254,9,FALSE) -> #N/D | M48: =VLOOKUP(A48,Iscrizioni!$A$3:$K$254,8,FALSE) -> #N/D | N48: 45
C49: =B49-'Arrivo ass'!$F$1 -> 0 | D49: =C49*1000/K49 -> #N/D | E49: 46 | F49: 46 | H49: =IF(VLOOKUP(A49,Iscrizioni!$A$3:$K$254,2,FALSE)="SI",VLOOKUP(A49,Iscrizioni!$A$3:$K$254,6,FALSE),"NON ISCRITTO") -> #N/D | I49: =VLOOKUP(A49,Iscrizioni!$A$3:$K$254,7,FALSE) -> #N/D | J49: =VLOOKUP(A49,Iscrizioni!$A$3:$K$254,3,FALSE) -> #N/D | K49: =VLOOKUP(J49,Tabelle!$A$2:$C$90,3,FALSE) -> #N/D | L49: =VLOOKUP(A49,Iscrizioni!$A$3:$K$254,9,FALSE) -> #N/D | M49: =VLOOKUP(A49,Iscrizioni!$A$3:$K$254,8,FALSE) -> #N/D | N49: 46
C50: =B50-'Arrivo ass'!$F$1 -> 0 | D50: =C50*1000/K50 -> #N/D | E50: 47 | F50: 47 | H50: =IF(VLOOKUP(A50,Iscrizioni!$A$3:$K$254,2,FALSE)="SI",VLOOKUP(A50,Iscrizioni!$A$3:$K$254,6,FALSE),"NON ISCRITTO") -> #N/D | I50: =VLOOKUP(A50,Iscrizioni!$A$3:$K$254,7,FALSE) -> #N/D | J50: =VLOOKUP(A50,Iscrizioni!$A$3:$K$254,3,FALSE) -> #N/D | K50: =VLOOKUP(J50,Tabelle!$A$2:$C$90,3,FALSE) -> #N/D | L50: =VLOOKUP(A50,Iscrizioni!$A$3:$K$254,9,FALSE) -> #N/D | M50: =VLOOKUP(A50,Iscrizioni!$A$3:$K$254,8,FALSE) -> #N/D | N50: 47
C51: =B51-'Arrivo ass'!$F$1 -> 0 | D51: =C51*1000/K51 -> #N/D | E51: 48 | F51: 48 | H51: =IF(VLOOKUP(A51,Iscrizioni!$A$3:$K$254,2,FALSE)="SI",VLOOKUP(A51,Iscrizioni!$A$3:$K$254,6,FALSE),"NON ISCRITTO") -> #N/D | I51: =VLOOKUP(A51,Iscrizioni!$A$3:$K$254,7,FALSE) -> #N/D | J51: =VLOOKUP(A51,Iscrizioni!$A$3:$K$254,3,FALSE) -> #N/D | K51: =VLOOKUP(J51,Tabelle!$A$2:$C$90,3,FALSE) -> #N/D | L51: =VLOOKUP(A51,Iscrizioni!$A$3:$K$254,9,FALSE) -> #N/D | M51: =VLOOKUP(A51,Iscrizioni!$A$3:$K$254,8,FALSE) -> #N/D | N51: 48
C52: =B52-'Arrivo ass'!$F$1 -> 0 | D52: =C52*1000/K52 -> #N/D | E52: 49 | F52: 49 | H52: =IF(VLOOKUP(A52,Iscrizioni!$A$3:$K$254,2,FALSE)="SI",VLOOKUP(A52,Iscrizioni!$A$3:$K$254,6,FALSE),"NON ISCRITTO") -> #N/D | I52: =VLOOKUP(A52,Iscrizioni!$A$3:$K$254,7,FALSE) -> #N/D | J52: =VLOOKUP(A52,Iscrizioni!$A$3:$K$254,3,FALSE) -> #N/D | K52: =VLOOKUP(J52,Tabelle!$A$2:$C$90,3,FALSE) -> #N/D | L52: =VLOOKUP(A52,Iscrizioni!$A$3:$K$254,9,FALSE) -> #N/D | M52: =VLOOKUP(A52,Iscrizioni!$A$3:$K$254,8,FALSE) -> #N/D | N52: 49
C53: =B53-'Arrivo ass'!$F$1 -> 0 | D53: =C53*1000/K53 -> #N/D | E53: 50 | F53: 50 | H53: =IF(VLOOKUP(A53,Iscrizioni!$A$3:$K$254,2,FALSE)="SI",VLOOKUP(A53,Iscrizioni!$A$3:$K$254,6,FALSE),"NON ISCRITTO") -> #N/D | I53: =VLOOKUP(A53,Iscrizioni!$A$3:$K$254,7,FALSE) -> #N/D | J53: =VLOOKUP(A53,Iscrizioni!$A$3:$K$254,3,FALSE) -> #N/D | K53: =VLOOKUP(J53,Tabelle!$A$2:$C$90,3,FALSE) -> #N/D | L53: =VLOOKUP(A53,Iscrizioni!$A$3:$K$254,9,FALSE) -> #N/D | M53: =VLOOKUP(A53,Iscrizioni!$A$3:$K$254,8,FALSE) -> #N/D | N53: 50
C54: =B54-'Arrivo ass'!$F$1 -> 0 | D54: =C54*1000/K54 -> #N/D | E54: 51 | F54: 51 | H54: =IF(VLOOKUP(A54,Iscrizioni!$A$3:$K$254,2,FALSE)="SI",VLOOKUP(A54,Iscrizioni!$A$3:$K$254,6,FALSE),"NON ISCRITTO") -> #N/D | I54: =VLOOKUP(A54,Iscrizioni!$A$3:$K$254,7,FALSE) -> #N/D | J54: =VLOOKUP(A54,Iscrizioni!$A$3:$K$254,3,FALSE) -> #N/D | K54: =VLOOKUP(J54,Tabelle!$A$2:$C$90,3,FALSE) -> #N/D | L54: =VLOOKUP(A54,Iscrizioni!$A$3:$K$254,9,FALSE) -> #N/D | M54: =VLOOKUP(A54,Iscrizioni!$A$3:$K$254,8,FALSE) -> #N/D | N54: 51
C55: =B55-'Arrivo ass'!$F$1 -> 0 | D55: =C55*1000/K55 -> #N/D | E55: 52 | F55: 52 | H55: =IF(VLOOKUP(A55,Iscrizioni!$A$3:$K$254,2,FALSE)="SI",VLOOKUP(A55,Iscrizioni!$A$3:$K$254,6,FALSE),"NON ISCRITTO") -> #N/D | I55: =VLOOKUP(A55,Iscrizioni!$A$3:$K$254,7,FALSE) -> #N/D | J55: =VLOOKUP(A55,Iscrizioni!$A$3:$K$254,3,FALSE) -> #N/D | K55: =VLOOKUP(J55,Tabelle!$A$2:$C$90,3,FALSE) -> #N/D | L55: =VLOOKUP(A55,Iscrizioni!$A$3:$K$254,9,FALSE) -> #N/D | M55: =VLOOKUP(A55,Iscrizioni!$A$3:$K$254,8,FALSE) -> #N/D | N55: 52
C56: =B56-'Arrivo ass'!$F$1 -> 0 | D56: =C56*1000/K56 -> #N/D | E56: 53 | F56: 53 | H56: =IF(VLOOKUP(A56,Iscrizioni!$A$3:$K$254,2,FALSE)="SI",VLOOKUP(A56,Iscrizioni!$A$3:$K$254,6,FALSE),"NON ISCRITTO") -> #N/D | I56: =VLOOKUP(A56,Iscrizioni!$A$3:$K$254,7,FALSE) -> #N/D | J56: =VLOOKUP(A56,Iscrizioni!$A$3:$K$254,3,FALSE) -> #N/D | K56: =VLOOKUP(J56,Tabelle!$A$2:$C$90,3,FALSE) -> #N/D | L56: =VLOOKUP(A56,Iscrizioni!$A$3:$K$254,9,FALSE) -> #N/D | M56: =VLOOKUP(A56,Iscrizioni!$A$3:$K$254,8,FALSE) -> #N/D | N56: 53
C57: =B57-'Arrivo ass'!$F$1 -> 0 | D57: =C57*1000/K57 -> #N/D | E57: 54 | F57: 54 | H57: =IF(VLOOKUP(A57,Iscrizioni!$A$3:$K$254,2,FALSE)="SI",VLOOKUP(A57,Iscrizioni!$A$3:$K$254,6,FALSE),"NON ISCRITTO") -> #N/D | I57: =VLOOKUP(A57,Iscrizioni!$A$3:$K$254,7,FALSE) -> #N/D | J57: =VLOOKUP(A57,Iscrizioni!$A$3:$K$254,3,FALSE) -> #N/D | K57: =VLOOKUP(J57,Tabelle!$A$2:$C$90,3,FALSE) -> #N/D | L57: =VLOOKUP(A57,Iscrizioni!$A$3:$K$254,9,FALSE) -> #N/D | M57: =VLOOKUP(A57,Iscrizioni!$A$3:$K$254,8,FALSE) -> #N/D | N57: 54
C58: =B58-'Arrivo ass'!$F$1 -> 0 | D58: =C58*1000/K58 -> #N/D | E58: 55 | F58: 55 | H58: =IF(VLOOKUP(A58,Iscrizioni!$A$3:$K$254,2,FALSE)="SI",VLOOKUP(A58,Iscrizioni!$A$3:$K$254,6,FALSE),"NON ISCRITTO") -> #N/D | I58: =VLOOKUP(A58,Iscrizioni!$A$3:$K$254,7,FALSE) -> #N/D | J58: =VLOOKUP(A58,Iscrizioni!$A$3:$K$254,3,FALSE) -> #N/D | K58: =VLOOKUP(J58,Tabelle!$A$2:$C$90,3,FALSE) -> #N/D | L58: =VLOOKUP(A58,Iscrizioni!$A$3:$K$254,9,FALSE) -> #N/D | M58: =VLOOKUP(A58,Iscrizioni!$A$3:$K$254,8,FALSE) -> #N/D | N58: 55
C59: =B59-'Arrivo ass'!$F$1 -> 0 | D59: =C59*1000/K59 -> #N/D | E59: 56 | F59: 56 | H59: =IF(VLOOKUP(A59,Iscrizioni!$A$3:$K$254,2,FALSE)="SI",VLOOKUP(A59,Iscrizioni!$A$3:$K$254,6,FALSE),"NON ISCRITTO") -> #N/D | I59: =VLOOKUP(A59,Iscrizioni!$A$3:$K$254,7,FALSE) -> #N/D | J59: =VLOOKUP(A59,Iscrizioni!$A$3:$K$254,3,FALSE) -> #N/D | K59: =VLOOKUP(J59,Tabelle!$A$2:$C$90,3,FALSE) -> #N/D | L59: =VLOOKUP(A59,Iscrizioni!$A$3:$K$254,9,FALSE) -> #N/D | M59: =VLOOKUP(A59,Iscrizioni!$A$3:$K$254,8,FALSE) -> #N/D | N59: 56
C60: =B60-'Arrivo ass'!$F$1 -> 0 | D60: =C60*1000/K60 -> #N/D | E60: 57 | F60: 57 | H60: =IF(VLOOKUP(A60,Iscrizioni!$A$3:$K$254,2,FALSE)="SI",VLOOKUP(A60,Iscrizioni!$A$3:$K$254,6,FALSE),"NON ISCRITTO") -> #N/D | I60: =VLOOKUP(A60,Iscrizioni!$A$3:$K$254,7,FALSE) -> #N/D | J60: =VLOOKUP(A60,Iscrizioni!$A$3:$K$254,3,FALSE) -> #N/D | K60: =VLOOKUP(J60,Tabelle!$A$2:$C$90,3,FALSE) -> #N/D | L60: =VLOOKUP(A60,Iscrizioni!$A$3:$K$254,9,FALSE) -> #N/D | M60: =VLOOKUP(A60,Iscrizioni!$A$3:$K$254,8,FALSE) -> #N/D | N60: 57
C61: =B61-'Arrivo ass'!$F$1 -> 0 | D61: =C61*1000/K61 -> #N/D | E61: 58 | F61: 58 | H61: =IF(VLOOKUP(A61,Iscrizioni!$A$3:$K$254,2,FALSE)="SI",VLOOKUP(A61,Iscrizioni!$A$3:$K$254,6,FALSE),"NON ISCRITTO") -> #N/D | I61: =VLOOKUP(A61,Iscrizioni!$A$3:$K$254,7,FALSE) -> #N/D | J61: =VLOOKUP(A61,Iscrizioni!$A$3:$K$254,3,FALSE) -> #N/D | K61: =VLOOKUP(J61,Tabelle!$A$2:$C$90,3,FALSE) -> #N/D | L61: =VLOOKUP(A61,Iscrizioni!$A$3:$K$254,9,FALSE) -> #N/D | M61: =VLOOKUP(A61,Iscrizioni!$A$3:$K$254,8,FALSE) -> #N/D | N61: 58
C62: =B62-'Arrivo ass'!$F$1 -> 0 | D62: =C62*1000/K62 -> #N/D | E62: 59 | F62: 59 | H62: =IF(VLOOKUP(A62,Iscrizioni!$A$3:$K$254,2,FALSE)="SI",VLOOKUP(A62,Iscrizioni!$A$3:$K$254,6,FALSE),"NON ISCRITTO") -> #N/D | I62: =VLOOKUP(A62,Iscrizioni!$A$3:$K$254,7,FALSE) -> #N/D | J62: =VLOOKUP(A62,Iscrizioni!$A$3:$K$254,3,FALSE) -> #N/D | K62: =VLOOKUP(J62,Tabelle!$A$2:$C$90,3,FALSE) -> #N/D | L62: =VLOOKUP(A62,Iscrizioni!$A$3:$K$254,9,FALSE) -> #N/D | M62: =VLOOKUP(A62,Iscrizioni!$A$3:$K$254,8,FALSE) -> #N/D | N62: 59
C63: =B63-'Arrivo ass'!$F$1 -> 0 | D63: =C63*1000/K63 -> #N/D | E63: 60 | F63: 60 | H63: =IF(VLOOKUP(A63,Iscrizioni!$A$3:$K$254,2,FALSE)="SI",VLOOKUP(A63,Iscrizioni!$A$3:$K$254,6,FALSE),"NON ISCRITTO") -> #N/D | I63: =VLOOKUP(A63,Iscrizioni!$A$3:$K$254,7,FALSE) -> #N/D | J63: =VLOOKUP(A63,Iscrizioni!$A$3:$K$254,3,FALSE) -> #N/D | K63: =VLOOKUP(J63,Tabelle!$A$2:$C$90,3,FALSE) -> #N/D | L63: =VLOOKUP(A63,Iscrizioni!$A$3:$K$254,9,FALSE) -> #N/D | M63: =VLOOKUP(A63,Iscrizioni!$A$3:$K$254,8,FALSE) -> #N/D | N63: 60
C64: =B64-'Arrivo ass'!$F$1 -> 0 | D64: =C64*1000/K64 -> #N/D | E64: 61 | F64: 61 | H64: =IF(VLOOKUP(A64,Iscrizioni!$A$3:$K$254,2,FALSE)="SI",VLOOKUP(A64,Iscrizioni!$A$3:$K$254,6,FALSE),"NON ISCRITTO") -> #N/D | I64: =VLOOKUP(A64,Iscrizioni!$A$3:$K$254,7,FALSE) -> #N/D | J64: =VLOOKUP(A64,Iscrizioni!$A$3:$K$254,3,FALSE) -> #N/D | K64: =VLOOKUP(J64,Tabelle!$A$2:$C$90,3,FALSE) -> #N/D | L64: =VLOOKUP(A64,Iscrizioni!$A$3:$K$254,9,FALSE) -> #N/D | M64: =VLOOKUP(A64,Iscrizioni!$A$3:$K$254,8,FALSE) -> #N/D | N64: 61
C65: =B65-'Arrivo ass'!$F$1 -> 0 | D65: =C65*1000/K65 -> #N/D | E65: 62 | F65: 62 | H65: =IF(VLOOKUP(A65,Iscrizioni!$A$3:$K$254,2,FALSE)="SI",VLOOKUP(A65,Iscrizioni!$A$3:$K$254,6,FALSE),"NON ISCRITTO") -> #N/D | I65: =VLOOKUP(A65,Iscrizioni!$A$3:$K$254,7,FALSE) -> #N/D | J65: =VLOOKUP(A65,Iscrizioni!$A$3:$K$254,3,FALSE) -> #N/D | K65: =VLOOKUP(J65,Tabelle!$A$2:$C$90,3,FALSE) -> #N/D | L65: =VLOOKUP(A65,Iscrizioni!$A$3:$K$254,9,FALSE) -> #N/D | M65: =VLOOKUP(A65,Iscrizioni!$A$3:$K$254,8,FALSE) -> #N/D | N65: 62
C66: =B66-'Arrivo ass'!$F$1 -> 0 | D66: =C66*1000/K66 -> #N/D | E66: 63 | F66: 63 | H66: =IF(VLOOKUP(A66,Iscrizioni!$A$3:$K$254,2,FALSE)="SI",VLOOKUP(A66,Iscrizioni!$A$3:$K$254,6,FALSE),"NON ISCRITTO") -> #N/D | I66: =VLOOKUP(A66,Iscrizioni!$A$3:$K$254,7,FALSE) -> #N/D | J66: =VLOOKUP(A66,Iscrizioni!$A$3:$K$254,3,FALSE) -> #N/D | K66: =VLOOKUP(J66,Tabelle!$A$2:$C$90,3,FALSE) -> #N/D | L66: =VLOOKUP(A66,Iscrizioni!$A$3:$K$254,9,FALSE) -> #N/D | M66: =VLOOKUP(A66,Iscrizioni!$A$3:$K$254,8,FALSE) -> #N/D | N66: 63
C67: =B67-'Arrivo ass'!$F$1 -> 0 | D67: =C67*1000/K67 -> #N/D | E67: 64 | F67: 64 | H67: =IF(VLOOKUP(A67,Iscrizioni!$A$3:$K$254,2,FALSE)="SI",VLOOKUP(A67,Iscrizioni!$A$3:$K$254,6,FALSE),"NON ISCRITTO") -> #N/D | I67: =VLOOKUP(A67,Iscrizioni!$A$3:$K$254,7,FALSE) -> #N/D | J67: =VLOOKUP(A67,Iscrizioni!$A$3:$K$254,3,FALSE) -> #N/D | K67: =VLOOKUP(J67,Tabelle!$A$2:$C$90,3,FALSE) -> #N/D | L67: =VLOOKUP(A67,Iscrizioni!$A$3:$K$254,9,FALSE) -> #N/D | M67: =VLOOKUP(A67,Iscrizioni!$A$3:$K$254,8,FALSE) -> #N/D | N67: 64
C68: =B68-'Arrivo ass'!$F$1 -> 0 | D68: =C68*1000/K68 -> #N/D | E68: 65 | F68: 65 | H68: =IF(VLOOKUP(A68,Iscrizioni!$A$3:$K$254,2,FALSE)="SI",VLOOKUP(A68,Iscrizioni!$A$3:$K$254,6,FALSE),"NON ISCRITTO") -> #N/D | I68: =VLOOKUP(A68,Iscrizioni!$A$3:$K$254,7,FALSE) -> #N/D | J68: =VLOOKUP(A68,Iscrizioni!$A$3:$K$254,3,FALSE) -> #N/D | K68: =VLOOKUP(J68,Tabelle!$A$2:$C$90,3,FALSE) -> #N/D | L68: =VLOOKUP(A68,Iscrizioni!$A$3:$K$254,9,FALSE) -> #N/D | M68: =VLOOKUP(A68,Iscrizioni!$A$3:$K$254,8,FALSE) -> #N/D | N68: 65
C69: =B69-'Arrivo ass'!$F$1 -> 0 | D69: =C69*1000/K69 -> #N/D | E69: 66 | F69: 66 | H69: =IF(VLOOKUP(A69,Iscrizioni!$A$3:$K$254,2,FALSE)="SI",VLOOKUP(A69,Iscrizioni!$A$3:$K$254,6,FALSE),"NON ISCRITTO") -> #N/D | I69: =VLOOKUP(A69,Iscrizioni!$A$3:$K$254,7,FALSE) -> #N/D | J69: =VLOOKUP(A69,Iscrizioni!$A$3:$K$254,3,FALSE) -> #N/D | K69: =VLOOKUP(J69,Tabelle!$A$2:$C$90,3,FALSE) -> #N/D | L69: =VLOOKUP(A69,Iscrizioni!$A$3:$K$254,9,FALSE) -> #N/D | M69: =VLOOKUP(A69,Iscrizioni!$A$3:$K$254,8,FALSE) -> #N/D | N69: 66
C70: =B70-'Arrivo ass'!$F$1 -> 0 | D70: =C70*1000/K70 -> #N/D | E70: 67 | F70: 67 | H70: =IF(VLOOKUP(A70,Iscrizioni!$A$3:$K$254,2,FALSE)="SI",VLOOKUP(A70,Iscrizioni!$A$3:$K$254,6,FALSE),"NON ISCRITTO") -> #N/D | I70: =VLOOKUP(A70,Iscrizioni!$A$3:$K$254,7,FALSE) -> #N/D | J70: =VLOOKUP(A70,Iscrizioni!$A$3:$K$254,3,FALSE) -> #N/D | K70: =VLOOKUP(J70,Tabelle!$A$2:$C$90,3,FALSE) -> #N/D | L70: =VLOOKUP(A70,Iscrizioni!$A$3:$K$254,9,FALSE) -> #N/D | M70: =VLOOKUP(A70,Iscrizioni!$A$3:$K$254,8,FALSE) -> #N/D | N70: 67
C71: =B71-'Arrivo ass'!$F$1 -> 0 | D71: =C71*1000/K71 -> #N/D | E71: 68 | F71: 68 | H71: =IF(VLOOKUP(A71,Iscrizioni!$A$3:$K$254,2,FALSE)="SI",VLOOKUP(A71,Iscrizioni!$A$3:$K$254,6,FALSE),"NON ISCRITTO") -> #N/D | I71: =VLOOKUP(A71,Iscrizioni!$A$3:$K$254,7,FALSE) -> #N/D | J71: =VLOOKUP(A71,Iscrizioni!$A$3:$K$254,3,FALSE) -> #N/D | K71: =VLOOKUP(J71,Tabelle!$A$2:$C$90,3,FALSE) -> #N/D | L71: =VLOOKUP(A71,Iscrizioni!$A$3:$K$254,9,FALSE) -> #N/D | M71: =VLOOKUP(A71,Iscrizioni!$A$3:$K$254,8,FALSE) -> #N/D | N71: 68
C72: =B72-'Arrivo ass'!$F$1 -> 0 | D72: =C72*1000/K72 -> #N/D | E72: 69 | F72: 69 | H72: =IF(VLOOKUP(A72,Iscrizioni!$A$3:$K$254,2,FALSE)="SI",VLOOKUP(A72,Iscrizioni!$A$3:$K$254,6,FALSE),"NON ISCRITTO") -> #N/D | I72: =VLOOKUP(A72,Iscrizioni!$A$3:$K$254,7,FALSE) -> #N/D | J72: =VLOOKUP(A72,Iscrizioni!$A$3:$K$254,3,FALSE) -> #N/D | K72: =VLOOKUP(J72,Tabelle!$A$2:$C$90,3,FALSE) -> #N/D | L72: =VLOOKUP(A72,Iscrizioni!$A$3:$K$254,9,FALSE) -> #N/D | M72: =VLOOKUP(A72,Iscrizioni!$A$3:$K$254,8,FALSE) -> #N/D | N72: 69
C73: =B73-'Arrivo ass'!$F$1 -> 0 | D73: =C73*1000/K73 -> #N/D | E73: 70 | F73: 70 | H73: =IF(VLOOKUP(A73,Iscrizioni!$A$3:$K$254,2,FALSE)="SI",VLOOKUP(A73,Iscrizioni!$A$3:$K$254,6,FALSE),"NON ISCRITTO") -> #N/D | I73: =VLOOKUP(A73,Iscrizioni!$A$3:$K$254,7,FALSE) -> #N/D | J73: =VLOOKUP(A73,Iscrizioni!$A$3:$K$254,3,FALSE) -> #N/D | K73: =VLOOKUP(J73,Tabelle!$A$2:$C$90,3,FALSE) -> #N/D | L73: =VLOOKUP(A73,Iscrizioni!$A$3:$K$254,9,FALSE) -> #N/D | M73: =VLOOKUP(A73,Iscrizioni!$A$3:$K$254,8,FALSE) -> #N/D | N73: 70
C74: =B74-'Arrivo ass'!$F$1 -> 0 | D74: =C74*1000/K74 -> #N/D | E74: 71 | F74: 71 | H74: =IF(VLOOKUP(A74,Iscrizioni!$A$3:$K$254,2,FALSE)="SI",VLOOKUP(A74,Iscrizioni!$A$3:$K$254,6,FALSE),"NON ISCRITTO") -> #N/D | I74: =VLOOKUP(A74,Iscrizioni!$A$3:$K$254,7,FALSE) -> #N/D | J74: =VLOOKUP(A74,Iscrizioni!$A$3:$K$254,3,FALSE) -> #N/D | K74: =VLOOKUP(J74,Tabelle!$A$2:$C$90,3,FALSE) -> #N/D | L74: =VLOOKUP(A74,Iscrizioni!$A$3:$K$254,9,FALSE) -> #N/D | M74: =VLOOKUP(A74,Iscrizioni!$A$3:$K$254,8,FALSE) -> #N/D | N74: 71
C75: =B75-'Arrivo ass'!$F$1 -> 0 | D75: =C75*1000/K75 -> #N/D | E75: 72 | F75: 72 | H75: =IF(VLOOKUP(A75,Iscrizioni!$A$3:$K$254,2,FALSE)="SI",VLOOKUP(A75,Iscrizioni!$A$3:$K$254,6,FALSE),"NON ISCRITTO") -> #N/D | I75: =VLOOKUP(A75,Iscrizioni!$A$3:$K$254,7,FALSE) -> #N/D | J75: =VLOOKUP(A75,Iscrizioni!$A$3:$K$254,3,FALSE) -> #N/D | K75: =VLOOKUP(J75,Tabelle!$A$2:$C$90,3,FALSE) -> #N/D | L75: =VLOOKUP(A75,Iscrizioni!$A$3:$K$254,9,FALSE) -> #N/D | M75: =VLOOKUP(A75,Iscrizioni!$A$3:$K$254,8,FALSE) -> #N/D | N75: 72
C76: =B76-'Arrivo ass'!$F$1 -> 0 | D76: =C76*1000/K76 -> #N/D | E76: 73 | F76: 73 | H76: =IF(VLOOKUP(A76,Iscrizioni!$A$3:$K$254,2,FALSE)="SI",VLOOKUP(A76,Iscrizioni!$A$3:$K$254,6,FALSE),"NON ISCRITTO") -> #N/D | I76: =VLOOKUP(A76,Iscrizioni!$A$3:$K$254,7,FALSE) -> #N/D | J76: =VLOOKUP(A76,Iscrizioni!$A$3:$K$254,3,FALSE) -> #N/D | K76: =VLOOKUP(J76,Tabelle!$A$2:$C$90,3,FALSE) -> #N/D | L76: =VLOOKUP(A76,Iscrizioni!$A$3:$K$254,9,FALSE) -> #N/D | M76: =VLOOKUP(A76,Iscrizioni!$A$3:$K$254,8,FALSE) -> #N/D | N76: 73
C77: =B77-'Arrivo ass'!$F$1 -> 0 | D77: =C77*1000/K77 -> #N/D | E77: 74 | F77: 74 | H77: =IF(VLOOKUP(A77,Iscrizioni!$A$3:$K$254,2,FALSE)="SI",VLOOKUP(A77,Iscrizioni!$A$3:$K$254,6,FALSE),"NON ISCRITTO") -> #N/D | I77: =VLOOKUP(A77,Iscrizioni!$A$3:$K$254,7,FALSE) -> #N/D | J77: =VLOOKUP(A77,Iscrizioni!$A$3:$K$254,3,FALSE) -> #N/D | K77: =VLOOKUP(J77,Tabelle!$A$2:$C$90,3,FALSE) -> #N/D | L77: =VLOOKUP(A77,Iscrizioni!$A$3:$K$254,9,FALSE) -> #N/D | M77: =VLOOKUP(A77,Iscrizioni!$A$3:$K$254,8,FALSE) -> #N/D | N77: 74
C78: =B78-'Arrivo ass'!$F$1 -> 0 | D78: =C78*1000/K78 -> #N/D | E78: 75 | F78: 75 | H78: =IF(VLOOKUP(A78,Iscrizioni!$A$3:$K$254,2,FALSE)="SI",VLOOKUP(A78,Iscrizioni!$A$3:$K$254,6,FALSE),"NON ISCRITTO") -> #N/D | I78: =VLOOKUP(A78,Iscrizioni!$A$3:$K$254,7,FALSE) -> #N/D | J78: =VLOOKUP(A78,Iscrizioni!$A$3:$K$254,3,FALSE) -> #N/D | K78: =VLOOKUP(J78,Tabelle!$A$2:$C$90,3,FALSE) -> #N/D | L78: =VLOOKUP(A78,Iscrizioni!$A$3:$K$254,9,FALSE) -> #N/D | M78: =VLOOKUP(A78,Iscrizioni!$A$3:$K$254,8,FALSE) -> #N/D | N78: 75
C79: =B79-'Arrivo ass'!$F$1 -> 0 | D79: =C79*1000/K79 -> #N/D | E79: 76 | F79: 76 | H79: =IF(VLOOKUP(A79,Iscrizioni!$A$3:$K$254,2,FALSE)="SI",VLOOKUP(A79,Iscrizioni!$A$3:$K$254,6,FALSE),"NON ISCRITTO") -> #N/D | I79: =VLOOKUP(A79,Iscrizioni!$A$3:$K$254,7,FALSE) -> #N/D | J79: =VLOOKUP(A79,Iscrizioni!$A$3:$K$254,3,FALSE) -> #N/D | K79: =VLOOKUP(J79,Tabelle!$A$2:$C$90,3,FALSE) -> #N/D | L79: =VLOOKUP(A79,Iscrizioni!$A$3:$K$254,9,FALSE) -> #N/D | M79: =VLOOKUP(A79,Iscrizioni!$A$3:$K$254,8,FALSE) -> #N/D | N79: 76
C80: =B80-'Arrivo ass'!$F$1 -> 0 | D80: =C80*1000/K80 -> #N/D | E80: 77 | F80: 77 | H80: =IF(VLOOKUP(A80,Iscrizioni!$A$3:$K$254,2,FALSE)="SI",VLOOKUP(A80,Iscrizioni!$A$3:$K$254,6,FALSE),"NON ISCRITTO") -> #N/D | I80: =VLOOKUP(A80,Iscrizioni!$A$3:$K$254,7,FALSE) -> #N/D | J80: =VLOOKUP(A80,Iscrizioni!$A$3:$K$254,3,FALSE) -> #N/D | K80: =VLOOKUP(J80,Tabelle!$A$2:$C$90,3,FALSE) -> #N/D | L80: =VLOOKUP(A80,Iscrizioni!$A$3:$K$254,9,FALSE) -> #N/D | M80: =VLOOKUP(A80,Iscrizioni!$A$3:$K$254,8,FALSE) -> #N/D | N80: 77
C81: =B81-'Arrivo ass'!$F$1 -> 0 | D81: =C81*1000/K81 -> #N/D | E81: 78 | F81: 78 | H81: =IF(VLOOKUP(A81,Iscrizioni!$A$3:$K$254,2,FALSE)="SI",VLOOKUP(A81,Iscrizioni!$A$3:$K$254,6,FALSE),"NON ISCRITTO") -> #N/D | I81: =VLOOKUP(A81,Iscrizioni!$A$3:$K$254,7,FALSE) -> #N/D | J81: =VLOOKUP(A81,Iscrizioni!$A$3:$K$254,3,FALSE) -> #N/D | K81: =VLOOKUP(J81,Tabelle!$A$2:$C$90,3,FALSE) -> #N/D | L81: =VLOOKUP(A81,Iscrizioni!$A$3:$K$254,9,FALSE) -> #N/D | M81: =VLOOKUP(A81,Iscrizioni!$A$3:$K$254,8,FALSE) -> #N/D | N81: 78
C82: =B82-'Arrivo ass'!$F$1 -> 0 | D82: =C82*1000/K82 -> #N/D | E82: 79 | F82: 79 | H82: =IF(VLOOKUP(A82,Iscrizioni!$A$3:$K$254,2,FALSE)="SI",VLOOKUP(A82,Iscrizioni!$A$3:$K$254,6,FALSE),"NON ISCRITTO") -> #N/D | I82: =VLOOKUP(A82,Iscrizioni!$A$3:$K$254,7,FALSE) -> #N/D | J82: =VLOOKUP(A82,Iscrizioni!$A$3:$K$254,3,FALSE) -> #N/D | K82: =VLOOKUP(J82,Tabelle!$A$2:$C$90,3,FALSE) -> #N/D | L82: =VLOOKUP(A82,Iscrizioni!$A$3:$K$254,9,FALSE) -> #N/D | M82: =VLOOKUP(A82,Iscrizioni!$A$3:$K$254,8,FALSE) -> #N/D | N82: 79
C83: =B83-'Arrivo ass'!$F$1 -> 0 | D83: =C83*1000/K83 -> #N/D | E83: 80 | F83: 80 | H83: =IF(VLOOKUP(A83,Iscrizioni!$A$3:$K$254,2,FALSE)="SI",VLOOKUP(A83,Iscrizioni!$A$3:$K$254,6,FALSE),"NON ISCRITTO") -> #N/D | I83: =VLOOKUP(A83,Iscrizioni!$A$3:$K$254,7,FALSE) -> #N/D | J83: =VLOOKUP(A83,Iscrizioni!$A$3:$K$254,3,FALSE) -> #N/D | K83: =VLOOKUP(J83,Tabelle!$A$2:$C$90,3,FALSE) -> #N/D | L83: =VLOOKUP(A83,Iscrizioni!$A$3:$K$254,9,FALSE) -> #N/D | M83: =VLOOKUP(A83,Iscrizioni!$A$3:$K$254,8,FALSE) -> #N/D | N83: 80
C84: =B84-'Arrivo ass'!$F$1 -> 0 | D84: =C84*1000/K84 -> #N/D | E84: 81 | F84: 81 | H84: =IF(VLOOKUP(A84,Iscrizioni!$A$3:$K$254,2,FALSE)="SI",VLOOKUP(A84,Iscrizioni!$A$3:$K$254,6,FALSE),"NON ISCRITTO") -> #N/D | I84: =VLOOKUP(A84,Iscrizioni!$A$3:$K$254,7,FALSE) -> #N/D | J84: =VLOOKUP(A84,Iscrizioni!$A$3:$K$254,3,FALSE) -> #N/D | K84: =VLOOKUP(J84,Tabelle!$A$2:$C$90,3,FALSE) -> #N/D | L84: =VLOOKUP(A84,Iscrizioni!$A$3:$K$254,9,FALSE) -> #N/D | M84: =VLOOKUP(A84,Iscrizioni!$A$3:$K$254,8,FALSE) -> #N/D | N84: 81
C85: =B85-'Arrivo ass'!$F$1 -> 0 | D85: =C85*1000/K85 -> #N/D | E85: 82 | F85: 82 | H85: =IF(VLOOKUP(A85,Iscrizioni!$A$3:$K$254,2,FALSE)="SI",VLOOKUP(A85,Iscrizioni!$A$3:$K$254,6,FALSE),"NON ISCRITTO") -> #N/D | I85: =VLOOKUP(A85,Iscrizioni!$A$3:$K$254,7,FALSE) -> #N/D | J85: =VLOOKUP(A85,Iscrizioni!$A$3:$K$254,3,FALSE) -> #N/D | K85: =VLOOKUP(J85,Tabelle!$A$2:$C$90,3,FALSE) -> #N/D | L85: =VLOOKUP(A85,Iscrizioni!$A$3:$K$254,9,FALSE) -> #N/D | M85: =VLOOKUP(A85,Iscrizioni!$A$3:$K$254,8,FALSE) -> #N/D | N85: 82
C86: =B86-'Arrivo ass'!$F$1 -> 0 | D86: =C86*1000/K86 -> #N/D | E86: 83 | F86: 83 | H86: =IF(VLOOKUP(A86,Iscrizioni!$A$3:$K$254,2,FALSE)="SI",VLOOKUP(A86,Iscrizioni!$A$3:$K$254,6,FALSE),"NON ISCRITTO") -> #N/D | I86: =VLOOKUP(A86,Iscrizioni!$A$3:$K$254,7,FALSE) -> #N/D | J86: =VLOOKUP(A86,Iscrizioni!$A$3:$K$254,3,FALSE) -> #N/D | K86: =VLOOKUP(J86,Tabelle!$A$2:$C$90,3,FALSE) -> #N/D | L86: =VLOOKUP(A86,Iscrizioni!$A$3:$K$254,9,FALSE) -> #N/D | M86: =VLOOKUP(A86,Iscrizioni!$A$3:$K$254,8,FALSE) -> #N/D | N86: 83
C87: =B87-'Arrivo ass'!$F$1 -> 0 | D87: =C87*1000/K87 -> #N/D | E87: 84 | F87: 84 | H87: =IF(VLOOKUP(A87,Iscrizioni!$A$3:$K$254,2,FALSE)="SI",VLOOKUP(A87,Iscrizioni!$A$3:$K$254,6,FALSE),"NON ISCRITTO") -> #N/D | I87: =VLOOKUP(A87,Iscrizioni!$A$3:$K$254,7,FALSE) -> #N/D | J87: =VLOOKUP(A87,Iscrizioni!$A$3:$K$254,3,FALSE) -> #N/D | K87: =VLOOKUP(J87,Tabelle!$A$2:$C$90,3,FALSE) -> #N/D | L87: =VLOOKUP(A87,Iscrizioni!$A$3:$K$254,9,FALSE) -> #N/D | M87: =VLOOKUP(A87,Iscrizioni!$A$3:$K$254,8,FALSE) -> #N/D | N87: 84
C88: =B88-'Arrivo ass'!$F$1 -> 0 | D88: =C88*1000/K88 -> #N/D | E88: 85 | F88: 85 | H88: =IF(VLOOKUP(A88,Iscrizioni!$A$3:$K$254,2,FALSE)="SI",VLOOKUP(A88,Iscrizioni!$A$3:$K$254,6,FALSE),"NON ISCRITTO") -> #N/D | I88: =VLOOKUP(A88,Iscrizioni!$A$3:$K$254,7,FALSE) -> #N/D | J88: =VLOOKUP(A88,Iscrizioni!$A$3:$K$254,3,FALSE) -> #N/D | K88: =VLOOKUP(J88,Tabelle!$A$2:$C$90,3,FALSE) -> #N/D | L88: =VLOOKUP(A88,Iscrizioni!$A$3:$K$254,9,FALSE) -> #N/D | M88: =VLOOKUP(A88,Iscrizioni!$A$3:$K$254,8,FALSE) -> #N/D | N88: 85
C89: =B89-'Arrivo ass'!$F$1 -> 0 | D89: =C89*1000/K89 -> #N/D | E89: 86 | F89: 86 | H89: =IF(VLOOKUP(A89,Iscrizioni!$A$3:$K$254,2,FALSE)="SI",VLOOKUP(A89,Iscrizioni!$A$3:$K$254,6,FALSE),"NON ISCRITTO") -> #N/D | I89: =VLOOKUP(A89,Iscrizioni!$A$3:$K$254,7,FALSE) -> #N/D | J89: =VLOOKUP(A89,Iscrizioni!$A$3:$K$254,3,FALSE) -> #N/D | K89: =VLOOKUP(J89,Tabelle!$A$2:$C$90,3,FALSE) -> #N/D | L89: =VLOOKUP(A89,Iscrizioni!$A$3:$K$254,9,FALSE) -> #N/D | M89: =VLOOKUP(A89,Iscrizioni!$A$3:$K$254,8,FALSE) -> #N/D | N89: 86
C90: =B90-'Arrivo ass'!$F$1 -> 0 | D90: =C90*1000/K90 -> #N/D | E90: 87 | F90: 87 | H90: =IF(VLOOKUP(A90,Iscrizioni!$A$3:$K$254,2,FALSE)="SI",VLOOKUP(A90,Iscrizioni!$A$3:$K$254,6,FALSE),"NON ISCRITTO") -> #N/D | I90: =VLOOKUP(A90,Iscrizioni!$A$3:$K$254,7,FALSE) -> #N/D | J90: =VLOOKUP(A90,Iscrizioni!$A$3:$K$254,3,FALSE) -> #N/D | K90: =VLOOKUP(J90,Tabelle!$A$2:$C$90,3,FALSE) -> #N/D | L90: =VLOOKUP(A90,Iscrizioni!$A$3:$K$254,9,FALSE) -> #N/D | M90: =VLOOKUP(A90,Iscrizioni!$A$3:$K$254,8,FALSE) -> #N/D | N90: 87
C91: =B91-'Arrivo ass'!$F$1 -> 0 | D91: =C91*1000/K91 -> #N/D | E91: 88 | F91: 88 | H91: =IF(VLOOKUP(A91,Iscrizioni!$A$3:$K$254,2,FALSE)="SI",VLOOKUP(A91,Iscrizioni!$A$3:$K$254,6,FALSE),"NON ISCRITTO") -> #N/D | I91: =VLOOKUP(A91,Iscrizioni!$A$3:$K$254,7,FALSE) -> #N/D | J91: =VLOOKUP(A91,Iscrizioni!$A$3:$K$254,3,FALSE) -> #N/D | K91: =VLOOKUP(J91,Tabelle!$A$2:$C$90,3,FALSE) -> #N/D | L91: =VLOOKUP(A91,Iscrizioni!$A$3:$K$254,9,FALSE) -> #N/D | M91: =VLOOKUP(A91,Iscrizioni!$A$3:$K$254,8,FALSE) -> #N/D | N91: 88
C92: =B92-'Arrivo ass'!$F$1 -> 0 | D92: =C92*1000/K92 -> #N/D | E92: 89 | F92: 89 | H92: =IF(VLOOKUP(A92,Iscrizioni!$A$3:$K$254,2,FALSE)="SI",VLOOKUP(A92,Iscrizioni!$A$3:$K$254,6,FALSE),"NON ISCRITTO") -> #N/D | I92: =VLOOKUP(A92,Iscrizioni!$A$3:$K$254,7,FALSE) -> #N/D | J92: =VLOOKUP(A92,Iscrizioni!$A$3:$K$254,3,FALSE) -> #N/D | K92: =VLOOKUP(J92,Tabelle!$A$2:$C$90,3,FALSE) -> #N/D | L92: =VLOOKUP(A92,Iscrizioni!$A$3:$K$254,9,FALSE) -> #N/D | M92: =VLOOKUP(A92,Iscrizioni!$A$3:$K$254,8,FALSE) -> #N/D | N92: 89
C93: =B93-'Arrivo ass'!$F$1 -> 0 | D93: =C93*1000/K93 -> #N/D | E93: 90 | F93: 90 | H93: =IF(VLOOKUP(A93,Iscrizioni!$A$3:$K$254,2,FALSE)="SI",VLOOKUP(A93,Iscrizioni!$A$3:$K$254,6,FALSE),"NON ISCRITTO") -> #N/D | I93: =VLOOKUP(A93,Iscrizioni!$A$3:$K$254,7,FALSE) -> #N/D | J93: =VLOOKUP(A93,Iscrizioni!$A$3:$K$254,3,FALSE) -> #N/D | K93: =VLOOKUP(J93,Tabelle!$A$2:$C$90,3,FALSE) -> #N/D | L93: =VLOOKUP(A93,Iscrizioni!$A$3:$K$254,9,FALSE) -> #N/D | M93: =VLOOKUP(A93,Iscrizioni!$A$3:$K$254,8,FALSE) -> #N/D | N93: 90
C94: =B94-'Arrivo ass'!$F$1 -> 0 | D94: =C94*1000/K94 -> #N/D | E94: 91 | F94: 91 | H94: =IF(VLOOKUP(A94,Iscrizioni!$A$3:$K$254,2,FALSE)="SI",VLOOKUP(A94,Iscrizioni!$A$3:$K$254,6,FALSE),"NON ISCRITTO") -> #N/D | I94: =VLOOKUP(A94,Iscrizioni!$A$3:$K$254,7,FALSE) -> #N/D | J94: =VLOOKUP(A94,Iscrizioni!$A$3:$K$254,3,FALSE) -> #N/D | K94: =VLOOKUP(J94,Tabelle!$A$2:$C$90,3,FALSE) -> #N/D | L94: =VLOOKUP(A94,Iscrizioni!$A$3:$K$254,9,FALSE) -> #N/D | M94: =VLOOKUP(A94,Iscrizioni!$A$3:$K$254,8,FALSE) -> #N/D | N94: 91
C95: =B95-'Arrivo ass'!$F$1 -> 0 | D95: =C95*1000/K95 -> #N/D | E95: 92 | F95: 92 | H95: =IF(VLOOKUP(A95,Iscrizioni!$A$3:$K$254,2,FALSE)="SI",VLOOKUP(A95,Iscrizioni!$A$3:$K$254,6,FALSE),"NON ISCRITTO") -> #N/D | I95: =VLOOKUP(A95,Iscrizioni!$A$3:$K$254,7,FALSE) -> #N/D | J95: =VLOOKUP(A95,Iscrizioni!$A$3:$K$254,3,FALSE) -> #N/D | K95: =VLOOKUP(J95,Tabelle!$A$2:$C$90,3,FALSE) -> #N/D | L95: =VLOOKUP(A95,Iscrizioni!$A$3:$K$254,9,FALSE) -> #N/D | M95: =VLOOKUP(A95,Iscrizioni!$A$3:$K$254,8,FALSE) -> #N/D | N95: 92
C96: =B96-'Arrivo ass'!$F$1 -> 0 | D96: =C96*1000/K96 -> #N/D | E96: 93 | F96: 93 | H96: =IF(VLOOKUP(A96,Iscrizioni!$A$3:$K$254,2,FALSE)="SI",VLOOKUP(A96,Iscrizioni!$A$3:$K$254,6,FALSE),"NON ISCRITTO") -> #N/D | I96: =VLOOKUP(A96,Iscrizioni!$A$3:$K$254,7,FALSE) -> #N/D | J96: =VLOOKUP(A96,Iscrizioni!$A$3:$K$254,3,FALSE) -> #N/D | K96: =VLOOKUP(J96,Tabelle!$A$2:$C$90,3,FALSE) -> #N/D | L96: =VLOOKUP(A96,Iscrizioni!$A$3:$K$254,9,FALSE) -> #N/D | M96: =VLOOKUP(A96,Iscrizioni!$A$3:$K$254,8,FALSE) -> #N/D | N96: 93
C97: =B97-'Arrivo ass'!$F$1 -> 0 | D97: =C97*1000/K97 -> #N/D | E97: 94 | F97: 94 | H97: =IF(VLOOKUP(A97,Iscrizioni!$A$3:$K$254,2,FALSE)="SI",VLOOKUP(A97,Iscrizioni!$A$3:$K$254,6,FALSE),"NON ISCRITTO") -> #N/D | I97: =VLOOKUP(A97,Iscrizioni!$A$3:$K$254,7,FALSE) -> #N/D | J97: =VLOOKUP(A97,Iscrizioni!$A$3:$K$254,3,FALSE) -> #N/D | K97: =VLOOKUP(J97,Tabelle!$A$2:$C$90,3,FALSE) -> #N/D | L97: =VLOOKUP(A97,Iscrizioni!$A$3:$K$254,9,FALSE) -> #N/D | M97: =VLOOKUP(A97,Iscrizioni!$A$3:$K$254,8,FALSE) -> #N/D | N97: 94
C98: =B98-'Arrivo ass'!$F$1 -> 0 | D98: =C98*1000/K98 -> #N/D | E98: 95 | F98: 95 | H98: =IF(VLOOKUP(A98,Iscrizioni!$A$3:$K$254,2,FALSE)="SI",VLOOKUP(A98,Iscrizioni!$A$3:$K$254,6,FALSE),"NON ISCRITTO") -> #N/D | I98: =VLOOKUP(A98,Iscrizioni!$A$3:$K$254,7,FALSE) -> #N/D | J98: =VLOOKUP(A98,Iscrizioni!$A$3:$K$254,3,FALSE) -> #N/D | K98: =VLOOKUP(J98,Tabelle!$A$2:$C$90,3,FALSE) -> #N/D | L98: =VLOOKUP(A98,Iscrizioni!$A$3:$K$254,9,FALSE) -> #N/D | M98: =VLOOKUP(A98,Iscrizioni!$A$3:$K$254,8,FALSE) -> #N/D | N98: 95
C99: =B99-'Arrivo ass'!$F$1 -> 0 | D99: =C99*1000/K99 -> #N/D | E99: 96 | F99: 96 | H99: =IF(VLOOKUP(A99,Iscrizioni!$A$3:$K$254,2,FALSE)="SI",VLOOKUP(A99,Iscrizioni!$A$3:$K$254,6,FALSE),"NON ISCRITTO") -> #N/D | I99: =VLOOKUP(A99,Iscrizioni!$A$3:$K$254,7,FALSE) -> #N/D | J99: =VLOOKUP(A99,Iscrizioni!$A$3:$K$254,3,FALSE) -> #N/D | K99: =VLOOKUP(J99,Tabelle!$A$2:$C$90,3,FALSE) -> #N/D | L99: =VLOOKUP(A99,Iscrizioni!$A$3:$K$254,9,FALSE) -> #N/D | M99: =VLOOKUP(A99,Iscrizioni!$A$3:$K$254,8,FALSE) -> #N/D | N99: 96
C100: =B100-'Arrivo ass'!$F$1 -> 0 | D100: =C100*1000/K100 -> #N/D | E100: 97 | F100: 97 | H100: =IF(VLOOKUP(A100,Iscrizioni!$A$3:$K$254,2,FALSE)="SI",VLOOKUP(A100,Iscrizioni!$A$3:$K$254,6,FALSE),"NON ISCRITTO") -> #N/D | I100: =VLOOKUP(A100,Iscrizioni!$A$3:$K$254,7,FALSE) -> #N/D | J100: =VLOOKUP(A100,Iscrizioni!$A$3:$K$254,3,FALSE) -> #N/D | K100: =VLOOKUP(J100,Tabelle!$A$2:$C$90,3,FALSE) -> #N/D | L100: =VLOOKUP(A100,Iscrizioni!$A$3:$K$254,9,FALSE) -> #N/D | M100: =VLOOKUP(A100,Iscrizioni!$A$3:$K$254,8,FALSE) -> #N/D | N100: 97
C101: =B101-'Arrivo ass'!$F$1 -> 0 | D101: =C101*1000/K101 -> #N/D | E101: 98 | F101: 98 | H101: =IF(VLOOKUP(A101,Iscrizioni!$A$3:$K$254,2,FALSE)="SI",VLOOKUP(A101,Iscrizioni!$A$3:$K$254,6,FALSE),"NON ISCRITTO") -> #N/D | I101: =VLOOKUP(A101,Iscrizioni!$A$3:$K$254,7,FALSE) -> #N/D | J101: =VLOOKUP(A101,Iscrizioni!$A$3:$K$254,3,FALSE) -> #N/D | K101: =VLOOKUP(J101,Tabelle!$A$2:$C$90,3,FALSE) -> #N/D | L101: =VLOOKUP(A101,Iscrizioni!$A$3:$K$254,9,FALSE) -> #N/D | M101: =VLOOKUP(A101,Iscrizioni!$A$3:$K$254,8,FALSE) -> #N/D | N101: 98
C102: =B102-'Arrivo ass'!$F$1 -> 0 | D102: =C102*1000/K102 -> #N/D | E102: 99 | F102: 99 | H102: =IF(VLOOKUP(A102,Iscrizioni!$A$3:$K$254,2,FALSE)="SI",VLOOKUP(A102,Iscrizioni!$A$3:$K$254,6,FALSE),"NON ISCRITTO") -> #N/D | I102: =VLOOKUP(A102,Iscrizioni!$A$3:$K$254,7,FALSE) -> #N/D | J102: =VLOOKUP(A102,Iscrizioni!$A$3:$K$254,3,FALSE) -> #N/D | K102: =VLOOKUP(J102,Tabelle!$A$2:$C$90,3,FALSE) -> #N/D | L102: =VLOOKUP(A102,Iscrizioni!$A$3:$K$254,9,FALSE) -> #N/D | M102: =VLOOKUP(A102,Iscrizioni!$A$3:$K$254,8,FALSE) -> #N/D | N102: 99
C103: =B103-'Arrivo ass'!$F$1 -> 0 | D103: =C103*1000/K103 -> #N/D | E103: 100 | F103: 100 | H103: =IF(VLOOKUP(A103,Iscrizioni!$A$3:$K$254,2,FALSE)="SI",VLOOKUP(A103,Iscrizioni!$A$3:$K$254,6,FALSE),"NON ISCRITTO") -> #N/D | I103: =VLOOKUP(A103,Iscrizioni!$A$3:$K$254,7,FALSE) -> #N/D | J103: =VLOOKUP(A103,Iscrizioni!$A$3:$K$254,3,FALSE) -> #N/D | K103: =VLOOKUP(J103,Tabelle!$A$2:$C$90,3,FALSE) -> #N/D | L103: =VLOOKUP(A103,Iscrizioni!$A$3:$K$254,9,FALSE) -> #N/D | M103: =VLOOKUP(A103,Iscrizioni!$A$3:$K$254,8,FALSE) -> #N/D | N103: 100
C104: =B104-'Arrivo ass'!$F$1 -> 0 | D104: =C104*1000/K104 -> #N/D | E104: 101 | F104: 101 | H104: =IF(VLOOKUP(A104,Iscrizioni!$A$3:$K$254,2,FALSE)="SI",VLOOKUP(A104,Iscrizioni!$A$3:$K$254,6,FALSE),"NON ISCRITTO") -> #N/D | I104: =VLOOKUP(A104,Iscrizioni!$A$3:$K$254,7,FALSE) -> #N/D | J104: =VLOOKUP(A104,Iscrizioni!$A$3:$K$254,3,FALSE) -> #N/D | K104: =VLOOKUP(J104,Tabelle!$A$2:$C$90,3,FALSE) -> #N/D | L104: =VLOOKUP(A104,Iscrizioni!$A$3:$K$254,9,FALSE) -> #N/D | M104: =VLOOKUP(A104,Iscrizioni!$A$3:$K$254,8,FALSE) -> #N/D | N104: 101
C105: =B105-'Arrivo ass'!$F$1 -> 0 | D105: =C105*1000/K105 -> #N/D | E105: 102 | F105: 102 | H105: =IF(VLOOKUP(A105,Iscrizioni!$A$3:$K$254,2,FALSE)="SI",VLOOKUP(A105,Iscrizioni!$A$3:$K$254,6,FALSE),"NON ISCRITTO") -> #N/D | I105: =VLOOKUP(A105,Iscrizioni!$A$3:$K$254,7,FALSE) -> #N/D | J105: =VLOOKUP(A105,Iscrizioni!$A$3:$K$254,3,FALSE) -> #N/D | K105: =VLOOKUP(J105,Tabelle!$A$2:$C$90,3,FALSE) -> #N/D | L105: =VLOOKUP(A105,Iscrizioni!$A$3:$K$254,9,FALSE) -> #N/D | M105: =VLOOKUP(A105,Iscrizioni!$A$3:$K$254,8,FALSE) -> #N/D | N105: 102
C106: =B106-'Arrivo ass'!$F$1 -> 0 | D106: =C106*1000/K106 -> #N/D | E106: 103 | F106: 103 | H106: =IF(VLOOKUP(A106,Iscrizioni!$A$3:$K$254,2,FALSE)="SI",VLOOKUP(A106,Iscrizioni!$A$3:$K$254,6,FALSE),"NON ISCRITTO") -> #N/D | I106: =VLOOKUP(A106,Iscrizioni!$A$3:$K$254,7,FALSE) -> #N/D | J106: =VLOOKUP(A106,Iscrizioni!$A$3:$K$254,3,FALSE) -> #N/D | K106: =VLOOKUP(J106,Tabelle!$A$2:$C$90,3,FALSE) -> #N/D | L106: =VLOOKUP(A106,Iscrizioni!$A$3:$K$254,9,FALSE) -> #N/D | M106: =VLOOKUP(A106,Iscrizioni!$A$3:$K$254,8,FALSE) -> #N/D | N106: 103
C107: =B107-'Arrivo ass'!$F$1 -> 0 | D107: =C107*1000/K107 -> #N/D | E107: 104 | F107: 104 | H107: =IF(VLOOKUP(A107,Iscrizioni!$A$3:$K$254,2,FALSE)="SI",VLOOKUP(A107,Iscrizioni!$A$3:$K$254,6,FALSE),"NON ISCRITTO") -> #N/D | I107: =VLOOKUP(A107,Iscrizioni!$A$3:$K$254,7,FALSE) -> #N/D | J107: =VLOOKUP(A107,Iscrizioni!$A$3:$K$254,3,FALSE) -> #N/D | K107: =VLOOKUP(J107,Tabelle!$A$2:$C$90,3,FALSE) -> #N/D | L107: =VLOOKUP(A107,Iscrizioni!$A$3:$K$254,9,FALSE) -> #N/D | M107: =VLOOKUP(A107,Iscrizioni!$A$3:$K$254,8,FALSE) -> #N/D | N107: 104
C108: =B108-'Arrivo ass'!$F$1 -> 0 | D108: =C108*1000/K108 -> #N/D | E108: 105 | F108: 105 | H108: =IF(VLOOKUP(A108,Iscrizioni!$A$3:$K$254,2,FALSE)="SI",VLOOKUP(A108,Iscrizioni!$A$3:$K$254,6,FALSE),"NON ISCRITTO") -> #N/D | I108: =VLOOKUP(A108,Iscrizioni!$A$3:$K$254,7,FALSE) -> #N/D | J108: =VLOOKUP(A108,Iscrizioni!$A$3:$K$254,3,FALSE) -> #N/D | K108: =VLOOKUP(J108,Tabelle!$A$2:$C$90,3,FALSE) -> #N/D | L108: =VLOOKUP(A108,Iscrizioni!$A$3:$K$254,9,FALSE) -> #N/D | M108: =VLOOKUP(A108,Iscrizioni!$A$3:$K$254,8,FALSE) -> #N/D | N108: 105
C109: =B109-'Arrivo ass'!$F$1 -> 0 | D109: =C109*1000/K109 -> #N/D | E109: 106 | F109: 106 | H109: =IF(VLOOKUP(A109,Iscrizioni!$A$3:$K$254,2,FALSE)="SI",VLOOKUP(A109,Iscrizioni!$A$3:$K$254,6,FALSE),"NON ISCRITTO") -> #N/D | I109: =VLOOKUP(A109,Iscrizioni!$A$3:$K$254,7,FALSE) -> #N/D | J109: =VLOOKUP(A109,Iscrizioni!$A$3:$K$254,3,FALSE) -> #N/D | K109: =VLOOKUP(J109,Tabelle!$A$2:$C$90,3,FALSE) -> #N/D | L109: =VLOOKUP(A109,Iscrizioni!$A$3:$K$254,9,FALSE) -> #N/D | M109: =VLOOKUP(A109,Iscrizioni!$A$3:$K$254,8,FALSE) -> #N/D | N109: 106
C110: =B110-'Arrivo ass'!$F$1 -> 0 | D110: =C110*1000/K110 -> #N/D | E110: 107 | F110: 107 | H110: =IF(VLOOKUP(A110,Iscrizioni!$A$3:$K$254,2,FALSE)="SI",VLOOKUP(A110,Iscrizioni!$A$3:$K$254,6,FALSE),"NON ISCRITTO") -> #N/D | I110: =VLOOKUP(A110,Iscrizioni!$A$3:$K$254,7,FALSE) -> #N/D | J110: =VLOOKUP(A110,Iscrizioni!$A$3:$K$254,3,FALSE) -> #N/D | K110: =VLOOKUP(J110,Tabelle!$A$2:$C$90,3,FALSE) -> #N/D | L110: =VLOOKUP(A110,Iscrizioni!$A$3:$K$254,9,FALSE) -> #N/D | M110: =VLOOKUP(A110,Iscrizioni!$A$3:$K$254,8,FALSE) -> #N/D | N110: 107