F1: iscrizioni Fitzcup 2009
A2: N° vel. | B2: Conf. | C2: ID classe | D2: classe | E2: YS | F2: nome skipper | G2: Prodiere | H2: cellulare | I2: Circolo Velico | J2: zona FIV | K2: e-mail | L2: part.CVL | M2: part.4venti
A3: 1 r | B3: SI | C3: 56 - RS Vision | D3: =VLOOKUP(C3,Tabelle!$A$2:$C$90,2,FALSE) -> RS Vision | E3: =VLOOKUP(C3,Tabelle!$A$2:$C$90,3,FALSE) -> 1079 | F3: Zamboni Daniel | G3: Luppi Veronica | I3: CNBrenzone | J3: XIV | L3: no | M3: no | O3: =zählen -> #NOME?
A4: 1 t | B4: SI | C4: 70 - Trident 16 Cna | D4: =VLOOKUP(C4,Tabelle!$A$2:$C$90,2,FALSE) -> Trident 16 Cna | E4: =VLOOKUP(C4,Tabelle!$A$2:$C$90,3,FALSE) -> 1181 | F4: Agostini Andrea | G4: Vascellari Alessandro - Zucchetti Giulia | H4: 3207099208 | I4: ASS Sport VC Venezia | J4: XII | K4: a.ago74@gmail.com | L4: si | M4: no
A5: 2 | B5: SI | C5: 70 - Trident 16 Cna | D5: =VLOOKUP(C5,Tabelle!$A$2:$C$90,2,FALSE) -> Trident 16 Cna | E5: =VLOOKUP(C5,Tabelle!$A$2:$C$90,3,FALSE) -> 1181 | F5: Marcato Alessio | G5: Angelin Alessia-Basso Emi | H5: 3490535497 | I5: CV Casanova | J5: XII | K5: alessio.marcato@libero.it | L5: si | M5: no
A6: 3 f | B6: SI | C6: 18 - FD | D6: =VLOOKUP(C6,Tabelle!$A$2:$C$90,2,FALSE) -> FD | E6: =VLOOKUP(C6,Tabelle!$A$2:$C$90,3,FALSE) -> 880 | F6: Masturzo Vincenzo | G6: Masturzo Giuseppe | H6: 3356563796 | I6: CN Marina di Alimuri | J6: V | K6: giuseppe@oleificimasturzo.it | L6: no | M6: no
A7: 3 t | B7: SI | C7: 70 - Trident 16 Cna | D7: =VLOOKUP(C7,Tabelle!$A$2:$C$90,2,FALSE) -> Trident 16 Cna | E7: =VLOOKUP(C7,Tabelle!$A$2:$C$90,3,FALSE) -> 1181 | F7: Di Leonardo Carlo | G7: Pani Martino - Pellicci Silvia | H7: 3294238183 | I7: AACVC Venezia Vela | J7: XII | K7: carlodileonardo@tin.it | L7: si | M7: no
A8: 4 f | B8: SI | C8: 22 - FJ | D8: =VLOOKUP(C8,Tabelle!$A$2:$C$90,2,FALSE) -> FJ | E8: =VLOOKUP(C8,Tabelle!$A$2:$C$90,3,FALSE) -> 1118 | F8: Bolis Ezio | G8: Offer Silvia | H8: 3382648512 | I8: VC Campione del Garda | J8: XIV | K8: ezio.bolis@yahoo.it | L8: no | M8: no
A9: 4 t | B9: SI | C9: 70 - Trident 16 Cna | D9: =VLOOKUP(C9,Tabelle!$A$2:$C$90,2,FALSE) -> Trident 16 Cna | E9: =VLOOKUP(C9,Tabelle!$A$2:$C$90,3,FALSE) -> 1181 | F9: Bellin Simone | G9: Bolla Rita | I9: CV Casanova | J9: XII | K9: cefa76@gmail.com | L9: si | M9: no
A10: 5 f | B10: SI | C10: 22 - FJ | D10: =VLOOKUP(C10,Tabelle!$A$2:$C$90,2,FALSE) -> FJ | E10: =VLOOKUP(C10,Tabelle!$A$2:$C$90,3,FALSE) -> 1118 | F10: Da Ros Lorenzo | G10: Grilli Fabio | H10: 3492950803 | I10: Vela Erix Ass.Sport. Dil. | J10: II | K10: lorenzodrsl@libero.it | L10: no | M10: no
A11: 5 t | B11: SI | C11: 70 - Trident 16 Cna | D11: =VLOOKUP(C11,Tabelle!$A$2:$C$90,2,FALSE) -> Trident 16 Cna | E11: =VLOOKUP(C11,Tabelle!$A$2:$C$90,3,FALSE) -> 1181 | F11: Zennaro Nicola | G11: D'Ascoli Lucio-Pernigotti Daniele | I11: CV Casanova | J11: XII | K11: zennic@inwind.it | L11: no | M11: no
A12: 6 f | B12: SI | C12: 22 - FJ | D12: =VLOOKUP(C12,Tabelle!$A$2:$C$90,2,FALSE) -> FJ | E12: =VLOOKUP(C12,Tabelle!$A$2:$C$90,3,FALSE) -> 1118 | F12: Nacamulli Davide | G12: Fontana Pietro | H12: 3382641432 | I12: CDDF | J12: XIV | K12: davide.nacamulli@fastwebnet.it | L12: si | M12: no
A13: 6 t | B13: SI | C13: 70 - Trident 16 Cna | D13: =VLOOKUP(C13,Tabelle!$A$2:$C$90,2,FALSE) -> Trident 16 Cna | E13: =VLOOKUP(C13,Tabelle!$A$2:$C$90,3,FALSE) -> 1181 | F13: Bortoluzzi Tommaso | G13: Scarpa Elisa | I13: CV Casanova | J13: XII | K13: tommaso_bortoluzzi@hotmail.com | L13: no | M13: no
A14: 7 | B14: SI | C14: 76 - Vaurien | D14: =VLOOKUP(C14,Tabelle!$A$2:$C$90,2,FALSE) -> Vaurien | E14: =VLOOKUP(C14,Tabelle!$A$2:$C$90,3,FALSE) -> 1154 | F14: Tajoli Zeno | G14: Guerrini Andrea | H14: 438005153 | I14: CDDF | J14: XIV | K14: zeno.tajoli@yahoo.it | L14: no | M14: no
A15: 12 | B15: SI | C15: 33 - Laser STD | D15: =VLOOKUP(C15,Tabelle!$A$2:$C$90,2,FALSE) -> Laser STD | E15: 1078 | F15: Bellato Graziano | H15: 3485601790 | I15: CN Volano | J15: XI | L15: si | M15: si
A16: 13 | B16: SI | C16: 66 - Sunfish e/o Alpa skif | D16: =VLOOKUP(C16,Tabelle!$A$2:$C$90,2,FALSE) -> Sunfish e/o Alpa skif | E16: =VLOOKUP(C16,Tabelle!$A$2:$C$90,3,FALSE) -> 1127 | F16: Beltrame Antonio | H16: 3351212667 | I16: Punta vela Club | K16: beltrame.antonio@inxind.it | L16: no | M16: si
A17: 21 | B17: SI | C17: 66 - Sunfish e/o Alpa skif | D17: =VLOOKUP(C17,Tabelle!$A$2:$C$90,2,FALSE) -> Sunfish e/o Alpa skif | E17: =VLOOKUP(C17,Tabelle!$A$2:$C$90,3,FALSE) -> 1127 | F17: Demeo Giuseppe | H17: 3401400745 | I17: CDDF | J17: XIV | K17: giusepperosario.demeo@bpintra.it | L17: no | M17: si
A18: 30 | B18: SI | C18: 06 - 470 | D18: =VLOOKUP(C18,Tabelle!$A$2:$C$90,2,FALSE) -> 470 | E18: =VLOOKUP(C18,Tabelle!$A$2:$C$90,3,FALSE) -> 973 | F18: Latini Ivaldo | G18: Olivi Alessandra | I18: CVMarotta | J18: X | L18: no | M18: no
A19: 51 | B19: SI | C19: 18 - FD | D19: =VLOOKUP(C19,Tabelle!$A$2:$C$90,2,FALSE) -> FD | E19: =VLOOKUP(C19,Tabelle!$A$2:$C$90,3,FALSE) -> 880 | F19: Frau Virgilio | G19: Richelli Paola | I19: VCCampione | J19: XIV | L19: no | M19: no
A20: 108 | B20: SI | C20: 18 - FD | D20: =VLOOKUP(C20,Tabelle!$A$2:$C$90,2,FALSE) -> FD | E20: =VLOOKUP(C20,Tabelle!$A$2:$C$90,3,FALSE) -> 880 | F20: Ventura Andrea | G20: Piccoli Roberto | I20: CNBrenzone | J20: XIV | L20: no | M20: no
A21: 138 | B21: SI | C21: 33 - Laser STD | D21: =VLOOKUP(C21,Tabelle!$A$2:$C$90,2,FALSE) -> Laser STD | E21: =VLOOKUP(C21,Tabelle!$A$2:$C$90,3,FALSE) -> 1078 | F21: Ruppolo Luca | H21: 3396136587 | I21: LNI Belluno | K21: qcicuqcicu@yahoo.it | L21: si | M21: si
A22: 179 | B22: SI | C22: 65 - Strale | D22: =VLOOKUP(C22,Tabelle!$A$2:$C$90,2,FALSE) -> Strale | E22: =VLOOKUP(C22,Tabelle!$A$2:$C$90,3,FALSE) -> 1022 | F22: Zanandrea Lucio | G22: Frison Federico | H22: 3355206292 | I22: LNI Vicenza | J22: XII | K22: zanandrea.lucio@libero.it | L22: si | M22: si
A23: 216 | B23: SI | C23: 89 - classe U | D23: =VLOOKUP(C23,Tabelle!$A$2:$C$90,2,FALSE) -> Classe U | E23: =VLOOKUP(C23,Tabelle!$A$2:$C$90,3,FALSE) -> 966 | F23: Spanò Domenico | G23: Zanza Walter - Guareschi Corrado | H23: 3202326907 | I23: YC Versilia | J23: II | L23: no | M23: no
A24: 278 | B24: SI | C24: 13 - Contender | D24: =VLOOKUP(C24,Tabelle!$A$2:$C$90,2,FALSE) -> Contender | E24: =VLOOKUP(C24,Tabelle!$A$2:$C$90,3,FALSE) -> 993 | F24: Maffeis Massimo | H24: 3356088320 | I24: VC Campione | J24: XIV | K24: Maxycompr@hotmail.com | L24: no | M24: no
A25: 415 | B25: SI | C25: 88 - Rennjolle | D25: =VLOOKUP(C25,Tabelle!$A$2:$C$90,2,FALSE) -> Rennjolle | E25: =VLOOKUP(C25,Tabelle!$A$2:$C$90,3,FALSE) -> 1101 | F25: Modena Loris | G25: Vasallo Giovanni | H25: 3298622966 | I25: CN Brenzone | J25: XIV | L25: no | M25: no
A26: 435 | B26: SI | C26: 10 - Buzz | D26: =VLOOKUP(C26,Tabelle!$A$2:$C$90,2,FALSE) -> Buzz | E26: =VLOOKUP(C26,Tabelle!$A$2:$C$90,3,FALSE) -> 1005 | F26: Bigolin Maurizio | G26: Veneziano Robern | H26: 3287478379 | I26: LNI Desenzano | J26: XIV | K26: mbig68@libero.it | L26: si | M26: si
A27: 548 | B27: SI | C27: 17 - Europa | D27: =VLOOKUP(C27,Tabelle!$A$2:$C$90,2,FALSE) -> Europa | E27: =VLOOKUP(C27,Tabelle!$A$2:$C$90,3,FALSE) -> 1139 | F27: Riva Filippo | H27: 3482660085 | I27: LNI Vicenza | J27: XII | K27: filippo.riva@ide-rep.com | L27: no | M27: no
A28: 641 | B28: SI | C28: 26 - Iso | D28: =VLOOKUP(C28,Tabelle!$A$2:$C$90,2,FALSE) -> Iso | E28: =VLOOKUP(C28,Tabelle!$A$2:$C$90,3,FALSE) -> 926 | F28: Modena Umberto | G28: Zaccoletti Luca | H28: 3473662096 | I28: LNI Garda | J28: XIV | K28: ubi@univela.it | L28: si | M28: si
A29: 668 | B29: SI | C29: 18 - FD | D29: =VLOOKUP(C29,Tabelle!$A$2:$C$90,2,FALSE) -> FD | E29: =VLOOKUP(C29,Tabelle!$A$2:$C$90,3,FALSE) -> 880 | F29: Mantovani Giovanni | G29: Semeghini Arrigo | H29: 3392642928 | I29: LNI VIcenza | J29: XII | K29: giovan_m@tin.it | L29: si | M29: no
A30: 701 | B30: SI | C30: 60 - RS 500 | D30: =VLOOKUP(C30,Tabelle!$A$2:$C$90,2,FALSE) -> RS 500 | E30: =VLOOKUP(C30,Tabelle!$A$2:$C$90,3,FALSE) -> 970 | F30: Vicini Giuseppe | G30: Visintini Alessandro | H30: 3485147344 | I30: CDDF | J30: XIV | K30: beppeevo@gmail.com
A31: 703 | B31: SI | C31: 60 - RS 500 | D31: =VLOOKUP(C31,Tabelle!$A$2:$C$90,2,FALSE) -> RS 500 | E31: =VLOOKUP(C31,Tabelle!$A$2:$C$90,3,FALSE) -> 970 | F31: Maffezzoli Niccolò | G31: Sada Carlotta Maria | H31: 3396904456
A32: 713 | B32: SI | C32: 60 - RS 500 | D32: =VLOOKUP(C32,Tabelle!$A$2:$C$90,2,FALSE) -> RS 500 | E32: =VLOOKUP(C32,Tabelle!$A$2:$C$90,3,FALSE) -> 970 | F32: Semenzato Flavio | G32: Basile Giandomenico | H32: 3334051585 | I32: Circolo 40 Ruggenti Caorle | J32: XII | K32: flaviosemenzato@alice.it | L32: no | M32: no
A33: 714 | B33: SI | C33: 60 - RS 500 | D33: =VLOOKUP(C33,Tabelle!$A$2:$C$90,2,FALSE) -> RS 500 | E33: =VLOOKUP(C33,Tabelle!$A$2:$C$90,3,FALSE) -> 970 | F33: Maggioni Giuseppe | G33: Maggioni Umberto | H33: 3335235676 | I33: CN Brenzone | J33: XIV | K33: ferdinando.maggioni@unipd.it | L33: no | M33: no
A34: 780 | B34: SI | C34: 60 - RS 500 | D34: =VLOOKUP(C34,Tabelle!$A$2:$C$90,2,FALSE) -> RS 500 | E34: =VLOOKUP(C34,Tabelle!$A$2:$C$90,3,FALSE) -> 970 | F34: Maccari Federico Maria | G34: Brighenti Claudio | I34: CV Belluno | J34: XV | L34: no | M34: no
A35: 782 | B35: SI | C35: 60 - RS 500 | D35: =VLOOKUP(C35,Tabelle!$A$2:$C$90,2,FALSE) -> RS 500 | E35: =VLOOKUP(C35,Tabelle!$A$2:$C$90,3,FALSE) -> 970 | F35: Scarpa Roberto | G35: Favaro Benedetta | H35: 3477167745 | I35: AVL | J35: XII | L35: no | M35: no
A36: 799 | B36: SI | C36: 15 - Dinghy '12 classico | D36: =VLOOKUP(C36,Tabelle!$A$2:$C$90,2,FALSE) -> Dinghy '12 classico | E36: =VLOOKUP(C36,Tabelle!$A$2:$C$90,3,FALSE) -> 1334 | F36: Armellini Roberto | H36: 3357192377 | I36: Homerus onlus | J36: XIV | K36: roberto@armellin.org | L36: si | M36: si
A37: 800 | B37: SI | C37: 60 - RS 500 | D37: =VLOOKUP(C37,Tabelle!$A$2:$C$90,2,FALSE) -> RS 500 | E37: =VLOOKUP(C37,Tabelle!$A$2:$C$90,3,FALSE) -> 970 | F37: Carlini Luca | G37: Balestrero Stefano | H37: 3339410737 | I37: YCC Genova | J37: 1 | L37: no | M37: no
A38: 801 | B38: SI | C38: 60 - RS 500 | D38: =VLOOKUP(C38,Tabelle!$A$2:$C$90,2,FALSE) -> RS 500 | E38: =VLOOKUP(C38,Tabelle!$A$2:$C$90,3,FALSE) -> 970 | F38: Corica Francesco | G38: Guagliardo Jacopo | H38: 339410737 | I38: YCC Genova | J38: 1 | L38: no | M38: no
A39: 812 | B39: SI | C39: 10 - Buzz | D39: =VLOOKUP(C39,Tabelle!$A$2:$C$90,2,FALSE) -> Buzz | E39: =VLOOKUP(C39,Tabelle!$A$2:$C$90,3,FALSE) -> 1005 | F39: Gasparini Alessandro | G39: Bertocco Riccardo | H39: 3290253417 | I39: LNI Belluno | J39: XII | K39: alexc.gasss@iol.it | L39: si | M39: si
A40: 814 | B40: SI | C40: 60 - RS 500 | D40: =VLOOKUP(C40,Tabelle!$A$2:$C$90,2,FALSE) -> RS 500 | E40: =VLOOKUP(C40,Tabelle!$A$2:$C$90,3,FALSE) -> 970 | F40: Scarpa Nicolò | G40: Biasutti Andrea | H40: 3477167745 | I40: AVL | J40: XII | L40: no | M40: no
A41: 867 | B41: SI | C41: 04 - 49ers | D41: =VLOOKUP(C41,Tabelle!$A$2:$C$90,2,FALSE) -> 49ers | E41: =VLOOKUP(C41,Tabelle!$A$2:$C$90,3,FALSE) -> 747 | F41: Tita Ruggero | G41: Pilati Matteo | I41: Compagnia della Vela | J41: XII | L41: no | M41: no
A42: 962 | B42: SI | C42: 70 - Trident 16 Cna | D42: =VLOOKUP(C42,Tabelle!$A$2:$C$90,2,FALSE) -> Trident 16 Cna | E42: =VLOOKUP(C42,Tabelle!$A$2:$C$90,3,FALSE) -> 1181 | F42: Mainero Mario | G42: Lorenzetti Marco | H42: 3295462697 | I42: CN Senigallia | J42: X | K42: murussu@alice.it | L42: no | M42: no
A43: 974 | B43: SI | C43: 17 - Europa | D43: =VLOOKUP(C43,Tabelle!$A$2:$C$90,2,FALSE) -> Europa | E43: =VLOOKUP(C43,Tabelle!$A$2:$C$90,3,FALSE) -> 1139 | F43: Lo Manto Caterina | H43: 3493779082 | I43: CDDF | J43: XIV | K43: caterina.lomanto@gmail.com | L43: no | M43: no
A44: 978 | B44: SI | C44: 10 - Buzz | D44: =VLOOKUP(C44,Tabelle!$A$2:$C$90,2,FALSE) -> Buzz | E44: =VLOOKUP(C44,Tabelle!$A$2:$C$90,3,FALSE) -> 1005 | F44: Monciardini Paolo | G44: Cuccato Debora | H44: 3386046883 | I44: UMV | J44: XV | K44: paolomoncia@tiscali.it | L44: si | M44: si
A45: 1465 | B45: SI | C45: 62 - S nazionale | D45: =VLOOKUP(C45,Tabelle!$A$2:$C$90,2,FALSE) -> S nazionale | E45: =VLOOKUP(C45,Tabelle!$A$2:$C$90,3,FALSE) -> 1088 | F45: Ocera Mattia | G45: Ocera Andrea | H45: 3401511231 | I45: CN Bersaglio | J45: XV | L45: no | M45: no
A46: 1975 | B46: SI | C46: 54 - RS Feva | D46: =VLOOKUP(C46,Tabelle!$A$2:$C$90,2,FALSE) -> RS Feva | E46: =VLOOKUP(C46,Tabelle!$A$2:$C$90,3,FALSE) -> 1189 | F46: Fortunati Paolo | G46: Mannino Riccardo | H46: 3392930183 | I46: CV Sun§Sea | J46: XII | K46: sunseasailing@gmail.com | L46: no | M46: no
A47: 2153 | B47: SI | C47: 16 - Dinghy '12 vtr | D47: =VLOOKUP(C47,Tabelle!$A$2:$C$90,2,FALSE) -> Dinghy '12 vtr | E47: =VLOOKUP(C47,Tabelle!$A$2:$C$90,3,FALSE) -> 1271 | F47: Baroni Maurizio | H47: 3336139885 | I47: GDV LNI Belluno | J47: XII | K47: Maurizio.baroni@tin.it | L47: si | M47: no
A48: 2175 | B48: SI | C48: 16 - Dinghy '12 vtr | D48: =VLOOKUP(C48,Tabelle!$A$2:$C$90,2,FALSE) -> Dinghy '12 vtr | E48: =VLOOKUP(C48,Tabelle!$A$2:$C$90,3,FALSE) -> 1271 | F48: Panzeri Massimo | G48: Salsa Paolo | H48: 3494271883 | I48: UVMaccagno | J48: XV | L48: no | M48: no
A49: 2455 | B49: SI | C49: 09 - Byte CII | D49: =VLOOKUP(C49,Tabelle!$A$2:$C$90,2,FALSE) -> Byte CII | E49: =VLOOKUP(C49,Tabelle!$A$2:$C$90,3,FALSE) -> 1139 | F49: Dugnagni Giacomo | H49: 3202632474 | I49: LNI Desenzano | J49: XIV | K49: gdugnani@libero.it | L49: si | M49: si
A50: 2814 | B50: SI | C50: 22 - FJ | D50: =VLOOKUP(C50,Tabelle!$A$2:$C$90,2,FALSE) -> FJ | E50: =VLOOKUP(C50,Tabelle!$A$2:$C$90,3,FALSE) -> 1118 | F50: Uras Claudio | G50: Residori Alessandra | H50: 3484506295 | I50: CN Valdese WIND | J50: 1 | K50: claudio.uras@tin.it | L50: no | M50: no
A51: 3124 | B51: SI | C51: 22 - FJ | D51: =VLOOKUP(C51,Tabelle!$A$2:$C$90,2,FALSE) -> FJ | E51: =VLOOKUP(C51,Tabelle!$A$2:$C$90,3,FALSE) -> 1118 | F51: Zabrzewska Mgadalena | G51: Corbellari Gianluigi | H51: 3388130309 | I51: CDDF | J51: XIV | K51: kiklenka@alice.it | L51: si | M51: no
A52: 3215 | B52: SI | C52: 22 - FJ | D52: =VLOOKUP(C52,Tabelle!$A$2:$C$90,2,FALSE) -> FJ | E52: =VLOOKUP(C52,Tabelle!$A$2:$C$90,3,FALSE) -> 1118 | F52: Cirolia Vincenzo | G52: Mazzieri Marco | H52: 3356939777 | I52: CV Cervia | J52: XI | K52: Vincenzo@cirolia.com | L52: si | M52: no
A53: 3267 | B53: SI | C53: 22 - FJ | D53: =VLOOKUP(C53,Tabelle!$A$2:$C$90,2,FALSE) -> FJ | E53: =VLOOKUP(C53,Tabelle!$A$2:$C$90,3,FALSE) -> 1118 | F53: De Rossi Michele | G53: Benamati Anna | H53: 3486607288 | I53: CDDF | J53: XIV | K53: cadet1065@yahoo.it | L53: no | M53: no
A54: 3370 | B54: SI | C54: 22 - FJ | D54: =VLOOKUP(C54,Tabelle!$A$2:$C$90,2,FALSE) -> FJ | E54: =VLOOKUP(C54,Tabelle!$A$2:$C$90,3,FALSE) -> 1118 | F54: Cambi Enzo | G54: De Rossi Lorenzo | H54: 3490613155 | I54: CDDF | J54: XIV | K54: enzo.cambi@gmail.com | L54: si | M54: si
A55: 3405 | B55: SI | C55: 54 - RS Feva | D55: =VLOOKUP(C55,Tabelle!$A$2:$C$90,2,FALSE) -> RS Feva | E55: =VLOOKUP(C55,Tabelle!$A$2:$C$90,3,FALSE) -> 1189 | F55: Pozder Willy Enrico | G55: Visconti Federico | H55: 3333299661 | I55: LNI Brescia Desenzano | J55: XIV | K55: domenico.foschini.14zona@gmail.com | L55: no | M55: no
A56: 3415 | B56: SI | C56: 54 - RS Feva | D56: =VLOOKUP(C56,Tabelle!$A$2:$C$90,2,FALSE) -> RS Feva | E56: =VLOOKUP(C56,Tabelle!$A$2:$C$90,3,FALSE) -> 1189 | F56: Coppola Vincenzo | G56: Romano Monica | I56: C.Canottieri Roggero di Lauria | J56: VII | K56: domenico.foschini.14zona@gmail.com | L56: no | M56: no
A57: 3792 | B57: SI | C57: 06 - 470 | D57: =VLOOKUP(C57,Tabelle!$A$2:$C$90,2,FALSE) -> 470 | E57: =VLOOKUP(C57,Tabelle!$A$2:$C$90,3,FALSE) -> 973 | F57: Candeago Francesco | G57: Candeago Maurizio | I57: CN Valle d'Aosta + CN Torino | M57: no
A58: 3886 | B58: SI | C58: 22 - FJ | D58: =VLOOKUP(C58,Tabelle!$A$2:$C$90,2,FALSE) -> FJ | E58: =VLOOKUP(C58,Tabelle!$A$2:$C$90,3,FALSE) -> 1118 | F58: Chiodi Mario | G58: Langaro Paolo | I58: LNI VIcenza | J58: XII | K58: vivo.chiodi@libero.it | L58: si | M58: no
A59: 3806 | B59: SI | C59: 22 - FJ | D59: =VLOOKUP(C59,Tabelle!$A$2:$C$90,2,FALSE) -> FJ | E59: =VLOOKUP(C59,Tabelle!$A$2:$C$90,3,FALSE) -> 1118 | F59: Veroni Giuseppe | G59: Calò Sebastian | H59: 3483014560 | I59: YC Acquafesca | J59: XIV | K59: veroni@verpa.it | L59: si | M59: no
A60: 3824 | B60: SI | C60: 22 - FJ | D60: =VLOOKUP(C60,Tabelle!$A$2:$C$90,2,FALSE) -> FJ | E60: =VLOOKUP(C60,Tabelle!$A$2:$C$90,3,FALSE) -> 1118 | F60: Cocca Secondo | G60: Cocca Igor | H60: 3355435015 | I60: CDDF | J60: XIV | K60: cocca.secondo@tin.it | L60: no | M60: no
A61: 4259 | B61: SI | C61: 06 - 470 | D61: =VLOOKUP(C61,Tabelle!$A$2:$C$90,2,FALSE) -> 470 | E61: =VLOOKUP(C61,Tabelle!$A$2:$C$90,3,FALSE) -> 973 | F61: Stefanutto Luca | G61: Vendramini Andrea | H61: 3479939019 | I61: CNSM | L61: si | M61: no
A62: 4321 | B62: SI | C62: 06 - 470 | D62: =VLOOKUP(C62,Tabelle!$A$2:$C$90,2,FALSE) -> 470 | E62: =VLOOKUP(C62,Tabelle!$A$2:$C$90,3,FALSE) -> 973 | F62: Zaina Roberto | G62: Bragato Nicola | H62: 3497571904 | I62: CNSM | K62: zaina.roberto@gmail.it | L62: no | M62: no
A63: 4878 | B63: SI | C63: 72 - Topaz Uno race plus | D63: =VLOOKUP(C63,Tabelle!$A$2:$C$90,2,FALSE) -> Topaz Uno race plus | E63: =VLOOKUP(C63,Tabelle!$A$2:$C$90,3,FALSE) -> 1240 | F63: Lauria Antonino | H63: 3292106666 | I63: CDDF | J63: XIV | K63: lauria@thema96.it | L63: no | M63: no
A64: 5053 | B64: NO | C64: 32 - Laser 5000 | D64: =VLOOKUP(C64,Tabelle!$A$2:$C$90,2,FALSE) -> Laser 5000 | E64: =VLOOKUP(C64,Tabelle!$A$2:$C$90,3,FALSE) -> 846 | F64: Borzani Steven | G64: Girelli Stefano | H64: 3384136720 | I64: FVD Desenzano | J64: XIV | K64: stefano.borzani@gmail.com | L64: no | M64: no
A65: 5384 | B65: SI | C65: 72 - Topaz Uno race plus | D65: =VLOOKUP(C65,Tabelle!$A$2:$C$90,2,FALSE) -> Topaz Uno race plus | E65: =VLOOKUP(C65,Tabelle!$A$2:$C$90,3,FALSE) -> 1240 | F65: Pannocchia Daniele | H65: 3473707884 | I65: CV La Spezia | J65: 1 | K65: daniele.pannocchia-hf28@poste.it | L65: no | M65: no
A66: 36165 | B66: SI | C66: 77 - Vaurien new sails | D66: =VLOOKUP(C66,Tabelle!$A$2:$C$90,2,FALSE) -> Vaurien new sails | E66: =VLOOKUP(C66,Tabelle!$A$2:$C$90,3,FALSE) -> 1118 | F66: Parigi Stefano | G66: Lombard Nicolas | H66: 3280129495 | I66: CV Pietrabianca | K66: stefano.parigi@yahoo.it | L66: si | M66: no
A67: 36293 | B67: SI | C67: 77 - Vaurien new sails | D67: =VLOOKUP(C67,Tabelle!$A$2:$C$90,2,FALSE) -> Vaurien new sails | E67: =VLOOKUP(C67,Tabelle!$A$2:$C$90,3,FALSE) -> 1118 | F67: Crecchi Marco | G67: Bini Maurizio | H67: 3494632964 | I67: AVAL-CDV Gravedona | J67: XV | K67: marcocrecchi@tin.it | L67: no | M67: no
A68: 45881 | B68: SI | C68: 68 - Topper | D68: =VLOOKUP(C68,Tabelle!$A$2:$C$90,2,FALSE) -> Topper | E68: =VLOOKUP(C68,Tabelle!$A$2:$C$90,3,FALSE) -> 1290 | F68: Agarri Panutti Dominique | H68: 3396659085 | I68: FVM | J68: XIV | K68: kinsley@alice.it | L68: no | M68: no
A69: 46603 | B69: SI | C69: 68 - Topper | D69: =VLOOKUP(C69,Tabelle!$A$2:$C$90,2,FALSE) -> Topper | E69: =VLOOKUP(C69,Tabelle!$A$2:$C$90,3,FALSE) -> 1290 | F69: Kinsley Rebecca | H69: 3396659085 | I69: FVM | J69: XIV | K69: kinsley@alice.it | L69: no | M69: no
A70: 46604 | B70: SI | C70: 68 - Topper | D70: =VLOOKUP(C70,Tabelle!$A$2:$C$90,2,FALSE) -> Topper | E70: =VLOOKUP(C70,Tabelle!$A$2:$C$90,3,FALSE) -> 1290 | F70: Zampieri Giuliana | H70: 3384311582 | I70: YC Acquafesca | J70: XIV | L70: no | M70: no
A71: 61716 | B71: SI | C71: 33 - Laser STD | D71: =VLOOKUP(C71,Tabelle!$A$2:$C$90,2,FALSE) -> Laser STD | E71: =VLOOKUP(C71,Tabelle!$A$2:$C$90,3,FALSE) -> 1078 | F71: Macchiavello Andrea | H71: 3494206556 | I71: CDDF | J71: XIV | K71: illic@libero.it | L71: no | M71: no
A72: 154960 | B72: SI | C72: 33 - Laser STD | D72: =VLOOKUP(C72,Tabelle!$A$2:$C$90,2,FALSE) -> Laser STD | E72: =VLOOKUP(C72,Tabelle!$A$2:$C$90,3,FALSE) -> 1078 | F72: Cassini Marcello | I72: CDDF | J72: XIV | K72: cicce731@yahoo.it | L72: no | M72: no
A73: 158549 | B73: SI | C73: 33 - Laser STD | D73: =VLOOKUP(C73,Tabelle!$A$2:$C$90,2,FALSE) -> Laser STD | E73: =VLOOKUP(C73,Tabelle!$A$2:$C$90,3,FALSE) -> 1078 | F73: Barberis Enrico | H73: 3385696503 | I73: Punta vela Club Saronno | J73: XV | K73: eb1958@libero.it | L73: si | M73: no
A74: 181984 | B74: SI | C74: 33 - Laser STD | D74: =VLOOKUP(C74,Tabelle!$A$2:$C$90,2,FALSE) -> Laser STD | E74: =VLOOKUP(C74,Tabelle!$A$2:$C$90,3,FALSE) -> 1078 | F74: Barozzi Mauro | I74: CDDF | J74: XIV | K74: b.mauro@libero.it | L74: no | M74: no
A75: 188540 | B75: SI | C75: 33 - Laser STD | D75: =VLOOKUP(C75,Tabelle!$A$2:$C$90,2,FALSE) -> Laser STD | E75: =VLOOKUP(C75,Tabelle!$A$2:$C$90,3,FALSE) -> 1078 | F75: Perlini Carlo | H75: 3498160374 | I75: LNI Garda | J75: XIV | K75: perla954@libero.it | L75: si | M75: si
A76: 194377 | B76: NO | C76: 33 - Laser STD | D76: =VLOOKUP(C76,Tabelle!$A$2:$C$90,2,FALSE) -> Laser STD | E76: =VLOOKUP(C76,Tabelle!$A$2:$C$90,3,FALSE) -> 1078 | F76: Salvà Lorenzo | I76: CN Brenzone | J76: XIV | K76: lorenzosalva@ | L76: no | M76: no
B77: NO | C77: 33 - Laser STD | D77: =VLOOKUP(C77,Tabelle!$A$2:$C$90,2,FALSE) -> Laser STD | E77: =VLOOKUP(C77,Tabelle!$A$2:$C$90,3,FALSE) -> 1078 | F77: Pizzolato Stefano | H77: 3396217054 | I77: Palladio Sailing | K77: ipizzolato@ambraelettronica.it
B78: NO | D78: =VLOOKUP(C78,Tabelle!$A$2:$C$90,2,FALSE) -> #N/D | E78: =VLOOKUP(C78,Tabelle!$A$2:$C$90,3,FALSE) -> #N/D
B79: NO | D79: =VLOOKUP(C79,Tabelle!$A$2:$C$90,2,FALSE) -> #N/D | E79: =VLOOKUP(C79,Tabelle!$A$2:$C$90,3,FALSE) -> #N/D
B80: NO | D80: =VLOOKUP(C80,Tabelle!$A$2:$C$90,2,FALSE) -> #N/D | E80: =VLOOKUP(C80,Tabelle!$A$2:$C$90,3,FALSE) -> #N/D
B81: NO | D81: =VLOOKUP(C81,Tabelle!$A$2:$C$90,2,FALSE) -> #N/D | E81: =VLOOKUP(C81,Tabelle!$A$2:$C$90,3,FALSE) -> #N/D
B82: NO | D82: =VLOOKUP(C82,Tabelle!$A$2:$C$90,2,FALSE) -> #N/D | E82: =VLOOKUP(C82,Tabelle!$A$2:$C$90,3,FALSE) -> #N/D
B83: NO | D83: =VLOOKUP(C83,Tabelle!$A$2:$C$90,2,FALSE) -> #N/D | E83: =VLOOKUP(C83,Tabelle!$A$2:$C$90,3,FALSE) -> #N/D
B84: NO | D84: =VLOOKUP(C84,Tabelle!$A$2:$C$90,2,FALSE) -> #N/D | E84: =VLOOKUP(C84,Tabelle!$A$2:$C$90,3,FALSE) -> #N/D
B85: NO | D85: =VLOOKUP(C85,Tabelle!$A$2:$C$90,2,FALSE) -> #N/D | E85: =VLOOKUP(C85,Tabelle!$A$2:$C$90,3,FALSE) -> #N/D
B86: NO | D86: =VLOOKUP(C86,Tabelle!$A$2:$C$90,2,FALSE) -> #N/D | E86: =VLOOKUP(C86,Tabelle!$A$2:$C$90,3,FALSE) -> #N/D
B87: NO | D87: =VLOOKUP(C87,Tabelle!$A$2:$C$90,2,FALSE) -> #N/D | E87: =VLOOKUP(C87,Tabelle!$A$2:$C$90,3,FALSE) -> #N/D
B88: NO | D88: =VLOOKUP(C88,Tabelle!$A$2:$C$90,2,FALSE) -> #N/D | E88: =VLOOKUP(C88,Tabelle!$A$2:$C$90,3,FALSE) -> #N/D
B89: NO | D89: =VLOOKUP(C89,Tabelle!$A$2:$C$90,2,FALSE) -> #N/D | E89: =VLOOKUP(C89,Tabelle!$A$2:$C$90,3,FALSE) -> #N/D
B90: NO | D90: =VLOOKUP(C90,Tabelle!$A$2:$C$90,2,FALSE) -> #N/D | E90: =VLOOKUP(C90,Tabelle!$A$2:$C$90,3,FALSE) -> #N/D
B91: NO | D91: =VLOOKUP(C91,Tabelle!$A$2:$C$90,2,FALSE) -> #N/D | E91: =VLOOKUP(C91,Tabelle!$A$2:$C$90,3,FALSE) -> #N/D
B92: NO | D92: =VLOOKUP(C92,Tabelle!$A$2:$C$90,2,FALSE) -> #N/D | E92: =VLOOKUP(C92,Tabelle!$A$2:$C$90,3,FALSE) -> #N/D
B93: NO | D93: =VLOOKUP(C93,Tabelle!$A$2:$C$90,2,FALSE) -> #N/D | E93: =VLOOKUP(C93,Tabelle!$A$2:$C$90,3,FALSE) -> #N/D
B94: NO | D94: =VLOOKUP(C94,Tabelle!$A$2:$C$90,2,FALSE) -> #N/D | E94: =VLOOKUP(C94,Tabelle!$A$2:$C$90,3,FALSE) -> #N/D
B95: NO | D95: =VLOOKUP(C95,Tabelle!$A$2:$C$90,2,FALSE) -> #N/D | E95: =VLOOKUP(C95,Tabelle!$A$2:$C$90,3,FALSE) -> #N/D
B96: NO | D96: =VLOOKUP(C96,Tabelle!$A$2:$C$90,2,FALSE) -> #N/D | E96: =VLOOKUP(C96,Tabelle!$A$2:$C$90,3,FALSE) -> #N/D
B97: NO | D97: =VLOOKUP(C97,Tabelle!$A$2:$C$90,2,FALSE) -> #N/D | E97: =VLOOKUP(C97,Tabelle!$A$2:$C$90,3,FALSE) -> #N/D
B98: NO | D98: =VLOOKUP(C98,Tabelle!$A$2:$C$90,2,FALSE) -> #N/D | E98: =VLOOKUP(C98,Tabelle!$A$2:$C$90,3,FALSE) -> #N/D
B99: NO | D99: =VLOOKUP(C99,Tabelle!$A$2:$C$90,2,FALSE) -> #N/D | E99: =VLOOKUP(C99,Tabelle!$A$2:$C$90,3,FALSE) -> #N/D
B100: NO | D100: =VLOOKUP(C100,Tabelle!$A$2:$C$90,2,FALSE) -> #N/D | E100: =VLOOKUP(C100,Tabelle!$A$2:$C$90,3,FALSE) -> #N/D
B101: NO | D101: =VLOOKUP(C101,Tabelle!$A$2:$C$90,2,FALSE) -> #N/D | E101: =VLOOKUP(C101,Tabelle!$A$2:$C$90,3,FALSE) -> #N/D
B102: NO | D102: =VLOOKUP(C102,Tabelle!$A$2:$C$90,2,FALSE) -> #N/D | E102: =VLOOKUP(C102,Tabelle!$A$2:$C$90,3,FALSE) -> #N/D
B103: NO | D103: =VLOOKUP(C103,Tabelle!$A$2:$C$90,2,FALSE) -> #N/D | E103: =VLOOKUP(C103,Tabelle!$A$2:$C$90,3,FALSE) -> #N/D
B104: NO | D104: =VLOOKUP(C104,Tabelle!$A$2:$C$90,2,FALSE) -> #N/D | E104: =VLOOKUP(C104,Tabelle!$A$2:$C$90,3,FALSE) -> #N/D
B105: NO | D105: =VLOOKUP(C105,Tabelle!$A$2:$C$90,2,FALSE) -> #N/D | E105: =VLOOKUP(C105,Tabelle!$A$2:$C$90,3,FALSE) -> #N/D
B106: NO | D106: =VLOOKUP(C106,Tabelle!$A$2:$C$90,2,FALSE) -> #N/D | E106: =VLOOKUP(C106,Tabelle!$A$2:$C$90,3,FALSE) -> #N/D
B107: NO | D107: =VLOOKUP(C107,Tabelle!$A$2:$C$90,2,FALSE) -> #N/D | E107: =VLOOKUP(C107,Tabelle!$A$2:$C$90,3,FALSE) -> #N/D
B108: NO | D108: =VLOOKUP(C108,Tabelle!$A$2:$C$90,2,FALSE) -> #N/D | E108: =VLOOKUP(C108,Tabelle!$A$2:$C$90,3,FALSE) -> #N/D
B109: NO | D109: =VLOOKUP(C109,Tabelle!$A$2:$C$90,2,FALSE) -> #N/D | E109: =VLOOKUP(C109,Tabelle!$A$2:$C$90,3,FALSE) -> #N/D
B110: NO | D110: =VLOOKUP(C110,Tabelle!$A$2:$C$90,2,FALSE) -> #N/D | E110: =VLOOKUP(C110,Tabelle!$A$2:$C$90,3,FALSE) -> #N/D
B111: NO | D111: =VLOOKUP(C111,Tabelle!$A$2:$C$90,2,FALSE) -> #N/D | E111: =VLOOKUP(C111,Tabelle!$A$2:$C$90,3,FALSE) -> #N/D
B112: NO | D112: =VLOOKUP(C112,Tabelle!$A$2:$C$90,2,FALSE) -> #N/D | E112: =VLOOKUP(C112,Tabelle!$A$2:$C$90,3,FALSE) -> #N/D
B113: NO | D113: =VLOOKUP(C113,Tabelle!$A$2:$C$90,2,FALSE) -> #N/D | E113: =VLOOKUP(C113,Tabelle!$A$2:$C$90,3,FALSE) -> #N/D
B114: NO | D114: =VLOOKUP(C114,Tabelle!$A$2:$C$90,2,FALSE) -> #N/D | E114: =VLOOKUP(C114,Tabelle!$A$2:$C$90,3,FALSE) -> #N/D
B115: NO | D115: =VLOOKUP(C115,Tabelle!$A$2:$C$90,2,FALSE) -> #N/D | E115: =VLOOKUP(C115,Tabelle!$A$2:$C$90,3,FALSE) -> #N/D
B116: NO | D116: =VLOOKUP(C116,Tabelle!$A$2:$C$90,2,FALSE) -> #N/D | E116: =VLOOKUP(C116,Tabelle!$A$2:$C$90,3,FALSE) -> #N/D
B117: NO | D117: =VLOOKUP(C117,Tabelle!$A$2:$C$90,2,FALSE) -> #N/D | E117: =VLOOKUP(C117,Tabelle!$A$2:$C$90,3,FALSE) -> #N/D
B118: NO | D118: =VLOOKUP(C118,Tabelle!$A$2:$C$90,2,FALSE) -> #N/D | E118: =VLOOKUP(C118,Tabelle!$A$2:$C$90,3,FALSE) -> #N/D
B119: NO | D119: =VLOOKUP(C119,Tabelle!$A$2:$C$90,2,FALSE) -> #N/D | E119: =VLOOKUP(C119,Tabelle!$A$2:$C$90,3,FALSE) -> #N/D
B120: NO | D120: =VLOOKUP(C120,Tabelle!$A$2:$C$90,2,FALSE) -> #N/D | E120: =VLOOKUP(C120,Tabelle!$A$2:$C$90,3,FALSE) -> #N/D
B121: NO | D121: =VLOOKUP(C121,Tabelle!$A$2:$C$90,2,FALSE) -> #N/D | E121: =VLOOKUP(C121,Tabelle!$A$2:$C$90,3,FALSE) -> #N/D
B122: NO | D122: =VLOOKUP(C122,Tabelle!$A$2:$C$90,2,FALSE) -> #N/D | E122: =VLOOKUP(C122,Tabelle!$A$2:$C$90,3,FALSE) -> #N/D
B123: NO | D123: =VLOOKUP(C123,Tabelle!$A$2:$C$90,2,FALSE) -> #N/D | E123: =VLOOKUP(C123,Tabelle!$A$2:$C$90,3,FALSE) -> #N/D
B124: NO | D124: =VLOOKUP(C124,Tabelle!$A$2:$C$90,2,FALSE) -> #N/D | E124: =VLOOKUP(C124,Tabelle!$A$2:$C$90,3,FALSE) -> #N/D
B125: NO | D125: =VLOOKUP(C125,Tabelle!$A$2:$C$90,2,FALSE) -> #N/D | E125: =VLOOKUP(C125,Tabelle!$A$2:$C$90,3,FALSE) -> #N/D
B126: NO | D126: =VLOOKUP(C126,Tabelle!$A$2:$C$90,2,FALSE) -> #N/D | E126: =VLOOKUP(C126,Tabelle!$A$2:$C$90,3,FALSE) -> #N/D
B127: NO | D127: =VLOOKUP(C127,Tabelle!$A$2:$C$90,2,FALSE) -> #N/D | E127: =VLOOKUP(C127,Tabelle!$A$2:$C$90,3,FALSE) -> #N/D
B128: NO | D128: =VLOOKUP(C128,Tabelle!$A$2:$C$90,2,FALSE) -> #N/D | E128: =VLOOKUP(C128,Tabelle!$A$2:$C$90,3,FALSE) -> #N/D
B129: NO | D129: =VLOOKUP(C129,Tabelle!$A$2:$C$90,2,FALSE) -> #N/D | E129: =VLOOKUP(C129,Tabelle!$A$2:$C$90,3,FALSE) -> #N/D
B130: NO | D130: =VLOOKUP(C130,Tabelle!$A$2:$C$90,2,FALSE) -> #N/D | E130: =VLOOKUP(C130,Tabelle!$A$2:$C$90,3,FALSE) -> #N/D
B131: NO | D131: =VLOOKUP(C131,Tabelle!$A$2:$C$90,2,FALSE) -> #N/D | E131: =VLOOKUP(C131,Tabelle!$A$2:$C$90,3,FALSE) -> #N/D
B132: NO | D132: =VLOOKUP(C132,Tabelle!$A$2:$C$90,2,FALSE) -> #N/D | E132: =VLOOKUP(C132,Tabelle!$A$2:$C$90,3,FALSE) -> #N/D
B133: NO | D133: =VLOOKUP(C133,Tabelle!$A$2:$C$90,2,FALSE) -> #N/D | E133: =VLOOKUP(C133,Tabelle!$A$2:$C$90,3,FALSE) -> #N/D
B134: NO | D134: =VLOOKUP(C134,Tabelle!$A$2:$C$90,2,FALSE) -> #N/D | E134: =VLOOKUP(C134,Tabelle!$A$2:$C$90,3,FALSE) -> #N/D
B135: NO | D135: =VLOOKUP(C135,Tabelle!$A$2:$C$90,2,FALSE) -> #N/D | E135: =VLOOKUP(C135,Tabelle!$A$2:$C$90,3,FALSE) -> #N/D
B136: NO | D136: =VLOOKUP(C136,Tabelle!$A$2:$C$90,2,FALSE) -> #N/D | E136: =VLOOKUP(C136,Tabelle!$A$2:$C$90,3,FALSE) -> #N/D
B137: NO | D137: =VLOOKUP(C137,Tabelle!$A$2:$C$90,2,FALSE) -> #N/D | E137: =VLOOKUP(C137,Tabelle!$A$2:$C$90,3,FALSE) -> #N/D
B138: NO | D138: =VLOOKUP(C138,Tabelle!$A$2:$C$90,2,FALSE) -> #N/D | E138: =VLOOKUP(C138,Tabelle!$A$2:$C$90,3,FALSE) -> #N/D
B139: NO | D139: =VLOOKUP(C139,Tabelle!$A$2:$C$90,2,FALSE) -> #N/D | E139: =VLOOKUP(C139,Tabelle!$A$2:$C$90,3,FALSE) -> #N/D
B140: NO | D140: =VLOOKUP(C140,Tabelle!$A$2:$C$90,2,FALSE) -> #N/D | E140: =VLOOKUP(C140,Tabelle!$A$2:$C$90,3,FALSE) -> #N/D
B141: NO | D141: =VLOOKUP(C141,Tabelle!$A$2:$C$90,2,FALSE) -> #N/D | E141: =VLOOKUP(C141,Tabelle!$A$2:$C$90,3,FALSE) -> #N/D
B142: NO | D142: =VLOOKUP(C142,Tabelle!$A$2:$C$90,2,FALSE) -> #N/D | E142: =VLOOKUP(C142,Tabelle!$A$2:$C$90,3,FALSE) -> #N/D
B143: NO | D143: =VLOOKUP(C143,Tabelle!$A$2:$C$90,2,FALSE) -> #N/D | E143: =VLOOKUP(C143,Tabelle!$A$2:$C$90,3,FALSE) -> #N/D
B144: NO | D144: =VLOOKUP(C144,Tabelle!$A$2:$C$90,2,FALSE) -> #N/D | E144: =VLOOKUP(C144,Tabelle!$A$2:$C$90,3,FALSE) -> #N/D
B145: NO | D145: =VLOOKUP(C145,Tabelle!$A$2:$C$90,2,FALSE) -> #N/D | E145: =VLOOKUP(C145,Tabelle!$A$2:$C$90,3,FALSE) -> #N/D
B146: NO | D146: =VLOOKUP(C146,Tabelle!$A$2:$C$90,2,FALSE) -> #N/D | E146: =VLOOKUP(C146,Tabelle!$A$2:$C$90,3,FALSE) -> #N/D
B147: NO | D147: =VLOOKUP(C147,Tabelle!$A$2:$C$90,2,FALSE) -> #N/D | E147: =VLOOKUP(C147,Tabelle!$A$2:$C$90,3,FALSE) -> #N/D
B148: NO | D148: =VLOOKUP(C148,Tabelle!$A$2:$C$90,2,FALSE) -> #N/D | E148: =VLOOKUP(C148,Tabelle!$A$2:$C$90,3,FALSE) -> #N/D
B149: NO | D149: =VLOOKUP(C149,Tabelle!$A$2:$C$90,2,FALSE) -> #N/D | E149: =VLOOKUP(C149,Tabelle!$A$2:$C$90,3,FALSE) -> #N/D
B150: NO | D150: =VLOOKUP(C150,Tabelle!$A$2:$C$90,2,FALSE) -> #N/D | E150: =VLOOKUP(C150,Tabelle!$A$2:$C$90,3,FALSE) -> #N/D
B151: NO | D151: =VLOOKUP(C151,Tabelle!$A$2:$C$90,2,FALSE) -> #N/D | E151: =VLOOKUP(C151,Tabelle!$A$2:$C$90,3,FALSE) -> #N/D
B152: NO | D152: =VLOOKUP(C152,Tabelle!$A$2:$C$90,2,FALSE) -> #N/D | E152: =VLOOKUP(C152,Tabelle!$A$2:$C$90,3,FALSE) -> #N/D
B153: NO | D153: =VLOOKUP(C153,Tabelle!$A$2:$C$90,2,FALSE) -> #N/D | E153: =VLOOKUP(C153,Tabelle!$A$2:$C$90,3,FALSE) -> #N/D
B154: NO | D154: =VLOOKUP(C154,Tabelle!$A$2:$C$90,2,FALSE) -> #N/D | E154: =VLOOKUP(C154,Tabelle!$A$2:$C$90,3,FALSE) -> #N/D
B155: NO | D155: =VLOOKUP(C155,Tabelle!$A$2:$C$90,2,FALSE) -> #N/D | E155: =VLOOKUP(C155,Tabelle!$A$2:$C$90,3,FALSE) -> #N/D
B156: NO | D156: =VLOOKUP(C156,Tabelle!$A$2:$C$90,2,FALSE) -> #N/D | E156: =VLOOKUP(C156,Tabelle!$A$2:$C$90,3,FALSE) -> #N/D
B157: NO | D157: =VLOOKUP(C157,Tabelle!$A$2:$C$90,2,FALSE) -> #N/D | E157: =VLOOKUP(C157,Tabelle!$A$2:$C$90,3,FALSE) -> #N/D
B158: NO | D158: =VLOOKUP(C158,Tabelle!$A$2:$C$90,2,FALSE) -> #N/D | E158: =VLOOKUP(C158,Tabelle!$A$2:$C$90,3,FALSE) -> #N/D
B159: NO | D159: =VLOOKUP(C159,Tabelle!$A$2:$C$90,2,FALSE) -> #N/D | E159: =VLOOKUP(C159,Tabelle!$A$2:$C$90,3,FALSE) -> #N/D
B160: NO | D160: =VLOOKUP(C160,Tabelle!$A$2:$C$90,2,FALSE) -> #N/D | E160: =VLOOKUP(C160,Tabelle!$A$2:$C$90,3,FALSE) -> #N/D
B161: NO | D161: =VLOOKUP(C161,Tabelle!$A$2:$C$90,2,FALSE) -> #N/D | E161: =VLOOKUP(C161,Tabelle!$A$2:$C$90,3,FALSE) -> #N/D
B162: NO | D162: =VLOOKUP(C162,Tabelle!$A$2:$C$90,2,FALSE) -> #N/D | E162: =VLOOKUP(C162,Tabelle!$A$2:$C$90,3,FALSE) -> #N/D
B163: NO | D163: =VLOOKUP(C163,Tabelle!$A$2:$C$90,2,FALSE) -> #N/D | E163: =VLOOKUP(C163,Tabelle!$A$2:$C$90,3,FALSE) -> #N/D
B164: NO | D164: =VLOOKUP(C164,Tabelle!$A$2:$C$90,2,FALSE) -> #N/D | E164: =VLOOKUP(C164,Tabelle!$A$2:$C$90,3,FALSE) -> #N/D
B165: NO | D165: =VLOOKUP(C165,Tabelle!$A$2:$C$90,2,FALSE) -> #N/D | E165: =VLOOKUP(C165,Tabelle!$A$2:$C$90,3,FALSE) -> #N/D
B166: NO | D166: =VLOOKUP(C166,Tabelle!$A$2:$C$90,2,FALSE) -> #N/D | E166: =VLOOKUP(C166,Tabelle!$A$2:$C$90,3,FALSE) -> #N/D
B167: NO | D167: =VLOOKUP(C167,Tabelle!$A$2:$C$90,2,FALSE) -> #N/D | E167: =VLOOKUP(C167,Tabelle!$A$2:$C$90,3,FALSE) -> #N/D
B168: NO | D168: =VLOOKUP(C168,Tabelle!$A$2:$C$90,2,FALSE) -> #N/D | E168: =VLOOKUP(C168,Tabelle!$A$2:$C$90,3,FALSE) -> #N/D
B169: NO | D169: =VLOOKUP(C169,Tabelle!$A$2:$C$90,2,FALSE) -> #N/D | E169: =VLOOKUP(C169,Tabelle!$A$2:$C$90,3,FALSE) -> #N/D
B170: NO | D170: =VLOOKUP(C170,Tabelle!$A$2:$C$90,2,FALSE) -> #N/D | E170: =VLOOKUP(C170,Tabelle!$A$2:$C$90,3,FALSE) -> #N/D
B171: NO | D171: =VLOOKUP(C171,Tabelle!$A$2:$C$90,2,FALSE) -> #N/D | E171: =VLOOKUP(C171,Tabelle!$A$2:$C$90,3,FALSE) -> #N/D
B172: NO | D172: =VLOOKUP(C172,Tabelle!$A$2:$C$90,2,FALSE) -> #N/D | E172: =VLOOKUP(C172,Tabelle!$A$2:$C$90,3,FALSE) -> #N/D
B173: NO | D173: =VLOOKUP(C173,Tabelle!$A$2:$C$90,2,FALSE) -> #N/D | E173: =VLOOKUP(C173,Tabelle!$A$2:$C$90,3,FALSE) -> #N/D
B174: NO | D174: =VLOOKUP(C174,Tabelle!$A$2:$C$90,2,FALSE) -> #N/D | E174: =VLOOKUP(C174,Tabelle!$A$2:$C$90,3,FALSE) -> #N/D
B175: NO | D175: =VLOOKUP(C175,Tabelle!$A$2:$C$90,2,FALSE) -> #N/D | E175: =VLOOKUP(C175,Tabelle!$A$2:$C$90,3,FALSE) -> #N/D
B176: NO | D176: =VLOOKUP(C176,Tabelle!$A$2:$C$90,2,FALSE) -> #N/D | E176: =VLOOKUP(C176,Tabelle!$A$2:$C$90,3,FALSE) -> #N/D
B177: NO | D177: =VLOOKUP(C177,Tabelle!$A$2:$C$90,2,FALSE) -> #N/D | E177: =VLOOKUP(C177,Tabelle!$A$2:$C$90,3,FALSE) -> #N/D
B178: NO | D178: =VLOOKUP(C178,Tabelle!$A$2:$C$90,2,FALSE) -> #N/D | E178: =VLOOKUP(C178,Tabelle!$A$2:$C$90,3,FALSE) -> #N/D
B179: NO | D179: =VLOOKUP(C179,Tabelle!$A$2:$C$90,2,FALSE) -> #N/D | E179: =VLOOKUP(C179,Tabelle!$A$2:$C$90,3,FALSE) -> #N/D
B180: NO | D180: =VLOOKUP(C180,Tabelle!$A$2:$C$90,2,FALSE) -> #N/D | E180: =VLOOKUP(C180,Tabelle!$A$2:$C$90,3,FALSE) -> #N/D
B181: NO | D181: =VLOOKUP(C181,Tabelle!$A$2:$C$90,2,FALSE) -> #N/D | E181: =VLOOKUP(C181,Tabelle!$A$2:$C$90,3,FALSE) -> #N/D
B182: NO | D182: =VLOOKUP(C182,Tabelle!$A$2:$C$90,2,FALSE) -> #N/D | E182: =VLOOKUP(C182,Tabelle!$A$2:$C$90,3,FALSE) -> #N/D
B183: NO | D183: =VLOOKUP(C183,Tabelle!$A$2:$C$90,2,FALSE) -> #N/D | E183: =VLOOKUP(C183,Tabelle!$A$2:$C$90,3,FALSE) -> #N/D
B184: NO | D184: =VLOOKUP(C184,Tabelle!$A$2:$C$90,2,FALSE) -> #N/D | E184: =VLOOKUP(C184,Tabelle!$A$2:$C$90,3,FALSE) -> #N/D
B185: NO | D185: =VLOOKUP(C185,Tabelle!$A$2:$C$90,2,FALSE) -> #N/D | E185: =VLOOKUP(C185,Tabelle!$A$2:$C$90,3,FALSE) -> #N/D
B186: NO | D186: =VLOOKUP(C186,Tabelle!$A$2:$C$90,2,FALSE) -> #N/D | E186: =VLOOKUP(C186,Tabelle!$A$2:$C$90,3,FALSE) -> #N/D
B187: NO | D187: =VLOOKUP(C187,Tabelle!$A$2:$C$90,2,FALSE) -> #N/D | E187: =VLOOKUP(C187,Tabelle!$A$2:$C$90,3,FALSE) -> #N/D
B188: NO | D188: =VLOOKUP(C188,Tabelle!$A$2:$C$90,2,FALSE) -> #N/D | E188: =VLOOKUP(C188,Tabelle!$A$2:$C$90,3,FALSE) -> #N/D
B189: NO | D189: =VLOOKUP(C189,Tabelle!$A$2:$C$90,2,FALSE) -> #N/D | E189: =VLOOKUP(C189,Tabelle!$A$2:$C$90,3,FALSE) -> #N/D
B190: NO | D190: =VLOOKUP(C190,Tabelle!$A$2:$C$90,2,FALSE) -> #N/D | E190: =VLOOKUP(C190,Tabelle!$A$2:$C$90,3,FALSE) -> #N/D
B191: NO | D191: =VLOOKUP(C191,Tabelle!$A$2:$C$90,2,FALSE) -> #N/D | E191: =VLOOKUP(C191,Tabelle!$A$2:$C$90,3,FALSE) -> #N/D
B192: NO | D192: =VLOOKUP(C192,Tabelle!$A$2:$C$90,2,FALSE) -> #N/D | E192: =VLOOKUP(C192,Tabelle!$A$2:$C$90,3,FALSE) -> #N/D
B193: NO | D193: =VLOOKUP(C193,Tabelle!$A$2:$C$90,2,FALSE) -> #N/D | E193: =VLOOKUP(C193,Tabelle!$A$2:$C$90,3,FALSE) -> #N/D
B194: NO | D194: =VLOOKUP(C194,Tabelle!$A$2:$C$90,2,FALSE) -> #N/D | E194: =VLOOKUP(C194,Tabelle!$A$2:$C$90,3,FALSE) -> #N/D
B195: NO | D195: =VLOOKUP(C195,Tabelle!$A$2:$C$90,2,FALSE) -> #N/D | E195: =VLOOKUP(C195,Tabelle!$A$2:$C$90,3,FALSE) -> #N/D
B196: NO | D196: =VLOOKUP(C196,Tabelle!$A$2:$C$90,2,FALSE) -> #N/D | E196: =VLOOKUP(C196,Tabelle!$A$2:$C$90,3,FALSE) -> #N/D
B197: NO | D197: =VLOOKUP(C197,Tabelle!$A$2:$C$90,2,FALSE) -> #N/D | E197: =VLOOKUP(C197,Tabelle!$A$2:$C$90,3,FALSE) -> #N/D
B198: NO | D198: =VLOOKUP(C198,Tabelle!$A$2:$C$90,2,FALSE) -> #N/D | E198: =VLOOKUP(C198,Tabelle!$A$2:$C$90,3,FALSE) -> #N/D
B199: NO | D199: =VLOOKUP(C199,Tabelle!$A$2:$C$90,2,FALSE) -> #N/D | E199: =VLOOKUP(C199,Tabelle!$A$2:$C$90,3,FALSE) -> #N/D
B200: NO | D200: =VLOOKUP(C200,Tabelle!$A$2:$C$90,2,FALSE) -> #N/D | E200: =VLOOKUP(C200,Tabelle!$A$2:$C$90,3,FALSE) -> #N/D
B201: NO | D201: =VLOOKUP(C201,Tabelle!$A$2:$C$90,2,FALSE) -> #N/D | E201: =VLOOKUP(C201,Tabelle!$A$2:$C$90,3,FALSE) -> #N/D
B202: NO | D202: =VLOOKUP(C202,Tabelle!$A$2:$C$90,2,FALSE) -> #N/D | E202: =VLOOKUP(C202,Tabelle!$A$2:$C$90,3,FALSE) -> #N/D
B203: NO | D203: =VLOOKUP(C203,Tabelle!$A$2:$C$90,2,FALSE) -> #N/D | E203: =VLOOKUP(C203,Tabelle!$A$2:$C$90,3,FALSE) -> #N/D
B204: NO | D204: =VLOOKUP(C204,Tabelle!$A$2:$C$90,2,FALSE) -> #N/D | E204: =VLOOKUP(C204,Tabelle!$A$2:$C$90,3,FALSE) -> #N/D
B205: NO | D205: =VLOOKUP(C205,Tabelle!$A$2:$C$90,2,FALSE) -> #N/D | E205: =VLOOKUP(C205,Tabelle!$A$2:$C$90,3,FALSE) -> #N/D
B206: NO | D206: =VLOOKUP(C206,Tabelle!$A$2:$C$90,2,FALSE) -> #N/D | E206: =VLOOKUP(C206,Tabelle!$A$2:$C$90,3,FALSE) -> #N/D
B207: NO | D207: =VLOOKUP(C207,Tabelle!$A$2:$C$90,2,FALSE) -> #N/D | E207: =VLOOKUP(C207,Tabelle!$A$2:$C$90,3,FALSE) -> #N/D
B208: NO | D208: =VLOOKUP(C208,Tabelle!$A$2:$C$90,2,FALSE) -> #N/D | E208: =VLOOKUP(C208,Tabelle!$A$2:$C$90,3,FALSE) -> #N/D
B209: NO | D209: =VLOOKUP(C209,Tabelle!$A$2:$C$90,2,FALSE) -> #N/D | E209: =VLOOKUP(C209,Tabelle!$A$2:$C$90,3,FALSE) -> #N/D
B210: NO | D210: =VLOOKUP(C210,Tabelle!$A$2:$C$90,2,FALSE) -> #N/D | E210: =VLOOKUP(C210,Tabelle!$A$2:$C$90,3,FALSE) -> #N/D
B211: NO | D211: =VLOOKUP(C211,Tabelle!$A$2:$C$90,2,FALSE) -> #N/D | E211: =VLOOKUP(C211,Tabelle!$A$2:$C$90,3,FALSE) -> #N/D
B212: NO | D212: =VLOOKUP(C212,Tabelle!$A$2:$C$90,2,FALSE) -> #N/D | E212: =VLOOKUP(C212,Tabelle!$A$2:$C$90,3,FALSE) -> #N/D
B213: NO | D213: =VLOOKUP(C213,Tabelle!$A$2:$C$90,2,FALSE) -> #N/D | E213: =VLOOKUP(C213,Tabelle!$A$2:$C$90,3,FALSE) -> #N/D
B214: NO | D214: =VLOOKUP(C214,Tabelle!$A$2:$C$90,2,FALSE) -> #N/D | E214: =VLOOKUP(C214,Tabelle!$A$2:$C$90,3,FALSE) -> #N/D
B215: NO | D215: =VLOOKUP(C215,Tabelle!$A$2:$C$90,2,FALSE) -> #N/D | E215: =VLOOKUP(C215,Tabelle!$A$2:$C$90,3,FALSE) -> #N/D
B216: NO | D216: =VLOOKUP(C216,Tabelle!$A$2:$C$90,2,FALSE) -> #N/D | E216: =VLOOKUP(C216,Tabelle!$A$2:$C$90,3,FALSE) -> #N/D
B217: NO | D217: =VLOOKUP(C217,Tabelle!$A$2:$C$90,2,FALSE) -> #N/D | E217: =VLOOKUP(C217,Tabelle!$A$2:$C$90,3,FALSE) -> #N/D
B218: NO | D218: =VLOOKUP(C218,Tabelle!$A$2:$C$90,2,FALSE) -> #N/D | E218: =VLOOKUP(C218,Tabelle!$A$2:$C$90,3,FALSE) -> #N/D
B219: NO | D219: =VLOOKUP(C219,Tabelle!$A$2:$C$90,2,FALSE) -> #N/D | E219: =VLOOKUP(C219,Tabelle!$A$2:$C$90,3,FALSE) -> #N/D
B220: NO | D220: =VLOOKUP(C220,Tabelle!$A$2:$C$90,2,FALSE) -> #N/D | E220: =VLOOKUP(C220,Tabelle!$A$2:$C$90,3,FALSE) -> #N/D
B221: NO | D221: =VLOOKUP(C221,Tabelle!$A$2:$C$90,2,FALSE) -> #N/D | E221: =VLOOKUP(C221,Tabelle!$A$2:$C$90,3,FALSE) -> #N/D
B222: NO | D222: =VLOOKUP(C222,Tabelle!$A$2:$C$90,2,FALSE) -> #N/D | E222: =VLOOKUP(C222,Tabelle!$A$2:$C$90,3,FALSE) -> #N/D
B223: NO | D223: =VLOOKUP(C223,Tabelle!$A$2:$C$90,2,FALSE) -> #N/D | E223: =VLOOKUP(C223,Tabelle!$A$2:$C$90,3,FALSE) -> #N/D
B224: NO | D224: =VLOOKUP(C224,Tabelle!$A$2:$C$90,2,FALSE) -> #N/D | E224: =VLOOKUP(C224,Tabelle!$A$2:$C$90,3,FALSE) -> #N/D
B225: NO | D225: =VLOOKUP(C225,Tabelle!$A$2:$C$90,2,FALSE) -> #N/D | E225: =VLOOKUP(C225,Tabelle!$A$2:$C$90,3,FALSE) -> #N/D
B226: NO | D226: =VLOOKUP(C226,Tabelle!$A$2:$C$90,2,FALSE) -> #N/D | E226: =VLOOKUP(C226,Tabelle!$A$2:$C$90,3,FALSE) -> #N/D
B227: NO | D227: =VLOOKUP(C227,Tabelle!$A$2:$C$90,2,FALSE) -> #N/D | E227: =VLOOKUP(C227,Tabelle!$A$2:$C$90,3,FALSE) -> #N/D
B228: NO | D228: =VLOOKUP(C228,Tabelle!$A$2:$C$90,2,FALSE) -> #N/D | E228: =VLOOKUP(C228,Tabelle!$A$2:$C$90,3,FALSE) -> #N/D
B229: NO | D229: =VLOOKUP(C229,Tabelle!$A$2:$C$90,2,FALSE) -> #N/D | E229: =VLOOKUP(C229,Tabelle!$A$2:$C$90,3,FALSE) -> #N/D
B230: NO | D230: =VLOOKUP(C230,Tabelle!$A$2:$C$90,2,FALSE) -> #N/D | E230: =VLOOKUP(C230,Tabelle!$A$2:$C$90,3,FALSE) -> #N/D
B231: NO | D231: =VLOOKUP(C231,Tabelle!$A$2:$C$90,2,FALSE) -> #N/D | E231: =VLOOKUP(C231,Tabelle!$A$2:$C$90,3,FALSE) -> #N/D
B232: NO | D232: =VLOOKUP(C232,Tabelle!$A$2:$C$90,2,FALSE) -> #N/D | E232: =VLOOKUP(C232,Tabelle!$A$2:$C$90,3,FALSE) -> #N/D
B233: NO | D233: =VLOOKUP(C233,Tabelle!$A$2:$C$90,2,FALSE) -> #N/D | E233: =VLOOKUP(C233,Tabelle!$A$2:$C$90,3,FALSE) -> #N/D
B234: NO | D234: =VLOOKUP(C234,Tabelle!$A$2:$C$90,2,FALSE) -> #N/D | E234: =VLOOKUP(C234,Tabelle!$A$2:$C$90,3,FALSE) -> #N/D
B235: NO | D235: =VLOOKUP(C235,Tabelle!$A$2:$C$90,2,FALSE) -> #N/D | E235: =VLOOKUP(C235,Tabelle!$A$2:$C$90,3,FALSE) -> #N/D
B236: NO | D236: =VLOOKUP(C236,Tabelle!$A$2:$C$90,2,FALSE) -> #N/D | E236: =VLOOKUP(C236,Tabelle!$A$2:$C$90,3,FALSE) -> #N/D
B237: NO | D237: =VLOOKUP(C237,Tabelle!$A$2:$C$90,2,FALSE) -> #N/D | E237: =VLOOKUP(C237,Tabelle!$A$2:$C$90,3,FALSE) -> #N/D
B238: NO | D238: =VLOOKUP(C238,Tabelle!$A$2:$C$90,2,FALSE) -> #N/D | E238: =VLOOKUP(C238,Tabelle!$A$2:$C$90,3,FALSE) -> #N/D
B239: NO | D239: =VLOOKUP(C239,Tabelle!$A$2:$C$90,2,FALSE) -> #N/D | E239: =VLOOKUP(C239,Tabelle!$A$2:$C$90,3,FALSE) -> #N/D
B240: NO | D240: =VLOOKUP(C240,Tabelle!$A$2:$C$90,2,FALSE) -> #N/D | E240: =VLOOKUP(C240,Tabelle!$A$2:$C$90,3,FALSE) -> #N/D
B241: NO | D241: =VLOOKUP(C241,Tabelle!$A$2:$C$90,2,FALSE) -> #N/D | E241: =VLOOKUP(C241,Tabelle!$A$2:$C$90,3,FALSE) -> #N/D
B242: NO | D242: =VLOOKUP(C242,Tabelle!$A$2:$C$90,2,FALSE) -> #N/D | E242: =VLOOKUP(C242,Tabelle!$A$2:$C$90,3,FALSE) -> #N/D
B243: NO | D243: =VLOOKUP(C243,Tabelle!$A$2:$C$90,2,FALSE) -> #N/D | E243: =VLOOKUP(C243,Tabelle!$A$2:$C$90,3,FALSE) -> #N/D
B244: NO | D244: =VLOOKUP(C244,Tabelle!$A$2:$C$90,2,FALSE) -> #N/D | E244: =VLOOKUP(C244,Tabelle!$A$2:$C$90,3,FALSE) -> #N/D
B245: NO | D245: =VLOOKUP(C245,Tabelle!$A$2:$C$90,2,FALSE) -> #N/D | E245: =VLOOKUP(C245,Tabelle!$A$2:$C$90,3,FALSE) -> #N/D
B246: NO | D246: =VLOOKUP(C246,Tabelle!$A$2:$C$90,2,FALSE) -> #N/D | E246: =VLOOKUP(C246,Tabelle!$A$2:$C$90,3,FALSE) -> #N/D
B247: NO | D247: =VLOOKUP(C247,Tabelle!$A$2:$C$90,2,FALSE) -> #N/D | E247: =VLOOKUP(C247,Tabelle!$A$2:$C$90,3,FALSE) -> #N/D
B248: NO | D248: =VLOOKUP(C248,Tabelle!$A$2:$C$90,2,FALSE) -> #N/D | E248: =VLOOKUP(C248,Tabelle!$A$2:$C$90,3,FALSE) -> #N/D
B249: NO | D249: =VLOOKUP(C249,Tabelle!$A$2:$C$90,2,FALSE) -> #N/D | E249: =VLOOKUP(C249,Tabelle!$A$2:$C$90,3,FALSE) -> #N/D
B250: NO | D250: =VLOOKUP(C250,Tabelle!$A$2:$C$90,2,FALSE) -> #N/D | E250: =VLOOKUP(C250,Tabelle!$A$2:$C$90,3,FALSE) -> #N/D
B251: NO | D251: =VLOOKUP(C251,Tabelle!$A$2:$C$90,2,FALSE) -> #N/D | E251: =VLOOKUP(C251,Tabelle!$A$2:$C$90,3,FALSE) -> #N/D
B252: NO | D252: =VLOOKUP(C252,Tabelle!$A$2:$C$90,2,FALSE) -> #N/D | E252: =VLOOKUP(C252,Tabelle!$A$2:$C$90,3,FALSE) -> #N/D
B253: NO | D253: =VLOOKUP(C253,Tabelle!$A$2:$C$90,2,FALSE) -> #N/D | E253: =VLOOKUP(C253,Tabelle!$A$2:$C$90,3,FALSE) -> #N/D
B254: NO | D254: =VLOOKUP(C254,Tabelle!$A$2:$C$90,2,FALSE) -> #N/D | E254: =VLOOKUP(C254,Tabelle!$A$2:$C$90,3,FALSE) -> #N/D
B255: NO | D255: =VLOOKUP(C255,Tabelle!$A$2:$C$90,2,FALSE) -> #N/D | E255: =VLOOKUP(C255,Tabelle!$A$2:$C$90,3,FALSE) -> #N/D
B256: NO | D256: =VLOOKUP(C256,Tabelle!$A$2:$C$90,2,FALSE) -> #N/D | E256: =VLOOKUP(C256,Tabelle!$A$2:$C$90,3,FALSE) -> #N/D
B257: NO | D257: =VLOOKUP(C257,Tabelle!$A$2:$C$90,2,FALSE) -> #N/D | E257: =VLOOKUP(C257,Tabelle!$A$2:$C$90,3,FALSE) -> #N/D
B258: NO | D258: =VLOOKUP(C258,Tabelle!$A$2:$C$90,2,FALSE) -> #N/D | E258: =VLOOKUP(C258,Tabelle!$A$2:$C$90,3,FALSE) -> #N/D
B259: NO | D259: =VLOOKUP(C259,Tabelle!$A$2:$C$90,2,FALSE) -> #N/D | E259: =VLOOKUP(C259,Tabelle!$A$2:$C$90,3,FALSE) -> #N/D
B260: NO | D260: =VLOOKUP(C260,Tabelle!$A$2:$C$90,2,FALSE) -> #N/D | E260: =VLOOKUP(C260,Tabelle!$A$2:$C$90,3,FALSE) -> #N/D
B261: NO | D261: =VLOOKUP(C261,Tabelle!$A$2:$C$90,2,FALSE) -> #N/D | E261: =VLOOKUP(C261,Tabelle!$A$2:$C$90,3,FALSE) -> #N/D
B262: NO | D262: =VLOOKUP(C262,Tabelle!$A$2:$C$90,2,FALSE) -> #N/D | E262: =VLOOKUP(C262,Tabelle!$A$2:$C$90,3,FALSE) -> #N/D
B263: NO | D263: =VLOOKUP(C263,Tabelle!$A$2:$C$90,2,FALSE) -> #N/D | E263: =VLOOKUP(C263,Tabelle!$A$2:$C$90,3,FALSE) -> #N/D
B264: NO | D264: =VLOOKUP(C264,Tabelle!$A$2:$C$90,2,FALSE) -> #N/D | E264: =VLOOKUP(C264,Tabelle!$A$2:$C$90,3,FALSE) -> #N/D
B265: NO | D265: =VLOOKUP(C265,Tabelle!$A$2:$C$90,2,FALSE) -> #N/D | E265: =VLOOKUP(C265,Tabelle!$A$2:$C$90,3,FALSE) -> #N/D
B266: NO | D266: =VLOOKUP(C266,Tabelle!$A$2:$C$90,2,FALSE) -> #N/D | E266: =VLOOKUP(C266,Tabelle!$A$2:$C$90,3,FALSE) -> #N/D
B267: NO | D267: =VLOOKUP(C267,Tabelle!$A$2:$C$90,2,FALSE) -> #N/D | E267: =VLOOKUP(C267,Tabelle!$A$2:$C$90,3,FALSE) -> #N/D
B268: NO | D268: =VLOOKUP(C268,Tabelle!$A$2:$C$90,2,FALSE) -> #N/D | E268: =VLOOKUP(C268,Tabelle!$A$2:$C$90,3,FALSE) -> #N/D
B269: NO | D269: =VLOOKUP(C269,Tabelle!$A$2:$C$90,2,FALSE) -> #N/D | E269: =VLOOKUP(C269,Tabelle!$A$2:$C$90,3,FALSE) -> #N/D
B270: NO | D270: =VLOOKUP(C270,Tabelle!$A$2:$C$90,2,FALSE) -> #N/D | E270: =VLOOKUP(C270,Tabelle!$A$2:$C$90,3,FALSE) -> #N/D
B271: NO | D271: =VLOOKUP(C271,Tabelle!$A$2:$C$90,2,FALSE) -> #N/D | E271: =VLOOKUP(C271,Tabelle!$A$2:$C$90,3,FALSE) -> #N/D
B272: NO | D272: =VLOOKUP(C272,Tabelle!$A$2:$C$90,2,FALSE) -> #N/D | E272: =VLOOKUP(C272,Tabelle!$A$2:$C$90,3,FALSE) -> #N/D
B273: NO | D273: =VLOOKUP(C273,Tabelle!$A$2:$C$90,2,FALSE) -> #N/D | E273: =VLOOKUP(C273,Tabelle!$A$2:$C$90,3,FALSE) -> #N/D
B274: NO | D274: =VLOOKUP(C274,Tabelle!$A$2:$C$90,2,FALSE) -> #N/D | E274: =VLOOKUP(C274,Tabelle!$A$2:$C$90,3,FALSE) -> #N/D
B275: NO | D275: =VLOOKUP(C275,Tabelle!$A$2:$C$90,2,FALSE) -> #N/D | E275: =VLOOKUP(C275,Tabelle!$A$2:$C$90,3,FALSE) -> #N/D
B276: NO | D276: =VLOOKUP(C276,Tabelle!$A$2:$C$90,2,FALSE) -> #N/D | E276: =VLOOKUP(C276,Tabelle!$A$2:$C$90,3,FALSE) -> #N/D
B277: NO | D277: =VLOOKUP(C277,Tabelle!$A$2:$C$90,2,FALSE) -> #N/D | E277: =VLOOKUP(C277,Tabelle!$A$2:$C$90,3,FALSE) -> #N/D
B278: NO | D278: =VLOOKUP(C278,Tabelle!$A$2:$C$90,2,FALSE) -> #N/D | E278: =VLOOKUP(C278,Tabelle!$A$2:$C$90,3,FALSE) -> #N/D
B279: NO | D279: =VLOOKUP(C279,Tabelle!$A$2:$C$90,2,FALSE) -> #N/D | E279: =VLOOKUP(C279,Tabelle!$A$2:$C$90,3,FALSE) -> #N/D
B280: NO | D280: =VLOOKUP(C280,Tabelle!$A$2:$C$90,2,FALSE) -> #N/D | E280: =VLOOKUP(C280,Tabelle!$A$2:$C$90,3,FALSE) -> #N/D
B281: NO | D281: =VLOOKUP(C281,Tabelle!$A$2:$C$90,2,FALSE) -> #N/D | E281: =VLOOKUP(C281,Tabelle!$A$2:$C$90,3,FALSE) -> #N/D
B282: NO | D282: =VLOOKUP(C282,Tabelle!$A$2:$C$90,2,FALSE) -> #N/D | E282: =VLOOKUP(C282,Tabelle!$A$2:$C$90,3,FALSE) -> #N/D
B283: NO | D283: =VLOOKUP(C283,Tabelle!$A$2:$C$90,2,FALSE) -> #N/D | E283: =VLOOKUP(C283,Tabelle!$A$2:$C$90,3,FALSE) -> #N/D
B284: NO | D284: =VLOOKUP(C284,Tabelle!$A$2:$C$90,2,FALSE) -> #N/D | E284: =VLOOKUP(C284,Tabelle!$A$2:$C$90,3,FALSE) -> #N/D
B285: NO | D285: =VLOOKUP(C285,Tabelle!$A$2:$C$90,2,FALSE) -> #N/D | E285: =VLOOKUP(C285,Tabelle!$A$2:$C$90,3,FALSE) -> #N/D
B286: NO | D286: =VLOOKUP(C286,Tabelle!$A$2:$C$90,2,FALSE) -> #N/D | E286: =VLOOKUP(C286,Tabelle!$A$2:$C$90,3,FALSE) -> #N/D
B287: NO | D287: =VLOOKUP(C287,Tabelle!$A$2:$C$90,2,FALSE) -> #N/D | E287: =VLOOKUP(C287,Tabelle!$A$2:$C$90,3,FALSE) -> #N/D
B288: NO | D288: =VLOOKUP(C288,Tabelle!$A$2:$C$90,2,FALSE) -> #N/D | E288: =VLOOKUP(C288,Tabelle!$A$2:$C$90,3,FALSE) -> #N/D
B289: NO | D289: =VLOOKUP(C289,Tabelle!$A$2:$C$90,2,FALSE) -> #N/D | E289: =VLOOKUP(C289,Tabelle!$A$2:$C$90,3,FALSE) -> #N/D
B290: NO | D290: =VLOOKUP(C290,Tabelle!$A$2:$C$90,2,FALSE) -> #N/D | E290: =VLOOKUP(C290,Tabelle!$A$2:$C$90,3,FALSE) -> #N/D
B291: NO | D291: =VLOOKUP(C291,Tabelle!$A$2:$C$90,2,FALSE) -> #N/D | E291: =VLOOKUP(C291,Tabelle!$A$2:$C$90,3,FALSE) -> #N/D
B292: NO | D292: =VLOOKUP(C292,Tabelle!$A$2:$C$90,2,FALSE) -> #N/D | E292: =VLOOKUP(C292,Tabelle!$A$2:$C$90,3,FALSE) -> #N/D
B293: NO | D293: =VLOOKUP(C293,Tabelle!$A$2:$C$90,2,FALSE) -> #N/D | E293: =VLOOKUP(C293,Tabelle!$A$2:$C$90,3,FALSE) -> #N/D
B294: NO | D294: =VLOOKUP(C294,Tabelle!$A$2:$C$90,2,FALSE) -> #N/D | E294: =VLOOKUP(C294,Tabelle!$A$2:$C$90,3,FALSE) -> #N/D
B295: NO | D295: =VLOOKUP(C295,Tabelle!$A$2:$C$90,2,FALSE) -> #N/D | E295: =VLOOKUP(C295,Tabelle!$A$2:$C$90,3,FALSE) -> #N/D
B296: NO | D296: =VLOOKUP(C296,Tabelle!$A$2:$C$90,2,FALSE) -> #N/D | E296: =VLOOKUP(C296,Tabelle!$A$2:$C$90,3,FALSE) -> #N/D
B297: NO | D297: =VLOOKUP(C297,Tabelle!$A$2:$C$90,2,FALSE) -> #N/D | E297: =VLOOKUP(C297,Tabelle!$A$2:$C$90,3,FALSE) -> #N/D
B298: NO | D298: =VLOOKUP(C298,Tabelle!$A$2:$C$90,2,FALSE) -> #N/D | E298: =VLOOKUP(C298,Tabelle!$A$2:$C$90,3,FALSE) -> #N/D
B299: NO | D299: =VLOOKUP(C299,Tabelle!$A$2:$C$90,2,FALSE) -> #N/D | E299: =VLOOKUP(C299,Tabelle!$A$2:$C$90,3,FALSE) -> #N/D
B300: NO | D300: =VLOOKUP(C300,Tabelle!$A$2:$C$90,2,FALSE) -> #N/D | E300: =VLOOKUP(C300,Tabelle!$A$2:$C$90,3,FALSE) -> #N/D
B301: NO | D301: =VLOOKUP(C301,Tabelle!$A$2:$C$90,2,FALSE) -> #N/D | E301: =VLOOKUP(C301,Tabelle!$A$2:$C$90,3,FALSE) -> #N/D