A1: Orario partenza imbarcazioni | F1: 0.54166666666666663
F2: CLASSIFICA TEMPI COMPENSATI
A3: N° iscrizione | B3: Ora arrivo | C3: Tempo reale | D3: Tempo compensato | E3: Posizione Assoluta | F3: Posizione compensato | G3: Classe | H3: Skipper | I3: Prodiere | J3: YS | K3: Circolo Velico
A4: 6 | B4: 0.69369212962962967 | C4: =IF(ISBLANK(B4),"",B4-$F$1) -> 0.15202546296296304 | D4: =IF(ISNA(J4),"",C4*1000/J4) -> 0.12481565103691547 | E4: =IF(ISBLANK(A4),"",RANK(C4,$C$4:$C$40,1)) -> 18 | F4: =IF(ISNA(J4),"",RANK(D4,$D$4:$D$40,1)) -> 1 | G4: =IF(ISBLANK(A4),"",VLOOKUP($A4,'[CLASSIFICA FITZ CUP 2012 3.xls]Iscrizioni'!$A$4:$L$150,5,FALSE)) -> Topaz uno race plus | H4: =IF(ISBLANK(A4),"",VLOOKUP($A4,'[CLASSIFICA FITZ CUP 2012 3.xls]Iscrizioni'!$A$4:$L$150,7,FALSE)) -> Scarpa Alberto | I4: =IF(ISBLANK(A4),"",TRIM(VLOOKUP($A4,'[CLASSIFICA FITZ CUP 2012 3.xls]Iscrizioni'!$A$4:$L$150,8,FALSE))) ->  | J4: =VLOOKUP($A4,'[CLASSIFICA FITZ CUP 2012 3.xls]Iscrizioni'!$A$4:$L$150,6,FALSE) -> 1218 | K4: =IF(ISBLANK(A4),"",TRIM(VLOOKUP($A4,'[CLASSIFICA FITZ CUP 2012 3.xls]Iscrizioni'!$A$4:$L$150,10,FALSE))) -> Sun&sea
A5: 14 | B5: 0.6788657407407408 | C5: =IF(ISBLANK(B5),"",B5-$F$1) -> 0.13719907407407417 | D5: =IF(ISNA(J5),"",C5*1000/J5) -> 0.12645075951527573 | E5: =IF(ISBLANK(A5),"",RANK(C5,$C$4:$C$40,1)) -> 3 | F5: =IF(ISNA(J5),"",RANK(D5,$D$4:$D$40,1)) -> 2 | G5: =IF(ISBLANK(A5),"",VLOOKUP($A5,'[CLASSIFICA FITZ CUP 2012 3.xls]Iscrizioni'!$A$4:$L$150,5,FALSE)) -> Laser std | H5: =IF(ISBLANK(A5),"",VLOOKUP($A5,'[CLASSIFICA FITZ CUP 2012 3.xls]Iscrizioni'!$A$4:$L$150,7,FALSE)) -> Barozzi Mauro | J5: =VLOOKUP($A5,'[CLASSIFICA FITZ CUP 2012 3.xls]Iscrizioni'!$A$4:$L$150,6,FALSE) -> 1085 | K5: =IF(ISBLANK(A5),"",TRIM(VLOOKUP($A5,'[CLASSIFICA FITZ CUP 2012 3.xls]Iscrizioni'!$A$4:$L$150,10,FALSE))) -> CDDF
A6: 21 | B6: 0.69458333333333344 | C6: =IF(ISBLANK(B6),"",B6-$F$1) -> 0.15291666666666681 | D6: =IF(ISNA(J6),"",C6*1000/J6) -> 0.12860947574993004 | E6: =IF(ISBLANK(A6),"",RANK(C6,$C$4:$C$40,1)) -> 19 | F6: =IF(ISNA(J6),"",RANK(D6,$D$4:$D$40,1)) -> 3 | G6: =IF(ISBLANK(A6),"",VLOOKUP($A6,'[CLASSIFICA FITZ CUP 2012 3.xls]Iscrizioni'!$A$4:$L$150,5,FALSE)) -> RS Feva | H6: =IF(ISBLANK(A6),"",VLOOKUP($A6,'[CLASSIFICA FITZ CUP 2012 3.xls]Iscrizioni'!$A$4:$L$150,7,FALSE)) -> Bonicalza Mario | I6: =IF(ISBLANK(A6),"",TRIM(VLOOKUP($A6,'[CLASSIFICA FITZ CUP 2012 3.xls]Iscrizioni'!$A$4:$L$150,8,FALSE))) -> Bonicalza Luca | J6: =VLOOKUP($A6,'[CLASSIFICA FITZ CUP 2012 3.xls]Iscrizioni'!$A$4:$L$150,6,FALSE) -> 1189 | K6: =IF(ISBLANK(A6),"",TRIM(VLOOKUP($A6,'[CLASSIFICA FITZ CUP 2012 3.xls]Iscrizioni'!$A$4:$L$150,10,FALSE))) -> GDV LNI Milano
A7: 15 | B7: 0.68167824074074079 | C7: =IF(ISBLANK(B7),"",B7-$F$1) -> 0.14001157407407416 | D7: =IF(ISNA(J7),"",C7*1000/J7) -> 0.12904292541389323 | E7: =IF(ISBLANK(A7),"",RANK(C7,$C$4:$C$40,1)) -> 4 | F7: =IF(ISNA(J7),"",RANK(D7,$D$4:$D$40,1)) -> 4 | G7: =IF(ISBLANK(A7),"",VLOOKUP($A7,'[CLASSIFICA FITZ CUP 2012 3.xls]Iscrizioni'!$A$4:$L$150,5,FALSE)) -> Laser std | H7: =IF(ISBLANK(A7),"",VLOOKUP($A7,'[CLASSIFICA FITZ CUP 2012 3.xls]Iscrizioni'!$A$4:$L$150,7,FALSE)) -> Cassini Marcello | I7: =IF(ISBLANK(A7),"",TRIM(VLOOKUP($A7,'[CLASSIFICA FITZ CUP 2012 3.xls]Iscrizioni'!$A$4:$L$150,8,FALSE))) ->  | J7: =VLOOKUP($A7,'[CLASSIFICA FITZ CUP 2012 3.xls]Iscrizioni'!$A$4:$L$150,6,FALSE) -> 1085 | K7: =IF(ISBLANK(A7),"",TRIM(VLOOKUP($A7,'[CLASSIFICA FITZ CUP 2012 3.xls]Iscrizioni'!$A$4:$L$150,10,FALSE))) -> CDDF
A8: 4 | B8: 0.68937500000000007 | C8: =IF(ISBLANK(B8),"",B8-$F$1) -> 0.14770833333333344 | D8: =IF(ISNA(J8),"",C8*1000/J8) -> 0.12956871345029247 | E8: =IF(ISBLANK(A8),"",RANK(C8,$C$4:$C$40,1)) -> 14 | F8: =IF(ISNA(J8),"",RANK(D8,$D$4:$D$40,1)) -> 5 | G8: =IF(ISBLANK(A8),"",VLOOKUP($A8,'[CLASSIFICA FITZ CUP 2012 3.xls]Iscrizioni'!$A$4:$L$150,5,FALSE)) -> Byte C2 | H8: =IF(ISBLANK(A8),"",VLOOKUP($A8,'[CLASSIFICA FITZ CUP 2012 3.xls]Iscrizioni'!$A$4:$L$150,7,FALSE)) -> Dugnani Giacomo | I8: =IF(ISBLANK(A8),"",TRIM(VLOOKUP($A8,'[CLASSIFICA FITZ CUP 2012 3.xls]Iscrizioni'!$A$4:$L$150,8,FALSE))) ->  | J8: =VLOOKUP($A8,'[CLASSIFICA FITZ CUP 2012 3.xls]Iscrizioni'!$A$4:$L$150,6,FALSE) -> 1140 | K8: =IF(ISBLANK(A8),"",TRIM(VLOOKUP($A8,'[CLASSIFICA FITZ CUP 2012 3.xls]Iscrizioni'!$A$4:$L$150,10,FALSE))) -> GDV LNI BS Desenzano
A9: 17 | B9: 0.68690972222222213 | C9: =IF(ISBLANK(B9),"",B9-$F$1) -> 0.1452430555555555 | D9: =IF(ISNA(J9),"",C9*1000/J9) -> 0.13014610712863395 | E9: =IF(ISBLANK(A9),"",RANK(C9,$C$4:$C$40,1)) -> 8 | F9: =IF(ISNA(J9),"",RANK(D9,$D$4:$D$40,1)) -> 6 | G9: =IF(ISBLANK(A9),"",VLOOKUP($A9,'[CLASSIFICA FITZ CUP 2012 3.xls]Iscrizioni'!$A$4:$L$150,5,FALSE)) -> FJ | H9: =IF(ISBLANK(A9),"",VLOOKUP($A9,'[CLASSIFICA FITZ CUP 2012 3.xls]Iscrizioni'!$A$4:$L$150,7,FALSE)) -> Zabrzewska Magdalena | I9: =IF(ISBLANK(A9),"",TRIM(VLOOKUP($A9,'[CLASSIFICA FITZ CUP 2012 3.xls]Iscrizioni'!$A$4:$L$150,8,FALSE))) -> Corbellari Gianluigi | J9: =VLOOKUP($A9,'[CLASSIFICA FITZ CUP 2012 3.xls]Iscrizioni'!$A$4:$L$150,6,FALSE) -> 1116 | K9: =IF(ISBLANK(A9),"",TRIM(VLOOKUP($A9,'[CLASSIFICA FITZ CUP 2012 3.xls]Iscrizioni'!$A$4:$L$150,10,FALSE))) -> CDDF
A10: 13 | B10: 0.69747685185185182 | C10: =IF(ISBLANK(B10),"",B10-$F$1) -> 0.15581018518518519 | D10: =IF(ISNA(J10),"",C10*1000/J10) -> 0.1310430489362365 | E10: =IF(ISBLANK(A10),"",RANK(C10,$C$4:$C$40,1)) -> 23 | F10: =IF(ISNA(J10),"",RANK(D10,$D$4:$D$40,1)) -> 7 | G10: =IF(ISBLANK(A10),"",VLOOKUP($A10,'[CLASSIFICA FITZ CUP 2012 3.xls]Iscrizioni'!$A$4:$L$150,5,FALSE)) -> RS Feva | H10: =IF(ISBLANK(A10),"",VLOOKUP($A10,'[CLASSIFICA FITZ CUP 2012 3.xls]Iscrizioni'!$A$4:$L$150,7,FALSE)) -> Trevisan Luca | I10: =IF(ISBLANK(A10),"",TRIM(VLOOKUP($A10,'[CLASSIFICA FITZ CUP 2012 3.xls]Iscrizioni'!$A$4:$L$150,8,FALSE))) -> Trevisan Filippo | J10: =VLOOKUP($A10,'[CLASSIFICA FITZ CUP 2012 3.xls]Iscrizioni'!$A$4:$L$150,6,FALSE) -> 1189 | K10: =IF(ISBLANK(A10),"",TRIM(VLOOKUP($A10,'[CLASSIFICA FITZ CUP 2012 3.xls]Iscrizioni'!$A$4:$L$150,10,FALSE))) -> VC Acquafresca
A11: 18 | B11: 0.68405092592592587 | C11: =IF(ISBLANK(B11),"",B11-$F$1) -> 0.14238425925925924 | D11: =IF(ISNA(J11),"",C11*1000/J11) -> 0.13122973203618363 | E11: =IF(ISBLANK(A11),"",RANK(C11,$C$4:$C$40,1)) -> 5 | F11: =IF(ISNA(J11),"",RANK(D11,$D$4:$D$40,1)) -> 8 | G11: =IF(ISBLANK(A11),"",VLOOKUP($A11,'[CLASSIFICA FITZ CUP 2012 3.xls]Iscrizioni'!$A$4:$L$150,5,FALSE)) -> Laser std | H11: =IF(ISBLANK(A11),"",VLOOKUP($A11,'[CLASSIFICA FITZ CUP 2012 3.xls]Iscrizioni'!$A$4:$L$150,7,FALSE)) -> Gasparini Alessandro | I11: =IF(ISBLANK(A11),"",TRIM(VLOOKUP($A11,'[CLASSIFICA FITZ CUP 2012 3.xls]Iscrizioni'!$A$4:$L$150,8,FALSE))) ->  | J11: =VLOOKUP($A11,'[CLASSIFICA FITZ CUP 2012 3.xls]Iscrizioni'!$A$4:$L$150,6,FALSE) -> 1085 | K11: =IF(ISBLANK(A11),"",TRIM(VLOOKUP($A11,'[CLASSIFICA FITZ CUP 2012 3.xls]Iscrizioni'!$A$4:$L$150,10,FALSE))) -> LNI Belluno
A12: 25 | B12: 0.69717592592592592 | C12: =IF(ISBLANK(B12),"",B12-$F$1) -> 0.15550925925925929 | D12: =IF(ISNA(J12),"",C12*1000/J12) -> 0.1323483057525611 | E12: =IF(ISBLANK(A12),"",RANK(C12,$C$4:$C$40,1)) -> 22 | F12: =IF(ISNA(J12),"",RANK(D12,$D$4:$D$40,1)) -> 9 | G12: =IF(ISBLANK(A12),"",VLOOKUP($A12,'[CLASSIFICA FITZ CUP 2012 3.xls]Iscrizioni'!$A$4:$L$150,5,FALSE)) -> Laser 4.7 | H12: =IF(ISBLANK(A12),"",VLOOKUP($A12,'[CLASSIFICA FITZ CUP 2012 3.xls]Iscrizioni'!$A$4:$L$150,7,FALSE)) -> Ferrari Davide | I12: =IF(ISBLANK(A12),"",TRIM(VLOOKUP($A12,'[CLASSIFICA FITZ CUP 2012 3.xls]Iscrizioni'!$A$4:$L$150,8,FALSE))) ->  | J12: =VLOOKUP($A12,'[CLASSIFICA FITZ CUP 2012 3.xls]Iscrizioni'!$A$4:$L$150,6,FALSE) -> 1175 | K12: =IF(ISBLANK(A12),"",TRIM(VLOOKUP($A12,'[CLASSIFICA FITZ CUP 2012 3.xls]Iscrizioni'!$A$4:$L$150,10,FALSE))) -> GDV LNI BS Desenzano
A13: 12 | B13: 0.69351851851851853 | C13: =IF(ISBLANK(B13),"",B13-$F$1) -> 0.1518518518518519 | D13: =IF(ISNA(J13),"",C13*1000/J13) -> 0.13262170467410647 | E13: =IF(ISBLANK(A13),"",RANK(C13,$C$4:$C$40,1)) -> 17 | F13: =IF(ISNA(J13),"",RANK(D13,$D$4:$D$40,1)) -> 10 | G13: =IF(ISBLANK(A13),"",VLOOKUP($A13,'[CLASSIFICA FITZ CUP 2012 3.xls]Iscrizioni'!$A$4:$L$150,5,FALSE)) -> Europa | H13: =IF(ISBLANK(A13),"",VLOOKUP($A13,'[CLASSIFICA FITZ CUP 2012 3.xls]Iscrizioni'!$A$4:$L$150,7,FALSE)) -> Riva Filippo | I13: =IF(ISBLANK(A13),"",TRIM(VLOOKUP($A13,'[CLASSIFICA FITZ CUP 2012 3.xls]Iscrizioni'!$A$4:$L$150,8,FALSE))) ->  | J13: =VLOOKUP($A13,'[CLASSIFICA FITZ CUP 2012 3.xls]Iscrizioni'!$A$4:$L$150,6,FALSE) -> 1145 | K13: =IF(ISBLANK(A13),"",TRIM(VLOOKUP($A13,'[CLASSIFICA FITZ CUP 2012 3.xls]Iscrizioni'!$A$4:$L$150,10,FALSE))) -> VC Acquafresca
A14: 31 | B14: 0.68668981481481473 | C14: =IF(ISBLANK(B14),"",B14-$F$1) -> 0.1450231481481481 | D14: =IF(ISNA(J14),"",C14*1000/J14) -> 0.13366188769414572 | E14: =IF(ISBLANK(A14),"",RANK(C14,$C$4:$C$40,1)) -> 7 | F14: =IF(ISNA(J14),"",RANK(D14,$D$4:$D$40,1)) -> 11 | G14: =IF(ISBLANK(A14),"",VLOOKUP($A14,'[CLASSIFICA FITZ CUP 2012 3.xls]Iscrizioni'!$A$4:$L$150,5,FALSE)) -> Laser std | H14: =IF(ISBLANK(A14),"",VLOOKUP($A14,'[CLASSIFICA FITZ CUP 2012 3.xls]Iscrizioni'!$A$4:$L$150,7,FALSE)) -> Cattelani Andrea | I14: =IF(ISBLANK(A14),"",TRIM(VLOOKUP($A14,'[CLASSIFICA FITZ CUP 2012 3.xls]Iscrizioni'!$A$4:$L$150,8,FALSE))) ->  | J14: =VLOOKUP($A14,'[CLASSIFICA FITZ CUP 2012 3.xls]Iscrizioni'!$A$4:$L$150,6,FALSE) -> 1085 | K14: =IF(ISBLANK(A14),"",TRIM(VLOOKUP($A14,'[CLASSIFICA FITZ CUP 2012 3.xls]Iscrizioni'!$A$4:$L$150,10,FALSE))) -> CDDF
A15: 26 | B15: 0.70356481481481481 | C15: =IF(ISBLANK(B15),"",B15-$F$1) -> 0.16189814814814818 | D15: =IF(ISNA(J15),"",C15*1000/J15) -> 0.13435530966651302 | E15: =IF(ISBLANK(A15),"",RANK(C15,$C$4:$C$40,1)) -> 27 | F15: =IF(ISNA(J15),"",RANK(D15,$D$4:$D$40,1)) -> 12 | G15: =IF(ISBLANK(A15),"",VLOOKUP($A15,'[CLASSIFICA FITZ CUP 2012 3.xls]Iscrizioni'!$A$4:$L$150,5,FALSE)) -> Laser 13 | H15: =IF(ISBLANK(A15),"",VLOOKUP($A15,'[CLASSIFICA FITZ CUP 2012 3.xls]Iscrizioni'!$A$4:$L$150,7,FALSE)) -> Veneziano Roberto | I15: =IF(ISBLANK(A15),"",TRIM(VLOOKUP($A15,'[CLASSIFICA FITZ CUP 2012 3.xls]Iscrizioni'!$A$4:$L$150,8,FALSE))) -> Tajana Enrico | J15: =VLOOKUP($A15,'[CLASSIFICA FITZ CUP 2012 3.xls]Iscrizioni'!$A$4:$L$150,6,FALSE) -> 1205 | K15: =IF(ISBLANK(A15),"",TRIM(VLOOKUP($A15,'[CLASSIFICA FITZ CUP 2012 3.xls]Iscrizioni'!$A$4:$L$150,10,FALSE))) -> GDV LNI BS Desenzano
A16: 33 | B16: 0.69567129629629632 | C16: =IF(ISBLANK(B16),"",B16-$F$1) -> 0.15400462962962969 | D16: =IF(ISNA(J16),"",C16*1000/J16) -> 0.13450185993854119 | E16: =IF(ISBLANK(A16),"",RANK(C16,$C$4:$C$40,1)) -> 20 | F16: =IF(ISNA(J16),"",RANK(D16,$D$4:$D$40,1)) -> 13 | G16: =IF(ISBLANK(A16),"",VLOOKUP($A16,'[CLASSIFICA FITZ CUP 2012 3.xls]Iscrizioni'!$A$4:$L$150,5,FALSE)) -> Europa | H16: =IF(ISBLANK(A16),"",VLOOKUP($A16,'[CLASSIFICA FITZ CUP 2012 3.xls]Iscrizioni'!$A$4:$L$150,7,FALSE)) -> Benamati Anna | I16: =IF(ISBLANK(A16),"",TRIM(VLOOKUP($A16,'[CLASSIFICA FITZ CUP 2012 3.xls]Iscrizioni'!$A$4:$L$150,8,FALSE))) ->  | J16: =VLOOKUP($A16,'[CLASSIFICA FITZ CUP 2012 3.xls]Iscrizioni'!$A$4:$L$150,6,FALSE) -> 1145 | K16: =IF(ISBLANK(A16),"",TRIM(VLOOKUP($A16,'[CLASSIFICA FITZ CUP 2012 3.xls]Iscrizioni'!$A$4:$L$150,10,FALSE))) -> CDDF
A17: 32 | B17: 0.68825231481481486 | C17: =IF(ISBLANK(B17),"",B17-$F$1) -> 0.14658564814814823 | D17: =IF(ISNA(J17),"",C17*1000/J17) -> 0.13510197986004446 | E17: =IF(ISBLANK(A17),"",RANK(C17,$C$4:$C$40,1)) -> 10 | F17: =IF(ISNA(J17),"",RANK(D17,$D$4:$D$40,1)) -> 14 | G17: =IF(ISBLANK(A17),"",VLOOKUP($A17,'[CLASSIFICA FITZ CUP 2012 3.xls]Iscrizioni'!$A$4:$L$150,5,FALSE)) -> Laser std | H17: =IF(ISBLANK(A17),"",VLOOKUP($A17,'[CLASSIFICA FITZ CUP 2012 3.xls]Iscrizioni'!$A$4:$L$150,7,FALSE)) -> Prudenziati Andrea | I17: =IF(ISBLANK(A17),"",TRIM(VLOOKUP($A17,'[CLASSIFICA FITZ CUP 2012 3.xls]Iscrizioni'!$A$4:$L$150,8,FALSE))) ->  | J17: =VLOOKUP($A17,'[CLASSIFICA FITZ CUP 2012 3.xls]Iscrizioni'!$A$4:$L$150,6,FALSE) -> 1085 | K17: =IF(ISBLANK(A17),"",TRIM(VLOOKUP($A17,'[CLASSIFICA FITZ CUP 2012 3.xls]Iscrizioni'!$A$4:$L$150,10,FALSE))) -> Vela Lago Caldaro
A18: 30 | B18: 0.68825231481481486 | C18: =IF(ISBLANK(B18),"",B18-$F$1) -> 0.14658564814814823 | D18: 0.13510416666666666 | E18: =IF(ISBLANK(A18),"",RANK(C18,$C$4:$C$40,1)) -> 10 | F18: 14 | G18: Laser std. | H18: Bolis Ezio | J18: 1085 | K18: VC Campione
A19: 5 | B19: 0.68843750000000004 | C19: =IF(ISBLANK(B19),"",B19-$F$1) -> 0.14677083333333341 | D19: =IF(ISNA(J19),"",C19*1000/J19) -> 0.13527265745007686 | E19: =IF(ISBLANK(A19),"",RANK(C19,$C$4:$C$40,1)) -> 12 | F19: =IF(ISNA(J19),"",RANK(D19,$D$4:$D$40,1)) -> 16 | G19: =IF(ISBLANK(A19),"",VLOOKUP($A19,'[CLASSIFICA FITZ CUP 2012 3.xls]Iscrizioni'!$A$4:$L$150,5,FALSE)) -> Laser std | H19: =IF(ISBLANK(A19),"",VLOOKUP($A19,'[CLASSIFICA FITZ CUP 2012 3.xls]Iscrizioni'!$A$4:$L$150,7,FALSE)) -> Macchi Guido Pierluigi | I19: =IF(ISBLANK(A19),"",TRIM(VLOOKUP($A19,'[CLASSIFICA FITZ CUP 2012 3.xls]Iscrizioni'!$A$4:$L$150,8,FALSE))) ->  | J19: =VLOOKUP($A19,'[CLASSIFICA FITZ CUP 2012 3.xls]Iscrizioni'!$A$4:$L$150,6,FALSE) -> 1085 | K19: =IF(ISBLANK(A19),"",TRIM(VLOOKUP($A19,'[CLASSIFICA FITZ CUP 2012 3.xls]Iscrizioni'!$A$4:$L$150,10,FALSE))) -> ANS
A20: 34 | B20: 0.70753472222222225 | C20: =IF(ISBLANK(B20),"",B20-$F$1) -> 0.16586805555555562 | D20: =IF(ISNA(J20),"",C20*1000/J20) -> 0.13618066958584205 | E20: =IF(ISBLANK(A20),"",RANK(C20,$C$4:$C$40,1)) -> 32 | F20: =IF(ISNA(J20),"",RANK(D20,$D$4:$D$40,1)) -> 17 | G20: =IF(ISBLANK(A20),"",VLOOKUP($A20,'[CLASSIFICA FITZ CUP 2012 3.xls]Iscrizioni'!$A$4:$L$150,5,FALSE)) -> Topaz uno race plus | H20: =IF(ISBLANK(A20),"",VLOOKUP($A20,'[CLASSIFICA FITZ CUP 2012 3.xls]Iscrizioni'!$A$4:$L$150,7,FALSE)) -> Lauria Antonino | I20: =IF(ISBLANK(A20),"",TRIM(VLOOKUP($A20,'[CLASSIFICA FITZ CUP 2012 3.xls]Iscrizioni'!$A$4:$L$150,8,FALSE))) ->  | J20: =VLOOKUP($A20,'[CLASSIFICA FITZ CUP 2012 3.xls]Iscrizioni'!$A$4:$L$150,6,FALSE) -> 1218 | K20: =IF(ISBLANK(A20),"",TRIM(VLOOKUP($A20,'[CLASSIFICA FITZ CUP 2012 3.xls]Iscrizioni'!$A$4:$L$150,10,FALSE))) -> CDDF
A21: 27 | B21: 0.68998842592592602 | C21: =IF(ISBLANK(B21),"",B21-$F$1) -> 0.14832175925925939 | D21: =IF(ISNA(J21),"",C21*1000/J21) -> 0.1367020822665985 | E21: =IF(ISBLANK(A21),"",RANK(C21,$C$4:$C$40,1)) -> 15 | F21: =IF(ISNA(J21),"",RANK(D21,$D$4:$D$40,1)) -> 18 | G21: =IF(ISBLANK(A21),"",VLOOKUP($A21,'[CLASSIFICA FITZ CUP 2012 3.xls]Iscrizioni'!$A$4:$L$150,5,FALSE)) -> Laser std | H21: =IF(ISBLANK(A21),"",VLOOKUP($A21,'[CLASSIFICA FITZ CUP 2012 3.xls]Iscrizioni'!$A$4:$L$150,7,FALSE)) -> Bergamaschi Paolo | I21: =IF(ISBLANK(A21),"",TRIM(VLOOKUP($A21,'[CLASSIFICA FITZ CUP 2012 3.xls]Iscrizioni'!$A$4:$L$150,8,FALSE))) ->  | J21: =VLOOKUP($A21,'[CLASSIFICA FITZ CUP 2012 3.xls]Iscrizioni'!$A$4:$L$150,6,FALSE) -> 1085 | K21: =IF(ISBLANK(A21),"",TRIM(VLOOKUP($A21,'[CLASSIFICA FITZ CUP 2012 3.xls]Iscrizioni'!$A$4:$L$150,10,FALSE))) -> C.Canottieri
A22: 19 | B22: 0.70366898148148149 | C22: =IF(ISBLANK(B22),"",B22-$F$1) -> 0.16200231481481486 | D22: =IF(ISNA(J22),"",C22*1000/J22) -> 0.13787431048069351 | E22: =IF(ISBLANK(A22),"",RANK(C22,$C$4:$C$40,1)) -> 29 | F22: =IF(ISNA(J22),"",RANK(D22,$D$4:$D$40,1)) -> 19 | G22: =IF(ISBLANK(A22),"",VLOOKUP($A22,'[CLASSIFICA FITZ CUP 2012 3.xls]Iscrizioni'!$A$4:$L$150,5,FALSE)) -> Laser 4.7 | H22: =IF(ISBLANK(A22),"",VLOOKUP($A22,'[CLASSIFICA FITZ CUP 2012 3.xls]Iscrizioni'!$A$4:$L$150,7,FALSE)) -> Magni Stefano | I22: =IF(ISBLANK(A22),"",TRIM(VLOOKUP($A22,'[CLASSIFICA FITZ CUP 2012 3.xls]Iscrizioni'!$A$4:$L$150,8,FALSE))) ->  | J22: =VLOOKUP($A22,'[CLASSIFICA FITZ CUP 2012 3.xls]Iscrizioni'!$A$4:$L$150,6,FALSE) -> 1175 | K22: =IF(ISBLANK(A22),"",TRIM(VLOOKUP($A22,'[CLASSIFICA FITZ CUP 2012 3.xls]Iscrizioni'!$A$4:$L$150,10,FALSE))) -> GDV LNI BS Desenzano
A23: 35 | B23: 0.69862268518518522 | C23: =IF(ISBLANK(B23),"",B23-$F$1) -> 0.15695601851851859 | D23: =IF(ISNA(J23),"",C23*1000/J23) -> 0.14064159365458656 | E23: =IF(ISBLANK(A23),"",RANK(C23,$C$4:$C$40,1)) -> 25 | F23: =IF(ISNA(J23),"",RANK(D23,$D$4:$D$40,1)) -> 20 | G23: =IF(ISBLANK(A23),"",VLOOKUP($A23,'[CLASSIFICA FITZ CUP 2012 3.xls]Iscrizioni'!$A$4:$L$150,5,FALSE)) -> FJ | H23: =IF(ISBLANK(A23),"",VLOOKUP($A23,'[CLASSIFICA FITZ CUP 2012 3.xls]Iscrizioni'!$A$4:$L$150,7,FALSE)) -> Tosatti Paolo | I23: =IF(ISBLANK(A23),"",TRIM(VLOOKUP($A23,'[CLASSIFICA FITZ CUP 2012 3.xls]Iscrizioni'!$A$4:$L$150,8,FALSE))) -> Olivieri Giuliano | J23: =VLOOKUP($A23,'[CLASSIFICA FITZ CUP 2012 3.xls]Iscrizioni'!$A$4:$L$150,6,FALSE) -> 1116 | K23: =IF(ISBLANK(A23),"",TRIM(VLOOKUP($A23,'[CLASSIFICA FITZ CUP 2012 3.xls]Iscrizioni'!$A$4:$L$150,10,FALSE))) -> CDDF
A24: 16 | B24: 0.69920138888888894 | C24: =IF(ISBLANK(B24),"",B24-$F$1) -> 0.15753472222222231 | D24: =IF(ISNA(J24),"",C24*1000/J24) -> 0.14116014536041427 | E24: =IF(ISBLANK(A24),"",RANK(C24,$C$4:$C$40,1)) -> 26 | F24: =IF(ISNA(J24),"",RANK(D24,$D$4:$D$40,1)) -> 21 | G24: =IF(ISBLANK(A24),"",VLOOKUP($A24,'[CLASSIFICA FITZ CUP 2012 3.xls]Iscrizioni'!$A$4:$L$150,5,FALSE)) -> FJ | H24: =IF(ISBLANK(A24),"",VLOOKUP($A24,'[CLASSIFICA FITZ CUP 2012 3.xls]Iscrizioni'!$A$4:$L$150,7,FALSE)) -> Franzoni Davide | I24: =IF(ISBLANK(A24),"",TRIM(VLOOKUP($A24,'[CLASSIFICA FITZ CUP 2012 3.xls]Iscrizioni'!$A$4:$L$150,8,FALSE))) -> Randi Alan | J24: =VLOOKUP($A24,'[CLASSIFICA FITZ CUP 2012 3.xls]Iscrizioni'!$A$4:$L$150,6,FALSE) -> 1116 | K24: =IF(ISBLANK(A24),"",TRIM(VLOOKUP($A24,'[CLASSIFICA FITZ CUP 2012 3.xls]Iscrizioni'!$A$4:$L$150,10,FALSE))) -> CDDF
A25: 20 | B25: 0.70810185185185182 | C25: =IF(ISBLANK(B25),"",B25-$F$1) -> 0.16643518518518519 | D25: =IF(ISNA(J25),"",C25*1000/J25) -> 0.14164696611505123 | E25: =IF(ISBLANK(A25),"",RANK(C25,$C$4:$C$40,1)) -> 33 | F25: =IF(ISNA(J25),"",RANK(D25,$D$4:$D$40,1)) -> 22 | G25: =IF(ISBLANK(A25),"",VLOOKUP($A25,'[CLASSIFICA FITZ CUP 2012 3.xls]Iscrizioni'!$A$4:$L$150,5,FALSE)) -> Laser 4.7 | H25: =IF(ISBLANK(A25),"",VLOOKUP($A25,'[CLASSIFICA FITZ CUP 2012 3.xls]Iscrizioni'!$A$4:$L$150,7,FALSE)) -> Magni Federico | I25: =IF(ISBLANK(A25),"",TRIM(VLOOKUP($A25,'[CLASSIFICA FITZ CUP 2012 3.xls]Iscrizioni'!$A$4:$L$150,8,FALSE))) ->  | J25: =VLOOKUP($A25,'[CLASSIFICA FITZ CUP 2012 3.xls]Iscrizioni'!$A$4:$L$150,6,FALSE) -> 1175 | K25: =IF(ISBLANK(A25),"",TRIM(VLOOKUP($A25,'[CLASSIFICA FITZ CUP 2012 3.xls]Iscrizioni'!$A$4:$L$150,10,FALSE))) -> GDV LNI BS Desenzano
A26: 3 | B26: 0.69641203703703702 | C26: =IF(ISBLANK(B26),"",B26-$F$1) -> 0.15474537037037039 | D26: =IF(ISNA(J26),"",C26*1000/J26) -> 0.14262246117084829 | E26: =IF(ISBLANK(A26),"",RANK(C26,$C$4:$C$40,1)) -> 21 | F26: =IF(ISNA(J26),"",RANK(D26,$D$4:$D$40,1)) -> 23 | G26: =IF(ISBLANK(A26),"",VLOOKUP($A26,'[CLASSIFICA FITZ CUP 2012 3.xls]Iscrizioni'!$A$4:$L$150,5,FALSE)) -> Laser std | H26: =IF(ISBLANK(A26),"",VLOOKUP($A26,'[CLASSIFICA FITZ CUP 2012 3.xls]Iscrizioni'!$A$4:$L$150,7,FALSE)) -> Maffeis Massimo | I26: =IF(ISBLANK(A26),"",TRIM(VLOOKUP($A26,'[CLASSIFICA FITZ CUP 2012 3.xls]Iscrizioni'!$A$4:$L$150,8,FALSE))) ->  | J26: =VLOOKUP($A26,'[CLASSIFICA FITZ CUP 2012 3.xls]Iscrizioni'!$A$4:$L$150,6,FALSE) -> 1085 | K26: =IF(ISBLANK(A26),"",TRIM(VLOOKUP($A26,'[CLASSIFICA FITZ CUP 2012 3.xls]Iscrizioni'!$A$4:$L$150,10,FALSE))) -> VC Campione
A27: 36 | B27: 0.68657407407407411 | C27: =IF(ISBLANK(B27),"",B27-$F$1) -> 0.14490740740740748 | D27: =IF(ISNA(J27),"",C27*1000/J27) -> 0.14375734861845979 | E27: =IF(ISBLANK(A27),"",RANK(C27,$C$4:$C$40,1)) -> 6 | F27: =IF(ISNA(J27),"",RANK(D27,$D$4:$D$40,1)) -> 24 | G27: =IF(ISBLANK(A27),"",VLOOKUP($A27,'[CLASSIFICA FITZ CUP 2012 3.xls]Iscrizioni'!$A$4:$L$150,5,FALSE)) -> RS 100 8.4 | H27: =IF(ISBLANK(A27),"",VLOOKUP($A27,'[CLASSIFICA FITZ CUP 2012 3.xls]Iscrizioni'!$A$4:$L$150,7,FALSE)) -> Zarantonello Fabrizio | I27: =IF(ISBLANK(A27),"",TRIM(VLOOKUP($A27,'[CLASSIFICA FITZ CUP 2012 3.xls]Iscrizioni'!$A$4:$L$150,8,FALSE))) ->  | J27: =VLOOKUP($A27,'[CLASSIFICA FITZ CUP 2012 3.xls]Iscrizioni'!$A$4:$L$150,6,FALSE) -> 1008 | K27: =IF(ISBLANK(A27),"",TRIM(VLOOKUP($A27,'[CLASSIFICA FITZ CUP 2012 3.xls]Iscrizioni'!$A$4:$L$150,10,FALSE))) -> LNI Vicenza
A28: 24 | B28: 0.67664351851851856 | C28: =IF(ISBLANK(B28),"",B28-$F$1) -> 0.13497685185185193 | D28: =IF(ISNA(J28),"",C28*1000/J28) -> 0.14576333893288546 | E28: =IF(ISBLANK(A28),"",RANK(C28,$C$4:$C$40,1)) -> 1 | F28: =IF(ISNA(J28),"",RANK(D28,$D$4:$D$40,1)) -> 25 | G28: =IF(ISBLANK(A28),"",VLOOKUP($A28,'[CLASSIFICA FITZ CUP 2012 3.xls]Iscrizioni'!$A$4:$L$150,5,FALSE)) -> ISO | H28: =IF(ISBLANK(A28),"",VLOOKUP($A28,'[CLASSIFICA FITZ CUP 2012 3.xls]Iscrizioni'!$A$4:$L$150,7,FALSE)) -> Clementi Marco | I28: =IF(ISBLANK(A28),"",TRIM(VLOOKUP($A28,'[CLASSIFICA FITZ CUP 2012 3.xls]Iscrizioni'!$A$4:$L$150,8,FALSE))) -> Slaviero Stefano | J28: =VLOOKUP($A28,'[CLASSIFICA FITZ CUP 2012 3.xls]Iscrizioni'!$A$4:$L$150,6,FALSE) -> 926 | K28: =IF(ISBLANK(A28),"",TRIM(VLOOKUP($A28,'[CLASSIFICA FITZ CUP 2012 3.xls]Iscrizioni'!$A$4:$L$150,10,FALSE))) -> YC Acquafresca
A29: 23 | B29: 0.67789351851851853 | C29: =IF(ISBLANK(B29),"",B29-$F$1) -> 0.1362268518518519 | D29: =IF(ISNA(J29),"",C29*1000/J29) -> 0.14711323094152473 | E29: =IF(ISBLANK(A29),"",RANK(C29,$C$4:$C$40,1)) -> 2 | F29: =IF(ISNA(J29),"",RANK(D29,$D$4:$D$40,1)) -> 26 | G29: =IF(ISBLANK(A29),"",VLOOKUP($A29,'[CLASSIFICA FITZ CUP 2012 3.xls]Iscrizioni'!$A$4:$L$150,5,FALSE)) -> ISO | H29: =IF(ISBLANK(A29),"",VLOOKUP($A29,'[CLASSIFICA FITZ CUP 2012 3.xls]Iscrizioni'!$A$4:$L$150,7,FALSE)) -> Dal Cortivo Edoardo | I29: =IF(ISBLANK(A29),"",TRIM(VLOOKUP($A29,'[CLASSIFICA FITZ CUP 2012 3.xls]Iscrizioni'!$A$4:$L$150,8,FALSE))) -> Zanetti Michele | J29: =VLOOKUP($A29,'[CLASSIFICA FITZ CUP 2012 3.xls]Iscrizioni'!$A$4:$L$150,6,FALSE) -> 926 | K29: =IF(ISBLANK(A29),"",TRIM(VLOOKUP($A29,'[CLASSIFICA FITZ CUP 2012 3.xls]Iscrizioni'!$A$4:$L$150,10,FALSE))) -> YC Aquafresca
A30: 1 | B30: 0.70815972222222223 | C30: =IF(ISBLANK(B30),"",B30-$F$1) -> 0.1664930555555556 | D30: =IF(ISNA(J30),"",C30*1000/J30) -> 0.14773119392684614 | E30: =IF(ISBLANK(A30),"",RANK(C30,$C$4:$C$40,1)) -> 34 | F30: =IF(ISNA(J30),"",RANK(D30,$D$4:$D$40,1)) -> 27 | G30: =IF(ISBLANK(A30),"",VLOOKUP($A30,'[CLASSIFICA FITZ CUP 2012 3.xls]Iscrizioni'!$A$4:$L$150,5,FALSE)) -> Sunfish/Alpa Skiff | H30: =IF(ISBLANK(A30),"",VLOOKUP($A30,'[CLASSIFICA FITZ CUP 2012 3.xls]Iscrizioni'!$A$4:$L$150,7,FALSE)) -> Beltrame Antonio | I30: =IF(ISBLANK(A30),"",TRIM(VLOOKUP($A30,'[CLASSIFICA FITZ CUP 2012 3.xls]Iscrizioni'!$A$4:$L$150,8,FALSE))) ->  | J30: =VLOOKUP($A30,'[CLASSIFICA FITZ CUP 2012 3.xls]Iscrizioni'!$A$4:$L$150,6,FALSE) -> 1127 | K30: =IF(ISBLANK(A30),"",TRIM(VLOOKUP($A30,'[CLASSIFICA FITZ CUP 2012 3.xls]Iscrizioni'!$A$4:$L$150,10,FALSE))) -> Vela Ispra
A31: 11 | B31: 0.70422453703703702 | C31: =IF(ISBLANK(B31),"",B31-$F$1) -> 0.16255787037037039 | D31: =IF(ISNA(J31),"",C31*1000/J31) -> 0.14954725885038672 | E31: =IF(ISBLANK(A31),"",RANK(C31,$C$4:$C$40,1)) -> 30 | F31: =IF(ISNA(J31),"",RANK(D31,$D$4:$D$40,1)) -> 28 | G31: =IF(ISBLANK(A31),"",VLOOKUP($A31,'[CLASSIFICA FITZ CUP 2012 3.xls]Iscrizioni'!$A$4:$L$150,5,FALSE)) -> 420 | H31: =IF(ISBLANK(A31),"",VLOOKUP($A31,'[CLASSIFICA FITZ CUP 2012 3.xls]Iscrizioni'!$A$4:$L$150,7,FALSE)) -> Nicoletti Salvatore | I31: =IF(ISBLANK(A31),"",TRIM(VLOOKUP($A31,'[CLASSIFICA FITZ CUP 2012 3.xls]Iscrizioni'!$A$4:$L$150,8,FALSE))) -> Greco Nunzio | J31: =VLOOKUP($A31,'[CLASSIFICA FITZ CUP 2012 3.xls]Iscrizioni'!$A$4:$L$150,6,FALSE) -> 1087 | K31: =IF(ISBLANK(A31),"",TRIM(VLOOKUP($A31,'[CLASSIFICA FITZ CUP 2012 3.xls]Iscrizioni'!$A$4:$L$150,10,FALSE))) -> CDDF
A32: 9 | B32: 0.6980439814814815 | C32: =IF(ISBLANK(B32),"",B32-$F$1) -> 0.15637731481481487 | D32: =IF(ISNA(J32),"",C32*1000/J32) -> 0.14964336345915299 | E32: =IF(ISBLANK(A32),"",RANK(C32,$C$4:$C$40,1)) -> 24 | F32: =IF(ISNA(J32),"",RANK(D32,$D$4:$D$40,1)) -> 29 | G32: =IF(ISBLANK(A32),"",VLOOKUP($A32,'[CLASSIFICA FITZ CUP 2012 3.xls]Iscrizioni'!$A$4:$L$150,5,FALSE)) -> RS Vareo | H32: =IF(ISBLANK(A32),"",VLOOKUP($A32,'[CLASSIFICA FITZ CUP 2012 3.xls]Iscrizioni'!$A$4:$L$150,7,FALSE)) -> Modena Umberto | I32: =IF(ISBLANK(A32),"",TRIM(VLOOKUP($A32,'[CLASSIFICA FITZ CUP 2012 3.xls]Iscrizioni'!$A$4:$L$150,8,FALSE))) ->  | J32: =VLOOKUP($A32,'[CLASSIFICA FITZ CUP 2012 3.xls]Iscrizioni'!$A$4:$L$150,6,FALSE) -> 1045 | K32: =IF(ISBLANK(A32),"",TRIM(VLOOKUP($A32,'[CLASSIFICA FITZ CUP 2012 3.xls]Iscrizioni'!$A$4:$L$150,10,FALSE))) -> GDV LNI BS Desenzano
A33: 10 | B33: 0.6880208333333333 | C33: =IF(ISBLANK(B33),"",B33-$F$1) -> 0.14635416666666667 | D33: =IF(ISNA(J33),"",C33*1000/J33) -> 0.15041538198013021 | E33: =IF(ISBLANK(A33),"",RANK(C33,$C$4:$C$40,1)) -> 9 | F33: =IF(ISNA(J33),"",RANK(D33,$D$4:$D$40,1)) -> 30 | G33: =IF(ISBLANK(A33),"",VLOOKUP($A33,'[CLASSIFICA FITZ CUP 2012 3.xls]Iscrizioni'!$A$4:$L$150,5,FALSE)) -> 470 | H33: =IF(ISBLANK(A33),"",VLOOKUP($A33,'[CLASSIFICA FITZ CUP 2012 3.xls]Iscrizioni'!$A$4:$L$150,7,FALSE)) -> Benetti Giancarlo | I33: =IF(ISBLANK(A33),"",TRIM(VLOOKUP($A33,'[CLASSIFICA FITZ CUP 2012 3.xls]Iscrizioni'!$A$4:$L$150,8,FALSE))) -> Pasini Andrea | J33: =VLOOKUP($A33,'[CLASSIFICA FITZ CUP 2012 3.xls]Iscrizioni'!$A$4:$L$150,6,FALSE) -> 973 | K33: =IF(ISBLANK(A33),"",TRIM(VLOOKUP($A33,'[CLASSIFICA FITZ CUP 2012 3.xls]Iscrizioni'!$A$4:$L$150,10,FALSE))) -> AVLC-SVKS
A34: 29 | B34: 0.70484953703703701 | C34: =IF(ISBLANK(B34),"",B34-$F$1) -> 0.16318287037037038 | D34: =IF(ISNA(J34),"",C34*1000/J34) -> 0.15081596152529611 | E34: =IF(ISBLANK(A34),"",RANK(C34,$C$4:$C$40,1)) -> 31 | F34: =IF(ISNA(J34),"",RANK(D34,$D$4:$D$40,1)) -> 31 | G34: =IF(ISBLANK(A34),"",VLOOKUP($A34,'[CLASSIFICA FITZ CUP 2012 3.xls]Iscrizioni'!$A$4:$L$150,5,FALSE)) -> Tridente 16 can | H34: =IF(ISBLANK(A34),"",VLOOKUP($A34,'[CLASSIFICA FITZ CUP 2012 3.xls]Iscrizioni'!$A$4:$L$150,7,FALSE)) -> Castelli Elena | I34: =IF(ISBLANK(A34),"",TRIM(VLOOKUP($A34,'[CLASSIFICA FITZ CUP 2012 3.xls]Iscrizioni'!$A$4:$L$150,8,FALSE))) -> Piero Svalduz, Luca Stivani | J34: =VLOOKUP($A34,'[CLASSIFICA FITZ CUP 2012 3.xls]Iscrizioni'!$A$4:$L$150,6,FALSE) -> 1082 | K34: =IF(ISBLANK(A34),"",TRIM(VLOOKUP($A34,'[CLASSIFICA FITZ CUP 2012 3.xls]Iscrizioni'!$A$4:$L$150,10,FALSE))) -> Veneto a Vela
A35: 22 | B35: 0.68931712962962965 | C35: =IF(ISBLANK(B35),"",B35-$F$1) -> 0.14765046296296302 | D35: =IF(ISNA(J35),"",C35*1000/J35) -> 0.15174764949944811 | E35: =IF(ISBLANK(A35),"",RANK(C35,$C$4:$C$40,1)) -> 13 | F35: =IF(ISNA(J35),"",RANK(D35,$D$4:$D$40,1)) -> 32 | G35: =IF(ISBLANK(A35),"",VLOOKUP($A35,'[CLASSIFICA FITZ CUP 2012 3.xls]Iscrizioni'!$A$4:$L$150,5,FALSE)) -> 470 | H35: =IF(ISBLANK(A35),"",VLOOKUP($A35,'[CLASSIFICA FITZ CUP 2012 3.xls]Iscrizioni'!$A$4:$L$150,7,FALSE)) -> Cecotto Massimiliano | I35: =IF(ISBLANK(A35),"",TRIM(VLOOKUP($A35,'[CLASSIFICA FITZ CUP 2012 3.xls]Iscrizioni'!$A$4:$L$150,8,FALSE))) -> Manfre Graziano | J35: =VLOOKUP($A35,'[CLASSIFICA FITZ CUP 2012 3.xls]Iscrizioni'!$A$4:$L$150,6,FALSE) -> 973 | K35: =IF(ISBLANK(A35),"",TRIM(VLOOKUP($A35,'[CLASSIFICA FITZ CUP 2012 3.xls]Iscrizioni'!$A$4:$L$150,10,FALSE))) -> CNS Margherita
A36: 8 | B36: 0.69276620370370379 | C36: =IF(ISBLANK(B36),"",B36-$F$1) -> 0.15109953703703716 | D36: =IF(ISNA(J36),"",C36*1000/J36) -> 0.15216468986609985 | E36: =IF(ISBLANK(A36),"",RANK(C36,$C$4:$C$40,1)) -> 16 | F36: =IF(ISNA(J36),"",RANK(D36,$D$4:$D$40,1)) -> 33 | G36: =IF(ISBLANK(A36),"",VLOOKUP($A36,'[CLASSIFICA FITZ CUP 2012 3.xls]Iscrizioni'!$A$4:$L$150,5,FALSE)) -> Contender | H36: =IF(ISBLANK(A36),"",VLOOKUP($A36,'[CLASSIFICA FITZ CUP 2012 3.xls]Iscrizioni'!$A$4:$L$150,7,FALSE)) -> Borzani Steven | I36: =IF(ISBLANK(A36),"",TRIM(VLOOKUP($A36,'[CLASSIFICA FITZ CUP 2012 3.xls]Iscrizioni'!$A$4:$L$150,8,FALSE))) ->  | J36: =VLOOKUP($A36,'[CLASSIFICA FITZ CUP 2012 3.xls]Iscrizioni'!$A$4:$L$150,6,FALSE) -> 993 | K36: =IF(ISBLANK(A36),"",TRIM(VLOOKUP($A36,'[CLASSIFICA FITZ CUP 2012 3.xls]Iscrizioni'!$A$4:$L$150,10,FALSE))) -> FV Valdese
A37: 2 | B37: 0.703587962962963 | C37: =IF(ISBLANK(B37),"",B37-$F$1) -> 0.16192129629629637 | D37: =IF(ISNA(J37),"",C37*1000/J37) -> 0.15644569690463417 | E37: =IF(ISBLANK(A37),"",RANK(C37,$C$4:$C$40,1)) -> 28 | F37: =IF(ISNA(J37),"",RANK(D37,$D$4:$D$40,1)) -> 34 | G37: =IF(ISBLANK(A37),"",VLOOKUP($A37,'[CLASSIFICA FITZ CUP 2012 3.xls]Iscrizioni'!$A$4:$L$150,5,FALSE)) -> Laser 2 | H37: =IF(ISBLANK(A37),"",VLOOKUP($A37,'[CLASSIFICA FITZ CUP 2012 3.xls]Iscrizioni'!$A$4:$L$150,7,FALSE)) -> Rebecchi Vittorio | I37: =IF(ISBLANK(A37),"",TRIM(VLOOKUP($A37,'[CLASSIFICA FITZ CUP 2012 3.xls]Iscrizioni'!$A$4:$L$150,8,FALSE))) -> Bignotti Giorgio | J37: =VLOOKUP($A37,'[CLASSIFICA FITZ CUP 2012 3.xls]Iscrizioni'!$A$4:$L$150,6,FALSE) -> 1035 | K37: =IF(ISBLANK(A37),"",TRIM(VLOOKUP($A37,'[CLASSIFICA FITZ CUP 2012 3.xls]Iscrizioni'!$A$4:$L$150,10,FALSE))) -> GDV LNI BS Desenzano
A38: 37 | B38: 0.70821759259259265 | C38: =IF(ISBLANK(B38),"",B38-$F$1) -> 0.16655092592592602 | D38: =IF(ISNA(J38),"",C38*1000/J38) -> 0.16091876901055652 | E38: =IF(ISBLANK(A38),"",RANK(C38,$C$4:$C$40,1)) -> 35 | F38: =IF(ISNA(J38),"",RANK(D38,$D$4:$D$40,1)) -> 35 | G38: =IF(ISBLANK(A38),"",VLOOKUP($A38,'[CLASSIFICA FITZ CUP 2012 3.xls]Iscrizioni'!$A$4:$L$150,5,FALSE)) -> Laser 2 | H38: =IF(ISBLANK(A38),"",VLOOKUP($A38,'[CLASSIFICA FITZ CUP 2012 3.xls]Iscrizioni'!$A$4:$L$150,7,FALSE)) -> Fiorenzato Luigi | I38: =IF(ISBLANK(A38),"",TRIM(VLOOKUP($A38,'[CLASSIFICA FITZ CUP 2012 3.xls]Iscrizioni'!$A$4:$L$150,8,FALSE))) ->  | J38: =VLOOKUP($A38,'[CLASSIFICA FITZ CUP 2012 3.xls]Iscrizioni'!$A$4:$L$150,6,FALSE) -> 1035 | K38: =IF(ISBLANK(A38),"",TRIM(VLOOKUP($A38,'[CLASSIFICA FITZ CUP 2012 3.xls]Iscrizioni'!$A$4:$L$150,10,FALSE))) -> CDDF
A39: 7 | B39: 0.70833333333333337 | C39: =IF(ISBLANK(B39),"",B39-$F$1) -> 0.16666666666666674 | D39: =IF(ISNA(J39),"",C39*1000/J39) -> 0.16103059581320459 | E39: =IF(ISBLANK(A39),"",RANK(C39,$C$4:$C$40,1)) -> 36 | F39: =IF(ISNA(J39),"",RANK(D39,$D$4:$D$40,1)) -> 36 | G39: =IF(ISBLANK(A39),"",VLOOKUP($A39,'[CLASSIFICA FITZ CUP 2012 3.xls]Iscrizioni'!$A$4:$L$150,5,FALSE)) -> Laser 2 | H39: =IF(ISBLANK(A39),"",VLOOKUP($A39,'[CLASSIFICA FITZ CUP 2012 3.xls]Iscrizioni'!$A$4:$L$150,7,FALSE)) -> Demeo Giuseppe | I39: =IF(ISBLANK(A39),"",TRIM(VLOOKUP($A39,'[CLASSIFICA FITZ CUP 2012 3.xls]Iscrizioni'!$A$4:$L$150,8,FALSE))) -> Donzelli Oliver | J39: =VLOOKUP($A39,'[CLASSIFICA FITZ CUP 2012 3.xls]Iscrizioni'!$A$4:$L$150,6,FALSE) -> 1035 | K39: =IF(ISBLANK(A39),"",TRIM(VLOOKUP($A39,'[CLASSIFICA FITZ CUP 2012 3.xls]Iscrizioni'!$A$4:$L$150,10,FALSE))) -> CDDF
C40: =IF(ISBLANK(B40),"",B40-$F$1) ->  | D40: =IF(ISNA(J40),"",C40*1000/J40) ->  | E40: 37 | F40: DNF | G40: =IF(ISBLANK(A40),"",VLOOKUP($A40,'[CLASSIFICA FITZ CUP 2012 3.xls]Iscrizioni'!$A$4:$L$150,5,FALSE)) ->  | H40: Bolis Ezio | I40: =IF(ISBLANK(A40),"",TRIM(VLOOKUP($A40,'[CLASSIFICA FITZ CUP 2012 3.xls]Iscrizioni'!$A$4:$L$150,8,FALSE))) ->  | J40: =VLOOKUP($A40,'[CLASSIFICA FITZ CUP 2012 3.xls]Iscrizioni'!$A$4:$L$150,6,FALSE) -> #N/D | K40: =IF(ISBLANK(A40),"",TRIM(VLOOKUP($A40,'[CLASSIFICA FITZ CUP 2012 3.xls]Iscrizioni'!$A$4:$L$150,10,FALSE))) -> 