D3: 2° Trofeo Jack Holt
D5: classifica definitiva
A9: Timoniere | B9: Prodiere | C9: N° velico | D9: Classe | E9: I° prova | F9: Rating | G9: Tempi compensati | H9: Punteggio
A11: Zabrzewska M. | B11: Corbellari G. | C11: ITA 3124 | D11: Int.FJ | E11: 1.1354166666666667E-2 | F11: 1118 | G11: =E11/F11*1000 -> 1.0155784138342278E-2 | H11: 1
A12: Primon Stefano | C12: ITA 1 | D12: Laser STD | E12: 1.1342592592592593E-2 | F12: 1078 | G12: =E12/F12*1000 -> 1.0521885521885523E-2 | H12: 2
A13: Primon Cesare | C13: ITA 39164 | D13: Laser STD | E13: 1.1388888888888889E-2 | F13: 1078 | G13: =E13/F13*1000 -> 1.0564831993403422E-2 | H13: 3
A14: Barozzi Mauro | C14: ITA 178784 | D14: Laser STD | E14: 1.2094907407407407E-2 | F14: 1078 | G14: =E14/F14*1000 -> 1.1219765684051397E-2 | H14: 4
A15: Bolis Ezio | B15: Makovec F. | C15: ITA 2747 | D15: Int. FJ | E15: 1.3842592592592592E-2 | F15: 1118 | G15: =E15/F15*1000 -> 1.2381567614125753E-2 | H15: 5
A16: Signorelli Alberto | C16: ITA 185543 | D16: Laser Radial | E16: 1.4490740740740742E-2 | F16: 1101 | G16: =E16/F16*1000 -> 1.3161435731826286E-2 | H16: 6
A17: Cocca Secondo | B17: Frison F. | C17: ITA 3824 | D17: Int. FJ | E17: 1.6898148148148148E-2 | F17: 1118 | G17: =E17/F17*1000 -> 1.5114622672762208E-2 | H17: 7
A18: Candela Luigi | B18: Macchiavello A. | C18: Ita 2 | D18: Caravelle | E18: 1.9745370370370371E-2 | F18: 1200 | G18: =E18/F18*1000 -> 1.6454475308641976E-2 | H18: 8