A3: Campionato Sociale 2013
A5: Regata Maggio | B5: Regata Luglio | C5: Fitzcup | D5: tot. Punteggio | E5: Equipaggi | F5: Classifica
A6: 2 | B6: 1 | C6: 2 | D6: =A6+B6+C6 -> 5 | E6: Cassini Marcello | F6: 1
A7: 4 | B7: 6 | C7: 1 | D7: =A7+B7+C7 -> 11 | E7: Zabrzewska Magdalena | F7: 2
A8: 5 | B8: 2 | C8: 20 | D8: =A8+B8+C8 -> 27 | E8: Franzoni Davide//Randi Alan | F8: 3
A9: 6 | B9: 6 | C9: 24 | D9: =A9+B9+C9 -> 36 | E9: Benamati Anna//Bonadimani Laura | F9: 4
A10: 1 | B10: 6 | C10: 32 | D10: =A10+B10+C10 -> 39 | E10: Vicentini Carlo Albero | F10: 5
A11: 3 | B11: 6 | C11: 32 | D11: =A11+B11+C11 -> 41 | E11: Baciga Stefano | F11: 6
A12: 8 | B12: 3 | C12: 32 | D12: =A12+B12+C12 -> 43 | E12: Pellegrini Mirko//Verzini Giulio | F12: 7
A13: 9 | B13: 4 | C13: 32 | D13: =A13+B13+C13 -> 45 | E13: Fiorenzato Luigi e Agnese | F13: 8
A14: 10 | B14: 6 | C14: 32 | D14: =A14+B14+C14 -> 48 | E14: Olivieri Giuliano//Tosatt Paolo | F14: 9
A16: in rosso = non partiti + 1