F2: CLASSIFICA PER CLASSE
A3: N iscrizione | B3: Ora arrivo | C3: Tempo reale | D3: Tempo compensato | E3: Posizione Assoluta | F3: Posizione compensato | G3: Classe | H3: Skipper | I3: Prodiere | J3: YS | K3: Circolo Velico | L3: Cellulare | M3: Classe da premiare
A4: =IF(ISERROR(SMALL('[CLASSIFICA FITZ CUP 2012 3.xls]class.assoluta'!$P$4:$P$150,ROW(A4)-ROW($A$3))),"",INDEX('[CLASSIFICA FITZ CUP 2012 3.xls]class.assoluta'!$A$4:$A$150,MATCH(SMALL('[CLASSIFICA FITZ CUP 2012 3.xls]class.assoluta'!$P$4:$P$150,ROW(A4)-ROW($A$3)),'[CLASSIFICA FITZ CUP 2012 3.xls]class.assoluta'!$P$4:$P$150,0))) -> 14 | B4: =IF($A4="","",VLOOKUP($A4,'[CLASSIFICA FITZ CUP 2012 3.xls]class.assoluta'!$A$4:$N$150,2,FALSE)) -> 0.6788657407407408 | C4: =IF($A4="","",VLOOKUP($A4,'[CLASSIFICA FITZ CUP 2012 3.xls]class.assoluta'!$A$4:$N$150,3,FALSE)) -> 0.13719907407407417 | D4: =IF($A4="","",VLOOKUP($A4,'[CLASSIFICA FITZ CUP 2012 3.xls]class.assoluta'!$A$4:$N$150,4,FALSE)) -> 0.12645075951527573 | E4: =IF($A4="","",VLOOKUP($A4,'[CLASSIFICA FITZ CUP 2012 3.xls]class.assoluta'!$A$4:$N$150,5,FALSE)) -> 3 | F4: =IF($A4="","",VLOOKUP($A4,'[CLASSIFICA FITZ CUP 2012 3.xls]class.assoluta'!$A$4:$N$150,6,FALSE)) -> 2 | G4: =IF($A4="","",VLOOKUP($A4,'[CLASSIFICA FITZ CUP 2012 3.xls]class.assoluta'!$A$4:$N$150,7,FALSE)) -> Laser std | H4: =IF($A4="","",VLOOKUP($A4,'[CLASSIFICA FITZ CUP 2012 3.xls]class.assoluta'!$A$4:$N$150,8,FALSE)) -> Barozzi Mauro | I4: =IF($A4="","",VLOOKUP($A4,'[CLASSIFICA FITZ CUP 2012 3.xls]class.assoluta'!$A$4:$N$150,9,FALSE)) -> 0 | J4: =IF($A4="","",VLOOKUP($A4,'[CLASSIFICA FITZ CUP 2012 3.xls]class.assoluta'!$A$4:$N$150,10,FALSE)) -> 1085 | K4: =IF($A4="","",VLOOKUP($A4,'[CLASSIFICA FITZ CUP 2012 3.xls]class.assoluta'!$A$4:$N$150,11,FALSE)) -> CDDF | L4: =IF($A4="","",VLOOKUP($A4,'[CLASSIFICA FITZ CUP 2012 3.xls]class.assoluta'!$A$4:$N$150,12,FALSE)) -> 0 | M4: =IF(COUNTIF($G$4:$G$151,G4)>=5,G4,"") -> Laser std
A5: =IF(ISERROR(SMALL('[CLASSIFICA FITZ CUP 2012 3.xls]class.assoluta'!$P$4:$P$150,ROW(A5)-ROW($A$3))),"",INDEX('[CLASSIFICA FITZ CUP 2012 3.xls]class.assoluta'!$A$4:$A$150,MATCH(SMALL('[CLASSIFICA FITZ CUP 2012 3.xls]class.assoluta'!$P$4:$P$150,ROW(A5)-ROW($A$3)),'[CLASSIFICA FITZ CUP 2012 3.xls]class.assoluta'!$P$4:$P$150,0))) -> 15 | B5: =IF($A5="","",VLOOKUP($A5,'[CLASSIFICA FITZ CUP 2012 3.xls]class.assoluta'!$A$4:$N$150,2,FALSE)) -> 0.68167824074074079 | C5: =IF($A5="","",VLOOKUP($A5,'[CLASSIFICA FITZ CUP 2012 3.xls]class.assoluta'!$A$4:$N$150,3,FALSE)) -> 0.14001157407407416 | D5: =IF($A5="","",VLOOKUP($A5,'[CLASSIFICA FITZ CUP 2012 3.xls]class.assoluta'!$A$4:$N$150,4,FALSE)) -> 0.12904292541389323 | E5: =IF($A5="","",VLOOKUP($A5,'[CLASSIFICA FITZ CUP 2012 3.xls]class.assoluta'!$A$4:$N$150,5,FALSE)) -> 4 | F5: =IF($A5="","",VLOOKUP($A5,'[CLASSIFICA FITZ CUP 2012 3.xls]class.assoluta'!$A$4:$N$150,6,FALSE)) -> 4 | G5: =IF($A5="","",VLOOKUP($A5,'[CLASSIFICA FITZ CUP 2012 3.xls]class.assoluta'!$A$4:$N$150,7,FALSE)) -> Laser std | H5: =IF($A5="","",VLOOKUP($A5,'[CLASSIFICA FITZ CUP 2012 3.xls]class.assoluta'!$A$4:$N$150,8,FALSE)) -> Cassini Marcello | I5: =IF($A5="","",VLOOKUP($A5,'[CLASSIFICA FITZ CUP 2012 3.xls]class.assoluta'!$A$4:$N$150,9,FALSE)) ->  | J5: =IF($A5="","",VLOOKUP($A5,'[CLASSIFICA FITZ CUP 2012 3.xls]class.assoluta'!$A$4:$N$150,10,FALSE)) -> 1085 | K5: =IF($A5="","",VLOOKUP($A5,'[CLASSIFICA FITZ CUP 2012 3.xls]class.assoluta'!$A$4:$N$150,11,FALSE)) -> CDDF | L5: =IF($A5="","",VLOOKUP($A5,'[CLASSIFICA FITZ CUP 2012 3.xls]class.assoluta'!$A$4:$N$150,12,FALSE)) -> 0 | M5: =IF(COUNTIF($G$4:$G$151,G5)>=5,G5,"") -> Laser std
A6: =IF(ISERROR(SMALL('[CLASSIFICA FITZ CUP 2012 3.xls]class.assoluta'!$P$4:$P$150,ROW(A6)-ROW($A$3))),"",INDEX('[CLASSIFICA FITZ CUP 2012 3.xls]class.assoluta'!$A$4:$A$150,MATCH(SMALL('[CLASSIFICA FITZ CUP 2012 3.xls]class.assoluta'!$P$4:$P$150,ROW(A6)-ROW($A$3)),'[CLASSIFICA FITZ CUP 2012 3.xls]class.assoluta'!$P$4:$P$150,0))) -> 18 | B6: =IF($A6="","",VLOOKUP($A6,'[CLASSIFICA FITZ CUP 2012 3.xls]class.assoluta'!$A$4:$N$150,2,FALSE)) -> 0.68405092592592587 | C6: =IF($A6="","",VLOOKUP($A6,'[CLASSIFICA FITZ CUP 2012 3.xls]class.assoluta'!$A$4:$N$150,3,FALSE)) -> 0.14238425925925924 | D6: =IF($A6="","",VLOOKUP($A6,'[CLASSIFICA FITZ CUP 2012 3.xls]class.assoluta'!$A$4:$N$150,4,FALSE)) -> 0.13122973203618363 | E6: =IF($A6="","",VLOOKUP($A6,'[CLASSIFICA FITZ CUP 2012 3.xls]class.assoluta'!$A$4:$N$150,5,FALSE)) -> 5 | F6: =IF($A6="","",VLOOKUP($A6,'[CLASSIFICA FITZ CUP 2012 3.xls]class.assoluta'!$A$4:$N$150,6,FALSE)) -> 8 | G6: =IF($A6="","",VLOOKUP($A6,'[CLASSIFICA FITZ CUP 2012 3.xls]class.assoluta'!$A$4:$N$150,7,FALSE)) -> Laser std | H6: =IF($A6="","",VLOOKUP($A6,'[CLASSIFICA FITZ CUP 2012 3.xls]class.assoluta'!$A$4:$N$150,8,FALSE)) -> Gasparini Alessandro | I6: =IF($A6="","",VLOOKUP($A6,'[CLASSIFICA FITZ CUP 2012 3.xls]class.assoluta'!$A$4:$N$150,9,FALSE)) ->  | J6: =IF($A6="","",VLOOKUP($A6,'[CLASSIFICA FITZ CUP 2012 3.xls]class.assoluta'!$A$4:$N$150,10,FALSE)) -> 1085 | K6: =IF($A6="","",VLOOKUP($A6,'[CLASSIFICA FITZ CUP 2012 3.xls]class.assoluta'!$A$4:$N$150,11,FALSE)) -> LNI Belluno | L6: =IF($A6="","",VLOOKUP($A6,'[CLASSIFICA FITZ CUP 2012 3.xls]class.assoluta'!$A$4:$N$150,12,FALSE)) -> 0 | M6: =IF(COUNTIF($G$4:$G$151,G6)>=5,G6,"") -> Laser std
A7: =IF(ISERROR(SMALL('[CLASSIFICA FITZ CUP 2012 3.xls]class.assoluta'!$P$4:$P$150,ROW(A7)-ROW($A$3))),"",INDEX('[CLASSIFICA FITZ CUP 2012 3.xls]class.assoluta'!$A$4:$A$150,MATCH(SMALL('[CLASSIFICA FITZ CUP 2012 3.xls]class.assoluta'!$P$4:$P$150,ROW(A7)-ROW($A$3)),'[CLASSIFICA FITZ CUP 2012 3.xls]class.assoluta'!$P$4:$P$150,0))) -> 31 | B7: =IF($A7="","",VLOOKUP($A7,'[CLASSIFICA FITZ CUP 2012 3.xls]class.assoluta'!$A$4:$N$150,2,FALSE)) -> 0.68668981481481473 | C7: =IF($A7="","",VLOOKUP($A7,'[CLASSIFICA FITZ CUP 2012 3.xls]class.assoluta'!$A$4:$N$150,3,FALSE)) -> 0.1450231481481481 | D7: =IF($A7="","",VLOOKUP($A7,'[CLASSIFICA FITZ CUP 2012 3.xls]class.assoluta'!$A$4:$N$150,4,FALSE)) -> 0.13366188769414572 | E7: =IF($A7="","",VLOOKUP($A7,'[CLASSIFICA FITZ CUP 2012 3.xls]class.assoluta'!$A$4:$N$150,5,FALSE)) -> 7 | F7: =IF($A7="","",VLOOKUP($A7,'[CLASSIFICA FITZ CUP 2012 3.xls]class.assoluta'!$A$4:$N$150,6,FALSE)) -> 11 | G7: =IF($A7="","",VLOOKUP($A7,'[CLASSIFICA FITZ CUP 2012 3.xls]class.assoluta'!$A$4:$N$150,7,FALSE)) -> Laser std | H7: =IF($A7="","",VLOOKUP($A7,'[CLASSIFICA FITZ CUP 2012 3.xls]class.assoluta'!$A$4:$N$150,8,FALSE)) -> Cattelani Andrea | I7: =IF($A7="","",VLOOKUP($A7,'[CLASSIFICA FITZ CUP 2012 3.xls]class.assoluta'!$A$4:$N$150,9,FALSE)) ->  | J7: =IF($A7="","",VLOOKUP($A7,'[CLASSIFICA FITZ CUP 2012 3.xls]class.assoluta'!$A$4:$N$150,10,FALSE)) -> 1085 | K7: =IF($A7="","",VLOOKUP($A7,'[CLASSIFICA FITZ CUP 2012 3.xls]class.assoluta'!$A$4:$N$150,11,FALSE)) -> CDDF | L7: =IF($A7="","",VLOOKUP($A7,'[CLASSIFICA FITZ CUP 2012 3.xls]class.assoluta'!$A$4:$N$150,12,FALSE)) -> 0 | M7: =IF(COUNTIF($G$4:$G$151,G7)>=5,G7,"") -> Laser std
A8: =IF(ISERROR(SMALL('[CLASSIFICA FITZ CUP 2012 3.xls]class.assoluta'!$P$4:$P$150,ROW(A8)-ROW($A$3))),"",INDEX('[CLASSIFICA FITZ CUP 2012 3.xls]class.assoluta'!$A$4:$A$150,MATCH(SMALL('[CLASSIFICA FITZ CUP 2012 3.xls]class.assoluta'!$P$4:$P$150,ROW(A8)-ROW($A$3)),'[CLASSIFICA FITZ CUP 2012 3.xls]class.assoluta'!$P$4:$P$150,0))) -> 32 | B8: =IF($A8="","",VLOOKUP($A8,'[CLASSIFICA FITZ CUP 2012 3.xls]class.assoluta'!$A$4:$N$150,2,FALSE)) -> 0.68825231481481486 | C8: =IF($A8="","",VLOOKUP($A8,'[CLASSIFICA FITZ CUP 2012 3.xls]class.assoluta'!$A$4:$N$150,3,FALSE)) -> 0.14658564814814823 | D8: =IF($A8="","",VLOOKUP($A8,'[CLASSIFICA FITZ CUP 2012 3.xls]class.assoluta'!$A$4:$N$150,4,FALSE)) -> 0.13510197986004446 | E8: =IF($A8="","",VLOOKUP($A8,'[CLASSIFICA FITZ CUP 2012 3.xls]class.assoluta'!$A$4:$N$150,5,FALSE)) -> 10 | F8: =IF($A8="","",VLOOKUP($A8,'[CLASSIFICA FITZ CUP 2012 3.xls]class.assoluta'!$A$4:$N$150,6,FALSE)) -> 14 | G8: =IF($A8="","",VLOOKUP($A8,'[CLASSIFICA FITZ CUP 2012 3.xls]class.assoluta'!$A$4:$N$150,7,FALSE)) -> Laser std | H8: =IF($A8="","",VLOOKUP($A8,'[CLASSIFICA FITZ CUP 2012 3.xls]class.assoluta'!$A$4:$N$150,8,FALSE)) -> Prudenziati Andrea | I8: =IF($A8="","",VLOOKUP($A8,'[CLASSIFICA FITZ CUP 2012 3.xls]class.assoluta'!$A$4:$N$150,9,FALSE)) ->  | J8: =IF($A8="","",VLOOKUP($A8,'[CLASSIFICA FITZ CUP 2012 3.xls]class.assoluta'!$A$4:$N$150,10,FALSE)) -> 1085 | K8: =IF($A8="","",VLOOKUP($A8,'[CLASSIFICA FITZ CUP 2012 3.xls]class.assoluta'!$A$4:$N$150,11,FALSE)) -> Vela Lago Caldaro | L8: =IF($A8="","",VLOOKUP($A8,'[CLASSIFICA FITZ CUP 2012 3.xls]class.assoluta'!$A$4:$N$150,12,FALSE)) -> 0 | M8: =IF(COUNTIF($G$4:$G$151,G8)>=5,G8,"") -> Laser std
A9: 30 | B9: 0.68825231481481486 | C9: 0.14658564814814815 | D9: 0.13510416666666666 | E9: 10 | F9: 14 | G9: Laser std | H9: Bolis Ezio | J9: 1085 | K9: VC Campione | M9: Laser std
A10: =IF(ISERROR(SMALL('[CLASSIFICA FITZ CUP 2012 3.xls]class.assoluta'!$P$4:$P$150,ROW(A10)-ROW($A$3))),"",INDEX('[CLASSIFICA FITZ CUP 2012 3.xls]class.assoluta'!$A$4:$A$150,MATCH(SMALL('[CLASSIFICA FITZ CUP 2012 3.xls]class.assoluta'!$P$4:$P$150,ROW(A10)-ROW($A$3)),'[CLASSIFICA FITZ CUP 2012 3.xls]class.assoluta'!$P$4:$P$150,0))) -> 27 | B10: =IF($A10="","",VLOOKUP($A10,'[CLASSIFICA FITZ CUP 2012 3.xls]class.assoluta'!$A$4:$N$150,2,FALSE)) -> 0.68998842592592602 | C10: =IF($A10="","",VLOOKUP($A10,'[CLASSIFICA FITZ CUP 2012 3.xls]class.assoluta'!$A$4:$N$150,3,FALSE)) -> 0.14832175925925939 | D10: =IF($A10="","",VLOOKUP($A10,'[CLASSIFICA FITZ CUP 2012 3.xls]class.assoluta'!$A$4:$N$150,4,FALSE)) -> 0.1367020822665985 | E10: =IF($A10="","",VLOOKUP($A10,'[CLASSIFICA FITZ CUP 2012 3.xls]class.assoluta'!$A$4:$N$150,5,FALSE)) -> 15 | F10: =IF($A10="","",VLOOKUP($A10,'[CLASSIFICA FITZ CUP 2012 3.xls]class.assoluta'!$A$4:$N$150,6,FALSE)) -> 17 | G10: =IF($A10="","",VLOOKUP($A10,'[CLASSIFICA FITZ CUP 2012 3.xls]class.assoluta'!$A$4:$N$150,7,FALSE)) -> Laser std | H10: =IF($A10="","",VLOOKUP($A10,'[CLASSIFICA FITZ CUP 2012 3.xls]class.assoluta'!$A$4:$N$150,8,FALSE)) -> Bergamaschi Paolo | I10: =IF($A10="","",VLOOKUP($A10,'[CLASSIFICA FITZ CUP 2012 3.xls]class.assoluta'!$A$4:$N$150,9,FALSE)) ->  | J10: =IF($A10="","",VLOOKUP($A10,'[CLASSIFICA FITZ CUP 2012 3.xls]class.assoluta'!$A$4:$N$150,10,FALSE)) -> 1085 | K10: =IF($A10="","",VLOOKUP($A10,'[CLASSIFICA FITZ CUP 2012 3.xls]class.assoluta'!$A$4:$N$150,11,FALSE)) -> C.Canottieri | L10: =IF($A10="","",VLOOKUP($A10,'[CLASSIFICA FITZ CUP 2012 3.xls]class.assoluta'!$A$4:$N$150,12,FALSE)) -> 0 | M10: =IF(COUNTIF($G$4:$G$151,G10)>=5,G10,"") -> Laser std
A11: =IF(ISERROR(SMALL('[CLASSIFICA FITZ CUP 2012 3.xls]class.assoluta'!$P$4:$P$150,ROW(A11)-ROW($A$3))),"",INDEX('[CLASSIFICA FITZ CUP 2012 3.xls]class.assoluta'!$A$4:$A$150,MATCH(SMALL('[CLASSIFICA FITZ CUP 2012 3.xls]class.assoluta'!$P$4:$P$150,ROW(A11)-ROW($A$3)),'[CLASSIFICA FITZ CUP 2012 3.xls]class.assoluta'!$P$4:$P$150,0))) -> 3 | B11: =IF($A11="","",VLOOKUP($A11,'[CLASSIFICA FITZ CUP 2012 3.xls]class.assoluta'!$A$4:$N$150,2,FALSE)) -> 0.69641203703703702 | C11: =IF($A11="","",VLOOKUP($A11,'[CLASSIFICA FITZ CUP 2012 3.xls]class.assoluta'!$A$4:$N$150,3,FALSE)) -> 0.15474537037037039 | D11: =IF($A11="","",VLOOKUP($A11,'[CLASSIFICA FITZ CUP 2012 3.xls]class.assoluta'!$A$4:$N$150,4,FALSE)) -> 0.14262246117084829 | E11: =IF($A11="","",VLOOKUP($A11,'[CLASSIFICA FITZ CUP 2012 3.xls]class.assoluta'!$A$4:$N$150,5,FALSE)) -> 21 | F11: =IF($A11="","",VLOOKUP($A11,'[CLASSIFICA FITZ CUP 2012 3.xls]class.assoluta'!$A$4:$N$150,6,FALSE)) -> 22 | G11: =IF($A11="","",VLOOKUP($A11,'[CLASSIFICA FITZ CUP 2012 3.xls]class.assoluta'!$A$4:$N$150,7,FALSE)) -> Laser std | H11: =IF($A11="","",VLOOKUP($A11,'[CLASSIFICA FITZ CUP 2012 3.xls]class.assoluta'!$A$4:$N$150,8,FALSE)) -> Maffeis Massimo | I11: =IF($A11="","",VLOOKUP($A11,'[CLASSIFICA FITZ CUP 2012 3.xls]class.assoluta'!$A$4:$N$150,9,FALSE)) ->  | J11: =IF($A11="","",VLOOKUP($A11,'[CLASSIFICA FITZ CUP 2012 3.xls]class.assoluta'!$A$4:$N$150,10,FALSE)) -> 1085 | K11: =IF($A11="","",VLOOKUP($A11,'[CLASSIFICA FITZ CUP 2012 3.xls]class.assoluta'!$A$4:$N$150,11,FALSE)) -> VC Campione | L11: =IF($A11="","",VLOOKUP($A11,'[CLASSIFICA FITZ CUP 2012 3.xls]class.assoluta'!$A$4:$N$150,12,FALSE)) -> 0 | M11: =IF(COUNTIF($G$4:$G$151,G11)>=5,G11,"") -> Laser std